"","speaker","title","msg"
"99","Ben Reitzes","Analyst at Melius Research","Hey, thanks a lot for sneaking me in there. Congratulations, Jayshree and team. I wanted to ask about enterprise again. I think the comments you made around cloud titans were all things that people were able to detect, but the enterprise, it seems so much better in terms of the performance and the guide. So, you mentioned that you gained share, but did the market pick up as well? And did you -- do you see that market pickup in demand in the enterprise sustaining into '24? And just kind of more color around enterprise and whether the market picked up in addition to you gaining share."
"100","Jayshree V. Ullal","President and Chief Executive Officer at Arista Networks","Hey, Ben. Thank you. What do you mean by the market pickup? I don't follow the question."
"101","Ben Reitzes","Analyst at Melius Research","Did demand pick up, because the enterprise outperformance was quite a surprise, and clearly, the cloud titan commentary was subdued as everybody was able to predict after the last conference calls this week. So, I mean, was it all market share or is the market picking up? Is demand picking up across the board?"
"102","Jayshree V. Ullal","President and Chief Executive Officer at Arista Networks","I would say to you that probably our enterprise demand has always been strong and not subdued, far from that, however, dwarfed by the excellence of our cloud performance. You didn't notice it and now you're noticing it."
"103","Liz Stine","Director, Investor Relations at Arista Networks","Thanks Ben. This concludes the Arista Second Quarter 2023 Earnings Call. We have posted a presentation which provides additional information on our results, which you can access on our Investors section of our website.

Thank you for joining us today and thank you for your interest in Arista."
"104","Operator",NA,"[Operator Closing Remarks]"
