"","speaker","title","msg"
"82","Seifi Ghasemi","Chairman, President and Chief Executive Officer at Air Products and Chemicals","Very good, Jeff. With respect to comparison, you are comparing us to a company which has a different strategy and a different -- so I don't want to comment on their results. You are comparing year-to-year because last year, our pricing was significantly better than the other people. So year-to-year, we are not going to show as much as an increase, because if they had a very low performance last year, this year, year-to-year, it looks better.

I think that is the main reason for the price increase. And so that is my general comment on that. But overall, we are very much focused on being a green energy growth company. We are an industrial gas company and at the same time -- so we are pursuing a totally different strategy, as you know I have talked before. The fact that our volumes are up, and I think this will continue to be the trend that we will beat other people on volume growth is because we are investing in the future, and we are winning our share or even better than our share of the smaller projects than people have been talking about.

So as a result, volume growth is obviously the key thing we're focused on. Pricing, we are holding our own. There is no significant difference in the pricing because if it was, the market shares will change. And the market shares are staying stable. So that is the question that I have, first one. On the second question that you have in terms of the efficiency of the crackers that we think we have versus the conventional wisdom that you use 20% to 30% of that, we have talked about this thing.

It is a technology we have been developing but the person who is doing that on a day-to-day basis is Dr. Serhan and I like him to make some comments about that. Samir?"
"83","Dr. Samir J. Serhan","Chief Operating Officer at Air Products and Chemicals","I mean it really goes safely to what you mentioned before. I mean it's that know-how we developed over the last 60 years in producing hydrogen. I mean this is really what -- we had this challenge a few years ago. We looked at the market, we saw that there are ammonia crackers, but the efficiency is really not acceptable. You end up wasting lots of the valuable product.

And again, we put our team of expert on this. And basically, we developed a product where we feel is very, very efficient. I mean, to a single-digit loss. And that's really what we have without giving too more details."
"84","Seifi Ghasemi","Chairman, President and Chief Executive Officer at Air Products and Chemicals","Well, Dr. Serhan just gave you more information, but you were saying 10% and he's not talking single digits, which is good news. But Jeff, if I may just summarize, I'm very proud of our team. We do have very good people, and they have developed this technology. And this is going to be a competitive advantage that we will end up having as we go forward on this conversion of ammonia to hydrogen. We have time for one more question, please go ahead."
"85","Jeff Zekauskas","Analyst at JPMorgan Chase & Co.","Thank you very much."
"86","Operator",NA,"Our last question comes from Vincent Andrews with Morgan Stanley. Please go ahead."
"87","Steve Haynes","Analyst at Morgan Stanley","Thanks for squeezing me in. This is Steve Haynes on for Vincent. Maybe just a quick one on the fourth quarter guide. I think 4Q usually steps up a bit more seasonally than what you have baked in? I know you just kind of talked about some macro uncertainty in China and in Europe, but is there anything else in there that's causing a little bit of the more muted 4Q ramp?"
"88","Seifi Ghasemi","Chairman, President and Chief Executive Officer at Air Products and Chemicals","Well, thank you for your question. When we give you guidance, we put touch together about what it is that we can see in terms of our best judgment of what we think we can deliver. When you look at our fourth quarter, I do agree with you that compared to seasonally adjusted results in the previous years, it seems that there is not as much of a jump as you would expect.

So on that front, maybe you can tell us that we are being a little bit cautious, but we are being cautious because we are totally uncertain about some of the economies. But that is our best judgment at this time. And obviously, I certainly hope that we can do better than that. Well, thank you very much. That concludes our session. And I would like to again thank everyone for joining our call today.

We really appreciate your interest and your good questions. And we look forward to discussing our results with you again next quarter. Stay safe. Have a great summer and talk to you soon. Take care. Thank you."
"89","Operator",NA,"[Operator Closing Remarks]"
