"","speaker","title","msg"
"4","Edmund Reese","Chief Financial Officer at Broadridge Financial Solutions","Thank you, Tim, and good morning, everyone. I'm pleased to be here to discuss the results from yet another strong quarter and the strong full year fiscal '23. Today, I will also provide you with some additional color into our guidance for fiscal '24, which continues to be in line with our historical three-year financial objectives.

Before jumping into a review of our strong results and guidance, I want to emphasize some of the significance of some key milestones that we achieved in fiscal '23. First, we completed the investment in our wealth management platform, reduced our client platform spend, and are now going live with our anchor client, recognizing revenue in July. Second, free cash flow conversion improved to 90%. Third, we paid down debt and reached our leverage objective, in line with our commitment during the Itiviti acquisition. And fourth, we positioned ourselves to return more capital to shareholders via higher dividend and the resumption of share repurchases in fiscal '24. And finally, as Tim noted, we capped our current three-year cycle, where we delivered at or above the high end of our three-year objectives. Those milestones were direct outcome of our strong fiscal '23 results.

And as you can see from the financial summary on Slide 9, Broadridge's full year recurring revenue growth was at the higher end of our fiscal '23 guidance. And with operating leverage in our business and continued disciplined expense management, high single digit adjusted EPS growth was right in line with our full year guidance, despite the lower event-driven revenue. On a full year basis, recurring revenue rose to approximately $4 billion, up 9% year-over-year on a constant currency basis, all organic. Adjusted operating income increased 12% and margin expanded 110 basis points to 19.8%, outpacing our annual margin expansion objective, despite the drag from increased low to no margin distribution revenue. And I'll remind you that while higher interest rate expenses partially offset operating income growth, the interest rate impact at the Broadridge level is fully offset by higher float income in our ICS segment. Adjusted EPS rose 9% to $7.01. And finally, we delivered closed sales of $246 million.

Turning to the fourth quarter, recurring revenue grew 8% on a constant currency basis to $1.3 billion, again the growth was all organic. Adjusted operating income grew 22%, right in line with our expectations, and AOI margins expanded 360 basis points. Adjusted EPS increased 21% to $3.21 and closed sales were 19% lower at $90 million.

Let's get into the detail of these results, starting with recurring revenue on Slide 10. Recurring revenue grew 8% to $1.3 billion in Q4 '23. Our recurring revenue growth was all organic, driven by a combination of converting sales to revenue in mid-single digit position in trade growth. For the full year, 9% recurring revenue growth was at the higher end of our full year guidance range of 6% to 9%. This 9% growth exceeds our 5% to 7% organic growth objective and marks three consecutive years of organic growth of at least 8%.

In addition to our strong organic growth, the acquisition of BTCS contributed 2.6 points of growth to our fiscal year '20 to fiscal '23 recurring revenue CAGR, right in line with what we communicated at the time of acquisition. As a result, we also exceeded our total recurring revenue growth objective of 7% to 9% with a three-year constant currency CAGR of 11%.

Let's turn now to Slide 11 to look at the growth across our ICS and GTO segments. We continue to see strong growth in both ICS and GTO. In Q4, ICS recurring revenue grew 7%, all organic, to $858 million, with solid growth across all four product lines. Regulatory revenue grew 5% to $444 million on the back of continued growth in U.S. equity and fund positions, partially offset by lower growth in international proxy. Data-driven fund solutions revenue increased 12% to $113 million, primarily due to higher float revenue in our mutual fund trade processing units. And issuer revenue grew 7% to $134 million, led by growth in our registered shareholder and disclosure solutions. Our customer communications recurring revenue was up 7% to $166 million, led by new client wins, higher print volumes, and very strong double-digit growth in our digital business. Our digital customer communications business has now surpassed $100 million in recurring revenue, which is a sign that our print, the higher margin digital strategy is working. Before the year, ICS grew recurring revenue at 9% with regulatory at 7% and double-digit growth across all other product lines.

Turning to GTO on Slide 12, Q4 recurring revenue grew by 9% to $401 million. Capital Markets revenue grew 12%, $257 million propelled by higher license revenue in BTCS, continued fixed-income trading volume growth, and new sales growth. Wealth & Investment Management revenue increased 4% to $143 million, driven by healthy growth from new sales, offset by lower trading volumes and the grow-over impact of higher license revenue in Q4 '22. For the year, GTO grew recurring revenue at 8%, ahead of our 5% to 7% growth objective, driven primarily by double-digit growth in our Capital Markets business.

Now let's turn to Slide 13 for a closer look at the volume trends. We had healthy position growth for both equities and funds in the fourth quarter, consistent with our testing results. Equity position growth was at [Phonetic] high-teen growth in Q4 '22 and was 6% in the quarter and 9% for the full year, with continued double-digit growth in managed accounts. Mutual fund position growth in the quarter ticked up to 8% and full year growth was also 8% with continued strong flows in the money market funds. Looking ahead to the first half of fiscal '24, our current testing for equity positions is showing mid-single-digit growth, which supports our full year outlook of mid-to-high single-digit growth.

Turning now to trade volumes on the bottom of that slide. Trade volumes grew 3% on a blended basis in Q4, driven by another quarter of double-digit fixed-income volume growth, which benefited our capital markets business and modest declines in equity volumes, impacting our retail wealth business. For the full year, trading volume was up 4%.

Let's now move to Slide 14 for the drivers of recurring revenue growth. For the quarter, recurring revenue growth of 8% was all organic and balanced between net new business and internal growth. Revenue from closed sales in our continued high retention from existing customers provided four points of growth. Our recurring revenue retention rate was 99% in the quarter and 98% for the full year. And internal growth primarily higher positions, trading volumes and float income also contributed 4 points. Foreign exchange impacted recurring revenue by 1 point with most of that coming in our GTO business as you can see in the table on the bottom of the slide.

I'll finish the discussion on revenue on Slide 15. Total revenue grew 7% in Q4 to $1.8 billion. Recurring revenue was the largest contributor with 5 points of growth. Event-driven revenue was $59 million and a 1 point headwind to Q4 growth. Event-driven revenue increased sequentially and was in line with our seven-year average as mutual fund proxy activity improved. While we're not forecasting any large fund proxy campaigns, we do expect some of the delayed mutual fund proxy activity in fiscal '23 to come through in fiscal '24, as event-driven revenue returns to more historical levels. Low to no margin distribution revenues contributed 3 points to total revenue growth. Distribution revenue increased 9% with postal rate increases contributing 8 points of that growth. Given that postal rate increases are pass through, elevated distribution revenue have a dilutive impact on our adjusted operating income margin.

Turning now to margins on Slide 16. Adjusted operating income margin for Q4 was 28.9%, a 360 basis point improvement over the prior year, driven by a combination of our operating leverage in our business, higher float income, and continued disciplined expense management. On a full year basis, we delivered a 110 basis points of margin expansion. The impact of interest income more than offset a 30 basis point headwind from the growth of low to no margin distribution revenue. Excluding both, margins expanded 60 basis points, which is above our 50 basis point long-term objective.

As I mentioned earlier, we have a track record of disciplined expense management. This discipline along with the operating leverage inherent in our business model, allows us to invest in our long-term growth investments and meet our earnings objectives. As we exit fiscal '23, we are undergoing a modest restructuring that will realign some of our businesses, streamline our management structure and impact approximately 2% of our 14,700 associates.

As a result, we incurred a $20 million restructuring charge in Q4 '23, and we anticipate that these actions will generate approximately $50 million in annualized savings, again allowing us to continue to fund growth investments and deliver earnings growth. Looking ahead, we expect another $15 million to $30 million charge in Q3 '24, as we complete this restructuring initiative and seek to create further room to invest. These restructuring charges are excluded from our calculation of adjusted operating income and adjusted EPS.

Let's move ahead to closed sales on Slide 17. We ended our fiscal year, closing $90 million in closed sales for the fourth quarter. For the full year, sales were down 12%, off a record fiscal '22 to $246 million. Closed sales were below our full year guidance, driven by lower international sales. Strong U.S. sales were driven by customer communications, digital solutions, and retirement solutions. Our pipeline entering fiscal '24 is at a record high, and the demand for our technology solutions remains strong. Importantly, the slowdown in sales we experienced in Q4 '23 is fully incorporated into our fiscal '24 guidance. Our $400 million backlog equal to 10% of our fiscal '23 recurring revenue, provides strong visibility into the revenue conversion from closed sales that will drive fiscal '24 revenue growth.

I'll now turn to cash flow on Slide 18. In fiscal year '23, we generated $748 million in free cash flow, doubling fiscal '22 levels. As a result, free cash flow conversion calculated as free cash flow over adjusted net earnings improved to 90% in fiscal '23. This improvement was the product of reduced client platform spend and payments from UBS, as we finalize the rollout and go-live plan, along with strong working capital management. Looking ahead to fiscal '24, we estimate free cash flow conversion of approximately 100%.

Let me make a note here before we move on to capital allocation. With a new contract with UBS in place, we have now moved our focus to marketing and driving $20 million to $30 million in sales of the wealth management platform components. As a result, we have moved approximately $600 million of software investment from the deferred client conversion line to intangible assets. This is consistent with balance sheet classification of platform technology that will be marketed to multiple clients. We continue to expect to recognize $57 million of annualized amortization expense in fiscal '24, resulting from our wealth platform investment and this change will have no impact on the free cash flow or the income statement.

Let's now discuss capital allocation on Slide 19. We spent $369 million on investments for growth, primarily our wealth platform and returned a net of $312 million to shareholders in fiscal '23. In addition, we repaid $385 million of debt. The combination of strong earnings growth and lower debt moves our leverage ratio at the end of fiscal '23 to 2.6 times. This level is consistent with the leverage objective we set when we announced the Itiviti acquisition and is in line with our goal of maintaining an investment grade credit rating.

As a result, we expect to return to more balanced capital allocation in fiscal '24. To that end, we are pleased that our Board has approved a 10% annual dividend increase to $3.20 per share in fiscal '24, in line with our targeted dividend payout ratio of 45% of adjusted earnings. We have capacity from other strategic tuck-in M&A and we are also in a position to resume share repurchases for the first time since fiscal '19.

I'll close my prepared remarks this morning with some detail on our fiscal '24 guidance, which is on Slide 20. Our fiscal '24 guidance calls for mid-to-high single-digit recurring revenue growth, margin expansion, strong adjusted EPS growth, and the recovery in closed sales.

Let's break down the relevant components and drivers of each guidance point starting first with revenue. We expect fiscal '24 recurring revenue growth constant currency of 6% to 9%, all organic, driven by new sales as we work to onboard our $400 million backlog. For modeling purposes, we expect GTO growth to be in line with our historical 5% to 7% organic range. In our wealth business, we anticipate that we will recognize approximately $75 million in incremental revenues from wealth platform clients. This growth will be significantly offset by the loss of revenue transitioning E-Trade to the Morgan Stanley platform. We are assuming flat trading volumes.

We expect event-driven revenue to return to more historical levels in the range of $230 million to $250 million. Distribution revenue is anticipated to grow in the high-single to low-double digit range, driven by further increases in postal rates. This continued strong growth in low to no margin distribution revenue does create a margin headwind that I'll discuss in a moment. I'll also note that using the current forward curve for FX suggest the 0.5 point benefit in recurring revenue relative to fiscal '23.

Second, let's move on to margins. We expect our adjusted operating income margin will be up year-over-year to approximately 20%. We expect the net impact of higher distribution revenues and higher float income to be dilutive to our margins in fiscal '24. Excluding the headwind from distribution and float income, we expect that the operating leverage in our business and our disciplined expense management will allow us to absorb the amortization from our wealth platform and fund higher growth investments in our business while driving greater than 50 basis points of margin expansion, in line with our historical objectives.

Third, EPS. We expect adjusted EPS growth of 8% to 12%. Embedded in this outlook is an expected tax rate of 23%, a slight uptick driven by the lower impact of discrete items on higher earnings and the geographic earnings mix.

Finally, closed sales. We expect a strong year in sales with the fiscal '24 range of $280 million to $320 million, based on our strong pipeline. We expect balanced sales between ICS and GTO, and I want to reiterate that the delays in the timing of our sales have only a very modest impact on our medium-term revenue outlook, given our backlog.

Taken together, our fiscal '24 guidance demonstrates the strength of our financial model. We continue to be focused on driving sustainable recurring revenue growth, using the operating leverage in our business to create capacity for continued investments and continued margin expansion, while also delivering steady and consistent adjusted EPS growth, all while maintaining an investment grade balance sheet and a balanced capital allocation policy.

Before I move on from guidance, let me briefly discuss our Q1 and first half adjusted EPS outlook. Historically, Broadridge has generated a little less than a quarter of our earnings in the first half, and we anticipate this year to be no different, with earnings slightly more weighted towards Q1 versus Q2, driven in part by higher event-driven revenue in the first quarter.

With that final note, let me wrap up with a quick summary of my key messages. Broadridge delivered strong Q4 financial results to close up a strong fiscal '23. We delivered at or above the high end of our three-year financial objectives. And with our fiscal '24 guidance, we are positioned to deliver another strong set of financial results. Last, we expect to return to more balanced capital allocation in fiscal '24, including double-digit dividend growth, the resumption of stock repurchases, and potential tuck-in M&A.

With that, let's take your questions. Operator?"
"5","Operator",NA,"Ladies and gentlemen, at this time we'll begin the question-and-answer session. [Operator Instructions] And our first question today comes from Peter Heckmann from D.A. Davidson. Please go ahead with your question."
"6","Peter Heckmann","Analyst at D.A. Davidson","Hey, good morning, everyone. Really complete call. You checked off a number of my questions as we went. I didn't hear -- I think I heard the equity position growth embedded in guidance was about mid-single digits. Would you assume funds would continue kind of mid-to-high?"
"7","Edmund Reese","Chief Financial Officer at Broadridge Financial Solutions","Yes, I'll start-off with that, Peter, and thanks for the question. Thanks for joining this morning. Yes, that is exactly what we're expecting for fiscal '24. We've continued to see strong growth in both equities and funds. They are at a more normalized level relative to fiscal '21 and fiscal '22. So in our testing in the first half, for the first half of this year is, as I said in my prepared remarks, showing mid-single digit growth, which gives us confidence in our outlook for mid-to-high single-digit growth in both equities and we expect the same thing in funds ending the year at 8% with continued growth in passive funds there, we expect mid-to-high single-digit growth."
"8","Peter Heckmann","Analyst at D.A. Davidson","Okay. That's helpful. And then in terms of the -- so it sounds as if the first quarter might have a little bit more event-driven as well as a relatively easy comparison on the -- on margins. So first quarter looks like a little bit larger than historical, so certainly the current consensus appears to be appropriate, if not a little low on the adjusted EPS side?"
"9","Edmund Reese","Chief Financial Officer at Broadridge Financial Solutions","Well, look, we're certainly focused on our business and what's driving the economics here. I do think there was, as we've been talking about throughout last year, delayed mutual fund proxy activity. And I don't think that's a choice that the business has to come back at some point. As I said in my remarks, we're not predicting any major fund to go to proxy, but the early signs as we begin to look at the jobs that we have for Q1 suggests that we are seeing some of those delays come into Q1, so I do expect Q1 to be slightly higher than Q2. But overall, the first half in line with what we've historically seen, which is just under a quarter of our earnings in the first half."
"10","Peter Heckmann","Analyst at D.A. Davidson","Okay. And if I could just sneak in one more, just on the bookings side in the second half of fiscal '23, any other characteristics that you would say in terms of U.S. being pretty much on target, Europe a little weaker. Anyway you can talk about maybe individual solution sets or any particular thing, big projects, small projects. Any other color in terms of the delays, that would be helpful?"
"11","Tim Gokey","Chief Executive Officer at Broadridge Financial Solutions","Yes, Peter, it is Tim. I'll take that. And clearly, our sales ended lower than we expected even just three months ago. And as you said, that was really continued nice growth in the U.S. and then challenges in Europe. We are really in a complex environment, whether that be war, whether that be the failure of one of the largest European institutions, led to delayed decision-making. And as Edmund said, we just have to repeat it, that we think the impact of this is modest, it's included in our outlook, '24 is driven by the $400 million backlog.

The color on drilling down further, it's really across many of the solutions. We saw slowdowns, and remember, our international business has driven a bit more on the GTO side than the ICS side. And there was really just decisional weakness both in post-trade and on the Itiviti side. That is feeding in too because as we look at those opportunities, they haven't gone away, they haven't gone to a competitor, and that is what is leading to really a record pipeline as we enter the year. So we are -- that's why we feel good about the $280 million to $320 million guide for this year, which is obviously a strong recovery. We are anticipating continued nice growth in the U.S., and we're positioning ourselves in Europe so that as decision-making there unlocks, we can really let those things flow through."
"12","Operator",NA,"And ladies and gentlemen, our next question comes from Dan Perlin from RBC Capital. Please go ahead with your question."
"13","Dan Perlin","Analyst at RBC Capital Markets","Thanks. Good morning. I wanted to kind of follow back up on kind of backlog here a little bit. So the $400 million, is there -- is there a way to kind of talk about, I guess, the nature of the work that's embedded in that and timing expectations that you might have in terms of conversions into revenue? Is it any different than what you historically would have seen in patterns? Are there types of businesses that are embedded in that, that just could be prolonged for longer than you anticipate?

And then I did want to just revisit again the closed sales in the quarter. I mean it did kind of surprise us. And obviously, it was surprising to you guys how quickly it kind of turned down. So here again, I guess, the question is just really on visibility, which I guess is just kind of an extension of the way Peter asked the last question."
"14","Edmund Reese","Chief Financial Officer at Broadridge Financial Solutions","Tim, let me maybe just start-off and give a little bit -- I'll talk about the -- first, Dan, thanks for the questions, and I'll talk a little bit about the backlog, but I want to put it in the context of our overall '24 guidance, and then maybe I'll turn it over to Tim to talk a little bit more about the closed sales.

When you think about our guidance for fiscal '24, there's a high level of confidence. And keep in mind, we're operating in this very volatile macroeconomic environment and continue to deliver the results that we just talked about for a moment. And as I think about our fiscal '24 guidance, your point on the backlog is the first thing that comes to mind, our continued conversion of the backlog to revenue. I don't think that there's anything in that backlog that's unique. We've said before that we see anywhere from a 12-month to 18-month conversion cycle. Clearly, we are going to have the wealth management revenue come across earlier in this year from the backlog, but continuing to execute on that is what we expect, and the cycle continues to be the same.

Further, I think about the position growth that we have, and as I said, the testing that we're seeing now suggests that our outlook for mid-to-high single-digit position growth continues to be in line. That continues to give us confidence in our recurring revenue guidance. And again, we have a six-month window insight upfront to look at that. And so, if something changes, we have the time to react on that. And then our continued execution on margin expansion in our business to be able to drive the guidance that we have and coming off of 77 basis points for the last three years, we continue to feel good about that guidance. So nothing specific about -- nothing specific that's different about the conversion to revenue cycle. And those are the factors that I take in mind as I think about the overall guidance.

And Tim, you might want to give some other comment on sales, if anything."
"15","Tim Gokey","Chief Executive Officer at Broadridge Financial Solutions","Yes. I just think, Dan, on sales visibility, these things are always hard to judge. It is -- and I'll reiterate that whether a sale finishes in June or it finishes in September or October for that matter, it really doesn't make much difference to our results. And I really go to the quality of the conversations, the need that our client institutions continue to express and their intent. And then beyond that, it just gets -- it gets bogged down in contracting in final -- lots of final details. And since the weakness was in Europe and Europe in the summer is not exactly a hotbed of activity, I'm not here promising that, oh, it's going to happen in the next few weeks either. But I do have good confidence that it will happen in this fiscal year."
"16","Dan Perlin","Analyst at RBC Capital Markets","Okay. No, that's great. Thank you. And then just a quick follow-up on margins. A couple of just, I guess, moving parts here. I just want to make sure I heard everything right. So if we look at '23 kind of ex distribution in some of these things or traded revenues, I think you said it increased 60 basis points versus the 110 basis points. So that's kind of the pure number that we should be focused on. And I think embedded in your guidance, I think you also said as you kind of remove some of these [Indecipherable] things around higher distribution and then maybe flow going against it, plus absorbing amortization that you'd be able to do 50 basis points of margin expansion. So I guess one is that I characterize both those correctly. And then secondly, anything you call out in terms of underlying momentum that you have in the margin structure?"
