"","speaker","title","msg"
"5","Michael E. LaBelle","Executive Vice President, Chief Financial Officer and Treasurer at Boston Properties","Great. Thanks, Doug. Good morning, everybody. I plan to cover the details of our fourth quarter performance and the changes to our 2023 earnings guidance. However, I would like to start with a summary of our recent capital raising activities.

We've been very busy in the capital markets and has substantially bolstered our liquidity heading into 2023. In the last 120 days, we've executed on three transactions in three different markets. We sold one of our residential buildings in Reston Town Center for $141 million and a 4.3% cap rate. We issued $750 million of five-year unsecured green bonds. And in January, we extended and upsized our corporate unsecured term loan to $1.2 billion, an increase of $470 million. In aggregate, the net proceeds raised from these deals is $1.35 billion, and we now have liquidity of $2.6 billion, which puts us in an extremely strong position to complete our development pipeline, including our recently commenced 570,000 square foot fully pre-leased, 290 Binney Street life science project, as well as provide additional capital for other opportunities that may arise.

We've also reduced our 2023 loan maturity exposure to $930 million, which is comprised of $500 million of senior unsecured notes that expire in September, and five expiring mortgages totaling $430 million at our share. The majority of these mortgages have embedded extension options and we anticipate renewing or refinancing all of these facilities. Given the challenging state-of-the current debt markets, particularly with respect to the mortgage markets, we are very well positioned.

Now I'd like to turn to our fourth quarter earnings results. We reported fourth quarter FFO of $1.86 per diluted share and full year 2022 FFO of $7.53 per diluted share. This is a penny ahead of the midpoint of our guidance and $0.02 ahead of Street consensus. The improvement was primarily from better performance in our portfolio with our NOI of about $4 million or $0.02 per share, ahead of our forecast. The outperformance was a mix of higher lease revenue, stronger results from our hotel in Cambridge, and higher building service income, especially in New York City where we see the highest space utilization.

The portfolio outperformance was partially offset by a penny of higher net interest expense related to our $750 million green bond offering that was not part of our original guidance. Although not part of FFO, I do want to describe that we took a $51 million or $0.29 per share non-cash impairment charge in the quarter, reducing the book value of our equity interest in our Dock 72 property located in Brooklyn, New York. This building is owned in a joint venture where we hold 50%. The building has suffered from weak leasing conditions in Brooklyn, and last quarter the primary client contracted by two floors. It's currently just 25% occupied, although it is 42% leased, including leases that have not yet commenced.

Overall, we had a strong year in 2022. We increased revenue by 8% and our FFO by 15% over 2021. Our growth came from our same-property portfolio, as well as our developments and our acquisitions. Our same-property NOI increased 4% over 2021, which was the high-end of our range. And on a cash basis, it was even stronger with cash NOI growth in our same-property portfolio of 6.5% over 2021. Our development deliveries added $0.24 per share to our 2022 earnings and our acquisitions net of dispositions added $0.10 per share.

Now I'd like to turn to an update to our 2023 guidance. As we detailed in our press release, the two most significant changes to our 2023 FFO guidance are the impact of commencing our 290 Street -- 290 Binney Street development and the interest expense associated with our new financings. We did not incorporate 290 Binney in our guidance last quarter due to several significant contingencies we needed to clear prior to starting the projects that were outside of our control. Our team successfully closed out these items late in the fourth quarter and we were able to start the project in January.

The development plan includes closing and demolishing the existing Binney Street garage. [Indecipherable] produced $8.6 million of NOI in 2022 and we will lose this income in 2023 and going forward until the completion of the development, which will include a new underground parking facility. As Owen described, the project is projected to be highly-accretive to our future FFO. And by the way, all the loss garage income is incorporated into those development returns. We are also required by GAAP to expense the garage demolition costs of approximately 3.2 million. We expect to incur the demolition expense in the first and second quarters of 2023 with no impact thereafter as the demolition will be complete. These two items related to 290 Binney Street will result in a $11.8 million of lower FFO in 2023 or $0.07 per share.

With respect to our financing activity, we disclosed in our press release in November that our $750 million green bond offering would add $0.08 per share to our 2023 net interest expense and reduce our FFO guidance. As a result, we expect the aggregate impact of starting 290 Binney and issuing incremental debt capital will reduce our 2023 FFO by $0.15 per share. Despite this, our new guidance range for diluted FFO of $7.08 and $7.18 per share is a reduction of only $0.09 per share at the midpoint from our guidance last quarter. That means, we've increased the projected contribution to FFO from other areas.

Also, we previously communicated the impact of our bond offering, so the reduction is really only a penny per share from our November adjusted guidance. The projected increases come from three places. First, excluding 290 Binney Street, our assumption for incremental contribution to NOI from acquisitions and developments is up $0.02 per share. The increase is from higher contribution from our 205th Avenue acquisition and better than projected leasing in our development pipeline. Doug described the increased leasing this quarter in the pipeline and some of that will generate revenues in 2023.

Second, our revised assumption for net interest expense is lower by $0.03 per share, net of the impact of the bond offering. And this improvement is primarily from higher earnings on our cash balances and higher capitalized interest from changes in our development spend and higher interest capitalization rate. And last, we've increased our guidance for development and management services income by $2 million or a penny per share, reflecting higher projected construction management fees.

So to summarize, we've modified our 2023 guidance range for diluted FFO to $7.08 to $7.18 per share, a decline of $0.09 per share at the midpoint. The changes are the result of cost from starting 290 Binney Street of $0.07 and higher interest expense from our bond offering of $0.08, and these reductions are partially offset by higher contributions to NOI from acquisitions and developments of $0.02, higher interest income and capitalized interest of $0.03 and higher-fee income of a penny.

Our 2023 forecast resulting in a projected reduction in FFO of 5% from last year after growing 15% in 2022. The reduction is wholly due to the significant increase in interest rates as our portfolio NOI continues to grow and we have a significant pipeline of accretive developments that are delivering over the next few years. As Owen described, it appears that we are close to the end-of-the Fed's tightening cycle. So interest rates should not be the same headwind going forward. The last thing I would like to mention is that we intend to change the timing of our initial issuance of annual guidance starting next year. We plan to provide guidance for 2024 with our fourth quarter earnings release, similar to the other companies in our sector.

That completes all of our formal remarks. Operator, can you open up the lines for questions?"
"6","Operator",NA,"Thank you, sir. [Operator Instructions] I show our first question comes from the line of Camille Bonnel from Bank of America. Please go ahead."
"7","Camille Bonnel","Analyst at BofA Global Research","Hi, good morning. Your guidance mentioned higher contributions from acquisitions and development activities, but it looks like a few initial occupancy dates for officers and life science projects got pushed back a quarter into next year. Can you just provide a bit of color on what's contributing to this outlook? And any comment specifically on how the leasing pipeline is going for your construction properties would be very helpful? Thank you."
"8","Owen D. Thomas","Chairman and Chief Executive Officer at Boston Properties","So we did a significant amount of leasing at 2100 Penn. And a portion of that will contribute in 2023. We did push-out by one quarter 360 Park Avenue South based upon where the leasing activity and the development activities are on that asset. And then the other place that we had a little bit of an increase was at 205th Avenue which is an acquisition we made and we finalized the kind of accounting of straight-line rents and fair-value rents for that asset. So that's flowing through into our straight-line rents next year, which our guidance is up for straight-line rent.

Doug, I don't know if you want to talk anymore about the development leasing? I mean, you talked about a little bit on..."
"9","Douglas T. Linde","President and Director at Boston Properties","Yeah. I think in my in my comments I described sort of where we are, which is big picture, we're about 50% leased on our the totality of our development assets, when -- and by the way, we will be including next quarter for 300 Binney and 290 Binney on our CIP schedule. The leasing is slow at 350 Park Avenue South. The leasing picked-up, as Mike said, at 2100 Pennsylvania Avenue. We are very well-leased at the other assets that brought on this quarter. So relative to 2023, I don't think you're going to see much in the way of changes."
"10","Operator",NA,"Thank you. And I show our next question comes from the line of John Kim from BMO Capital Markets. Please go ahead."
"11","John Kim","Analyst at BMO Capital Markets","Thanks, good morning. You spent a lot of time at your Investor Day talking about the occupancy upside potential given your near-term expirations. And I know a lot has changed since then, but you have leased 1.1 million square feet in the fourth quarter. And my question is, how does that compare versus your expectations at the time? And as you sit here today, is 1.1 million square feet, is that a good run rate for the rest of the year?"
"12","Douglas T. Linde","President and Director at Boston Properties","Well. You're asking if I describe how we were thinking about the world in September versus the way we're thinking about the world today. I would tell you that there has been a material change in the overall economy relative to the risk of recession, and I think there is less demand in the overall environment than there was then. We still feel really good about the overall quality of our assets and the ability to capture incremental demand in the marketplace due to the nature of the tenants that are looking for space.

And so again, we actually exceeded our own internal projections for the at the end-of-the year because we thought we would be slightly below where we were in the third quarter. And again, if you sort of -- it's just for bringing these new assets into service and simply put them in at their absolute leased occupancy or remove them, they actually increased our overall occupancy during the year. And so I would tell you if you look at our exploration schedules for 2023, when you look at the 1.5 million square feet we've already leased and we will again hopefully be leasing somewhere in the neighborhood of 750,000 to 1 million square feet per quarter, we should again be increasing our occupancy as we move through 2023."
"13","Owen D. Thomas","Chairman and Chief Executive Officer at Boston Properties","Yeah, John, just to add. I mean, we -- we've maintained our guidance for our same-property portfolio and for our occupancy. So our outlook is similar to what it was when we gave guidance last quarter. I think that our occupancy in the first quarter, so three months from now will likely be lower or flat to what it is today, but we've got a lot of leases that are already signed that Doug described. The 1.5 million square feet that are coming into play and I think that starting in the second quarter, we're going to see our occupancy grow from there through the rest of the year. And a lot of this occupancy has been coming in some of the major markets like New York City. We've got a number of leases that are signed that will be starting in the second quarter. Doug described the deal in Boston that we did just in December and that deal is going to start in the second quarter. And we also have some deals in Reston starting. So, I think that we feel -- we've been conservative in our approach to our guidance based upon what we see future leasing activity as, but we feel good about the guidance that we provided."
"14","Operator",NA,"Thank you. And I show, our next question comes from the line of Steve Sakwa from Evercore ISI. Please go ahead."
"15","Steve Sakwa","Analyst at Evercore ISI","Yeah, thanks, good morning. I want know if you can talk a little bit about maybe Platform 16 and 360 Park Avenue South, and I know both of those buildings were sort of geared towards the tech tenants. And Doug, given your comments about the slowing tech demand in even some of these tenants subleasing, I'm just curious how you're may be altering the -- the marketing program there or do you just need the macro environment to really get better to see traction on both of those buildings?"
"16","Douglas T. Linde","President and Director at Boston Properties","So, let me ask Hilary Spann to talk about 350 Park Avenue South, And I'll ask Bobby sort comment on Platform 16."
"17","Hilary Spann","Executive Vice President, New York Region at Boston Properties","Thanks, Doug. Hi, Steve, how are you doing. So at 350 Park Avenue South, the redevelopment is underway. We are very far along in discussions with a retail tenant that is going to be very exciting when we're able to announce it. I think it's fair to say that the demand for 360 Park Avenue South is diversified, but tilted toward tech and media firms because of its location in the Midtown South sub-market and to the point that everyone has been making on this call, that leasing velocity has slowed dramatically starting probably in end-of-the second-quarter of last year, maybe early third quarter of last year. And so, we are proceeding a pace with the development and we expect to deliver it as per our original estimates.

And some of the demand that we have seen for that building is actually in a more traditional industry groups, finance, you know the industries that support finance, etc. But no question that the leasing has slowed there, and so we are thinking that rather than looking at 150s, we may be looking more at 50 to 75,000 square foot tenants for to fill the demand for that building."
"18","Robert E. Pester","Executive Vice President, San Francisco Region at Boston Properties","Well, thank you. Yeah. Hi, Steve. So on Platform 16, the project doesn't deliver till 2025. And as we've told you many times before that the San Jose Silicon Valley market is a build and they will come market it. Typically, tenants don't look at the buildings until they can walk the building or get a feel that this deal is going up. We still see it as a tech building. It's the only building that's going to deliver in that 2025 timeframe in Silicon Valley, its new. So we're still optimistic that over the course of the next 24 months that tech user will materialize for the building."
"19","Operator",NA,"Thank you. And I show our next question comes from the line of Blaine Heck from Wells Fargo. Please go ahead."
"20","Blaine Heck","Analyst at Wells Fargo Securities","Great, thanks, good morning. The fourth quarter seem to be a slow leasing quarter in the overall market. You at BXP did relatively well compared to the market. But can you talk about whether you think you've seen a change in the level of demand or leasing activity thus far this year? And maybe more importantly, what do you think needs to change to get some of the tenants that have been reluctant to sign longer leases to make those longer-term commitments?"
"21","Douglas T. Linde","President and Director at Boston Properties","So, Blaine, I am, and I'll let Owen make a comment as well. I hope that my comments were both honest and thoughtful regarding what I think we think the demand picture is, which is there is less overall demand in the market today due to the nature of the business economies changes. And we don't think there's going to be much, if any, a positive absorption occurring. We think we will lease more space than our peers because we have premier work spaces -- places that are geared towards the tenants that are in the market and then that are making decisions. And I don't actually believe that the tenants that are looking for space are concerned about making long-term decisions, they are in fact most probably making long-term decisions than we are still doing longer-term leases in all of our other leasing that we've been doing in the last couple of quarters. Some of it hasn't hit the lines yet in terms of our occupancy numbers. But, so I can't tell you how long the economy is going to be where it is. But as the economy recovers, traditionally Jobs and/occupancy are second derivative events associated with that, and so it will be a period of time before tenants are ""growing again."" But, Owen, maybe you have some other ideas."
"22","Owen D. Thomas","Chairman and Chief Executive Officer at Boston Properties","Doug, you covered it well."
"23","Operator",NA,"Thank you. And I show our next question. Oour next question comes from the line of Alexander Goldfarb from Piper Sandler. Please go ahead."
"24","Alexander Goldfarb","Analyst at Piper Sandler Companies","Hey, good morning."
"25","Douglas T. Linde","President and Director at Boston Properties","Good morning up there."
"26","Alexander Goldfarb","Analyst at Piper Sandler Companies","First is a comment, maybe Dock 72 would be good for resi conversion if you're taken suggestions from the cheap seats. A question for Ray, is in D.C it's good to see the politicians and including in Congress addressing the work-from-home endemic that's with the Federal employees. My question for you though is, how much does work-from-home for government workers really affect like Reston Town Center and the private office market? I would guess that one GSA doesn't really sign high-priced deals to just given what's been going on. I'm guessing more of the private investment market is focused on private companies or DoD or other security tenants who have to be in office. So just sort of curious your take on what's going on in DC, and how much we need government workers to come back for the market to flourish?"
"27","Raymond A. Ritchey","Senior Executive Vice President at Boston Properties","First of all, happy New Year, Alex. Thanks for the question. You know it is -- we've been here in the district. It's really kind of frustrating to see the federal workforce not fully engaged in the return to work. The Real Estate Roundtable has been very effective in reaching out to Mayor Bowser and and really stressing to her the important for the federal workforce to return not only just in terms of consumption of office space, but the social fabric of the city is completed deteriorating with the workers not coming, and we're also very concerned about the impact upon metro. Before the pandemic, there was almost 800,000 riders a day on the metro, now it is less than 300,000, and that will have an impact on the the public transportation system here.

As it relates to Reston specifically, we have a very large portion of our tenants who are engaged in government contracting and support to the federal government. And the policy of the federal government not to return to work also is impacting occupancy in Reston. And while many of them have the requirement to be in the office because of the secured nature of their work, it still impacts the more traditional office support tenants for the federal government contractors. So it's impacting Reston from a presence of the retail, it impacts things like the fitness center and other support activities we have in the building. So even though we're a diverse tenant base there, the lack of the federal government coming to work is still impactful. And we're really insisting to the leadership in the district the importance for the Federal government to return to their offices."
"28","Operator",NA,"Thank you. And I show our next question comes from the line of Michael Griffin from Citi. Please go ahead."
"29","Michael Griffin","Analyst at Smith Barney Citigroup","Great, thanks. It seems like relative to the East Coast peers as West Coast markets continue to lag, I guess what sort of concern do you have for the long-term viability of the market like -- like San Francisco? And if there were a bid, would you look to maybe allocate capital out of there? And then Doug, one thing I wanted to clarify real quickly on your leasing comment. I think you said 39% of the leases this quarter came from renewals, some of which took the same amount of space versus some now they're downsized. What percentage took the same space versus downsized? Thank you."
"30","Douglas T. Linde","President and Director at Boston Properties","So, Michael, I don't have all the data in front of me, I might -- when I actually looked at the other day in terms of the number of tenants, there were two or three tenants they downsized, but they were larger. I mean, the biggest example being, we had Zillow's plus Trulia which renewed on two out of six floors at 535 Market Suite, but there are one or two tenants like that. The majority in terms of the number of tenants that signed leases that did renewals actually we're staying in basically the same number of square feet."
"31","Owen D. Thomas","Chairman and Chief Executive Officer at Boston Properties","And then it's Owen to answer your question about West Coast and capital allocation. You're right, the West Coast is lagging from a return to office perspective and also from a leasing perspective is driven by the fact that there is a much higher percentage of technology users in those markets and those users are not using our office to the same extent their industries are, and so far they've led other industries in terms of the layoffs, which impacts space use as we've described.

Look, we're going through a cycle and the word cycle means it goes down and it comes back up. This has happened before. Our recycle is different, but they all look somewhat the same. And I'm convinced this is a cycle as well and we will have a recovery, and I think the technology industries, the institutions that exist in California are not going to go away, but we -- we are going to have to work ourselves through the recovery that we see ahead."
"32","Douglas T. Linde","President and Director at Boston Properties","Michael, one thing I'd like to add is on the kind of tenants expanding versus contracting. We have done an analysis of the rent leases that commenced in 2022 for renewals and we had about 4 million square feet of leases that commenced. And we had actually those tenants expanded by 6% or almost 300,000 square feet. In the fourth quarter there was a reduction of about 100,000 square feet. But overall, you know some expand, some contracting. Again, this is only tenants that renewed in our portfolio or they took on additional space before their lease came up, it doesn't have -- it doesn't count tenants that either left our portfolio and I don't know what they did before that or they came into our portfolio and we don't know what their size was before that. But that's a signal that not every tenant is contracting. There's many tenants out there that are continuing to take more space."
"33","Operator",NA,"Thank you. And I show our next question comes from the line of Rich Anderson from SMBC. Please go ahead."
"34","Richard Anderson","Analyst at SMBC","Thanks, good morning. If I could just play a little devil's advocate on the premier office, excuse me, premier workspace. Motif that you're talking about here. In a deep recession type of environment, is it potentially an outcome where you could see a reversal of the trends that you're seeing relative to conventional, more cookie-cutter office where people are looking for cheaper alternatives and maybe your premier office product becomes more vulnerable in deep recession type of scenario. Is that something that has happened -- clearly has happened in the past. What gives you comfort that that won't be an outcome for you this time around?"
