"","speaker","title","msg"
"1","Operator",NA,"Good morning, everyone, and welcome to the Citizens Financial Group Second Quarter 2023 Earnings Conference Call. My name is Allan and I'll be your operator today. [Operator Instruction] Now, I will turn the call over to Kristin Silberberg, Executive Vice-President, Investor Relations. Kristin, you may begin."
"2","Kristin Silberberg","Executive Vice President, Investor Relations at Citizens Financial Group","Thank you, Allan. Good morning, everyone, and thank you for joining us. First, this morning, our Chairman and CEO, Bruce Van Saun; and CFO, John Woods will provide an overview of our second-quarter results. Brendan Coughlin, Head of Consumer Banking; and Don McCree, Head of Commercial Banking are also here to provide additional color. We will be referencing our second-quarter earnings presentation located on our Investor Relations website. After the presentation, we will be happy to take questions. Our comments today will include forward-looking statements, which are subject to risks and uncertainties, that may cause our results to differ materially from expectations.

These are outlined for your overview on page 2 of the presentation. We also referenced non-GAAP financial measures so it's important to review our GAAP results on page 3 of the presentation and the reconciliations in the appendix and with that, I'll hand over to you, Bruce."
"3","Bruce Van Saun","Chairman and CEO at Citizens Financial Group","Thanks, Kristin. And good morning, everyone. Thanks for joining our call today. The turbulent external environment continued in the second-quarter, but we continue to navigate well and we delivered solid financial performance. In particular, we're pleased with the strong results we achieved around capital, liquidity, and funding. Our CET1 ratio grew by 30 basis-points to 10.3% in the quarter and we were able to repurchase in excess of $250 million in stock. We grew spot deposits by 3% or $5.5 billion and our spot loan-to-deposit ratio improved to 85%. Our Federal Home Loan Bank borrowings dropped by $7 billion to $5 billion and contingent liquidity grew by 20% to $79 billion.

For the quarter, we posted underlying earnings per share of $1.04 and ROTCE of 13.9%. NII was down 3% reflecting higher funding costs in line with our expectations. Non-interest income grew 4%, slightly less-than-expected as capital markets saw a few deals pushed to the third quarter. Expenses were broadly stable as expected and credit costs continue to be manageable. One of the highlights for the second-quarter was the opportunity to secure a significant influx of talent, largely from the First Republic platform to meaningfully augment our Citizens private bank and wealth management business. While expense investments will lead revenues in 2023, we protect the business to be accretive in 2024 and significantly profitable in the medium-term. In our presentation this morning, we will highlight this initiatives in more detail.

We'll also review several other compelling initiatives that we believe will lead to strong medium-term outperformance. Execution of these initiatives continues to be strong. We're setting up a non-core run-off portfolio as a centerpiece of intensified balance sheet optimization efforts. We expect around $9 billion of loan run-off, largely in auto by the end of 2025. This capacity will be utilized to fund more strategic bond portfolios to pay down high-cost debt and to build cash and securities. In parallel, the Private Bank will grow loans over this period by $9 billion, which will be funded by $11 billion of incremental deposits.

The net benefit of all of this is a better deployment of capital, along with positive impact on earnings per share, ROTCE, and liquidity. We've also included more detail on our CRE loan portfolio. Our general office reserve is now at 8%. While we continue to see increases in criticized assets and charge-offs in this particular portfolio, we believe losses are manageable and readily absorbed by reserves and our strong capital position. Looking-forward, we anticipate that the environment while stabilizing will continue to be challenging.

Our net interest margin will decline again in Q3, given higher funding costs. We expect our terminal data to reach 49% to 50% at year end. Our fees should continue to grow sequentially, expenses will be well-controlled and credit should be broadly stable. We will further build our CET1 ratio, while continuing to repurchase shares. Overall, we're holding in okay on current-period performance with mid-teens ROTCE in 2023, while making the investments to deliver a stronger franchise, attractive growth and returns, and afforded by balance sheet over the medium-term.

We continue to build a great bank and we remain very excited about our future. Our capital strength and our attractive franchise position us to attract terrific talent and to take advantage of opportunities as they arise. With that let me turn it over to John to take you through more of the financial details. John?"
