"","speaker","title","msg"
"1","Operator",NA,"Good morning. My name is Katie, and I will be your conference facilitator today. Welcome to Chevron's Second Quarter 2023 Earnings Conference Call. [Operator Instructions] As a reminder, this conference call is being recorded.

I will now turn the conference call over to General Manager of Investor Relations of Chevron Corporation, Mr. Jake Spiering. Please go ahead."
"2","Jake Spiering","General Manager, Investor Relations at Chevron","Thank you, Katie. Welcome to Chevron's second quarter 2023 earnings conference call and webcast. I'm Jake Spiering, General Manager, Investor Relations.

Our Chairman and CEO, Mike Wirth and CFO, Pierre Breber, are on the call with me today. We will refer to slides and prepared remarks that are available on Chevron's website.

Before we begin, please be reminded that this presentation contains estimates, projections and other forward-looking statements. Please review the cautionary statement on Slide 2.

Now, I will turn it over to Mike."
"3","Michael K. Wirth","Chief Executive Officer & Chairman of the Board at Chevron","Thanks, Jake, and thank you, everyone, for joining us today. Earlier this week, we announced several senior leadership changes, including Pierre's plans to retire next year, along with second quarter performance highlights.

In a few minutes, Pierre will share more details on our financials, which included return on capital employed greater than 12% for the eighth consecutive quarter and another quarterly record in shareholder distributions, more than $7 billion.

At TCO, we're making good progress with commissioning and pre start-up activities, including introducing fuel gas to new facilities. In the third quarter, we expect mechanical completion for the future growth project and to complete a major turnaround. Cost and scheduled guidance is unchanged.

Conversion of the field from high pressure to low pressure is expected to begin late this year and FGP is on track to start up by mid next year. We have unused contingency, which gives us confidence that we'll complete the project within the total budget.

After completion of these projects, TCO is expected to deliver production greater than 1 million barrels of oil equivalent per day and generate about $5 billion of free cash flow, Chevron share at $60 Brent in 2025. Chevron's Permian production set another record in the second quarter, about 5% above the previous quarterly high.

We expect next quarter's production to be roughly flat before growing again in the fourth quarter, on track with our full year guidance. Early 2023 well performance in our company-operated assets in all three areas is consistent with our plans. In New Mexico, we've put on production at 10 wells. Before year-end, we expect to pop an additional 30 wells with higher expected production rates. As a reminder, about half of Chevron's production is company operated with a balanced non-operated and royalty production.

While short-term well performance is one measure, we're focused on maximizing value from our unique, large resource base expected to deliver decades of high-return production. Over the next five years, we expect to develop over 2,200 net new wells, growing production while delivering return on capital employed near 30% and free cash flow greater than $5 billion in 2027 at $60 Brent.

Longer term, we've identified well over 6,000 economic net well locations that support a plateau greater than 1 million barrels per day through the end of next decade. Our deep resource inventory and advantaged royalty position allow us to optimize our development plans for high returns, incorporating learnings and technology improvements as we expect to deliver strong free cash flow for years to come.

In the Deepwater Gulf of Mexico, the floating production unit anchor is on location and the project remains on track for first oil next year. We continue to build on our exploration success and were awarded the highest number of blocks in the most recent lease round. In the Eastern Med, our Aphrodite appraisal well in Cyprus met our expectations and we've submitted a development concept to the government.

At Leviathan, we're expanding pipeline capacity to nearly 1.4 Bcf per day. We expect to close our PDC Energy -- our acquisition of PDC Energy in August after their shareholder vote next week. Our teams are working on integration plans, and we look forward to welcoming PDC's talented employees to Chevron.

Now, over to Pierre."
"4","Pierre R. Breber","Vice President and Chief Financial Officer at Chevron","As Mike said, strong, consistent financial performance enabled Chevron to return record cash to shareholders this quarter while also investing within our capex budget and paying down debt. Working capital lowered cash flow primarily due to true-up tax payments outside the U.S. Excluding tax payments, working capital movements are variable. Our typical pattern in the second half of the year is to draw down working capital.

Chevron's net debt ratio ended the quarter at 7%, significantly below the low end of our guidance range. Surplus cash on the balance sheet was reduced during the quarter with cash balances ending at $9.6 billion, well above the cash required to run the company.

Adjusted second quarter earnings were down $5.6 billion versus the same quarter last year. Adjusted upstream earnings were lower mainly due to realizations, partly offset by higher liftings. Other includes primarily favorable tax items and income from Venezuela non-equity investments. Adjusted downstream earnings decreased primarily due to lower refining margins. Opex was up mainly due to higher transportation costs and the inclusion of REG.

Compared with last quarter, adjusted earnings were down $900 million. Adjusted upstream earnings decreased primarily due to lower realizations. This was partially offset by higher production in the U.S. and non-recurring tax benefits. Adjusted downstream earnings were down modestly. Lower margins were partially offset with higher volumes.

Second quarter oil equivalent production was down about 20,000 barrels per day from last quarter primarily due to planned turnarounds at Gorgon and in the Gulf of Mexico and downtime associated with the Canadian wildfires. This was mostly offset by growth in the Permian.

Now, looking ahead, in the third quarter, we have a planned turnaround at TCO and a planned pit stop at Gorgon completed earlier this week. Our full year production outlook is trending near the low end of the annual guidance range.

Since PDC's proxy solicitation on July 7, we've not been permitted to buy back our shares. After we closed the acquisition in August, we plan to resume buybacks at the $17.5 billion annual rate, which we expect to continue through the fourth quarter. We do not expect a dividend from TCO until the fourth quarter. Full year affiliate dividends are expected to be near the low end of our guidance.

Putting it all together, we delivered another quarter with solid financial results, strong project execution and continued return of cash to shareholders. Our approach is consistent and you can see that in our actions and results.

Back to you, Jake."
"5","Jake Spiering","General Manager, Investor Relations at Chevron","That concludes our prepared remarks. We're now take your questions. Please limit yourself to one question and one follow-up. We'll do our best to get all of your questions answered. Katie, please open the lines."
"6","Operator",NA,"Thank you. [Operator Instructions] Our first question comes from John Royall with JP Morgan."
"7","John Royall","Analyst at JP Morgan Cazenove","Hi, good morning and glad to be the first on this call to congratulate Pierre on his retirement. So, my first question is on upstream production. Can you bridge us maybe from the midpoint of your production guidance to the low end that you mentioned in the opening. Sounds like the Permian is on plan. So what pieces have come in below the midpoint of plan to move to that well end?"
"8","Michael K. Wirth","Chief Executive Officer & Chairman of the Board at Chevron","Yeah, John. We're -- guidance remains unchanged. We expect to be at the lower end of that. And as we said, Permian production has been strong. The things that Pierre mentioned, I think, are the key things that we've seen. There's been some impact of fires in Canada that have impacted our ability -- not really our operations per se, we did some evacuations on a precautionary basis, but it was mid-stream and processing downtime that we weren't able to move our production to market.

And the rest of it is -- oh, and Benchamas 2, I guess, is the other one. We have an FPSO in Thailand that had an incident and early in the year was taken off station. And so that's another 10,000 or 11,000 barrels a day net, which is off for the foreseeable future. And so, it's really those two things are the ones that are pushing us down that were both unexpected."
"9","John Royall","Analyst at JP Morgan Cazenove","Great, thanks, Mike. And then, my next question is just sticking to production, but just drilling in a bit on the Permian. The well results generally looked very strong in the first half, but still a bit below 2022 in New Mexico. Maybe you can just update us on what inning you think you're in just in terms of optimizing the single bench developments in New Mexico?"
"10","Michael K. Wirth","Chief Executive Officer & Chairman of the Board at Chevron","Yeah. So, the thing that I think is important to bear in mind is that New Mexico type curve we showed there, there are only 10 POPs represented or 10 POPs that we achieved, all in the second quarter there. So there's no first quarter POPs. And there's only seven that actually had enough data to make it into the curve you see on the chart. So it's a very thin set of data. We expect 30 more POPs in the second half of this year. So the bulk of the program is not represented in those curves.

And there's a couple of other things. One, the wells we did POP have had some facility constraints that have limited full productivity. So, we actually haven't been able to move all the production due to some third-party facility constraints that we faced. And the rest of the program is actually in a different part of the New Mexico portion of the Delaware where we expect higher productivity. So, it's a combination of things, but I really -- I'd caution you not to over index on a very thin data set with a lot more data to come in the second half of the year."
"11","Operator",NA,"Thank you. We'll go next to Devin McDermott with Morgan Stanley."
"12","Devin McDermott","Analyst at Morgan Stanley","Hey, good morning. Thanks for taking my question. And Pierre, congrats on the retirement. So, I wanted to just stick with the Permian since we're on that topic. I was wondering if you could talk a little bit just around the mix trend you're seeing there. And if we disaggregate the productivity a little bit further, you talk about how much of the uplift is coming from gas and NGLs versus oil? And then similarly, as you progress towards some of your longer-term production goals, how you expect the mix in the basin for you to trend oil, gas, NGLs over time?"
"13","Michael K. Wirth","Chief Executive Officer & Chairman of the Board at Chevron","Yes, Devin, we're still drilling primary benches so we can optimize the oil cut. Across the basin, our production remains roughly 50% oil, 25% NGLs, 25% gas. We look at all the commodities, oil, NGLs and gas and have our own long-term views on prices and markets to run the economics, to optimize to returns, and the gas oil ratio in aggregate has been relatively flat for a number of years and we don't see it changing a lot. It can vary a little bit in different parts of the basin. But if you take it for our whole portfolio, that 50%, 25%, 25% remains a pretty good way for you to think about it."
"14","Devin McDermott","Analyst at Morgan Stanley","Okay, great. And then, I wanted to shift over to TCO. Good to hear the continued positive progress there as we get closer to the finish line. There's a lot of moving pieces over the next year, year-and-a-half as we get the two phases of development online, you give the guidance for the turnaround impact in 3Q.

I was wondering if you could talk a little bit more about how you see the evolution of production into the fourth quarter of this year and then through 2024 as we get to that 2025 run rate, so shape it a bit for us as we look out over the next few quarters."
"15","Michael K. Wirth","Chief Executive Officer & Chairman of the Board at Chevron","Yes. So the headline here is no change to cost and schedule, I think that's really important. In the second quarter, we made really good progress. As we said, 98% project completion and commissioning is essentially two-thirds complete. In the second quarter, we achieved mechanical completion of the 3GI gas injection facilities and got fuel gas into the flare system, which is very important to enable an on-time startup of FGP.

In the quarter that we're in now in, the third quarter, we expect full mechanical completion of the future growth project and also a turnaround at one of the complex technology lines or KTLs. We'll begin a lot of work and start up on utility systems, boilers, steam system, other utilities that are required for a start-up with a pressure boost facility, which is the key driver of WPMP, which enables us to convert from high pressure to low pressure across the field.

Once that that turnaround is done in the third quarter, and you will see some production impact, I think Pierre guided to that. We expect to have two of the four big pressure boost compressors online, which allows us to begin the conversion of metering stations from high pressure to low pressure, and that will initiate -- we'll get that started at the end of this year. It will take 10 to 12 months for all of those conversions to occur.

Next year, there will be turnarounds. Next year as well, two more turnarounds, one at SGI and another one in one of KTLs and all of that is part of a very carefully choreographed sequencing of turnarounds and start-up activity that will bring the full field, so the million barrels a day for 2025.

So, as we indicated at our Investor Day, what you're going to see in '23 and '24 is the normal turnaround activity interlaced with all of this project start-up activity. This is not as simple as bringing on a new portion of the field, really reworking the entire gathering and producing capacity of the field. And so, it's quite a complex series of activities to execute all of that. And so the production reflects that. And we've put, I think in set, in earnings deck, a chart to kind of give you some guidance for both this year and next year."
"16","Pierre R. Breber","Vice President and Chief Financial Officer at Chevron","Yeah, slide 10 from our set has annual production '23, '24, '25. No change in that guidance."
"17","Operator",NA,"Thank you. We'll go next to Neil Mehta with Goldman Sachs."
"18","Neil Mehta","Analyst at The Goldman Sachs Group","Yeah, good morning team. I want to stay on TCO and while there will be a volume inflection in '25, there's probably going to be a free cash flow inflection in 2024, just as affiliate capex rolls off first. And so just can you talk about the cadence of that and how it manifests itself in terms of dividends?"
"19","Pierre R. Breber","Vice President and Chief Financial Officer at Chevron","Yeah, we've been guiding -- Neil, it's Pierre, to the clean year because that's the $5 billion of free cash flow at $60 Brent in 2025. And of course, regarding the free cash flow because as you recall, it's not just dividends, it's also repayment of the loans and the co-lending that we have done along the way and the profile of those loans are disclosed in our SEC filings.

I mean you will see -- exactly to your point, you'll see a build towards that just as the capex has rolled off. It was not, not that long ago, we were investing $3 billion to $4 billion a year, our share into the project, and that's down to $1.5 billion or so this year and will continue to trend down. So there's that inflection point.

What's also being managed, of course, our commodity prices and those vary. And as we've said, TCO continues to be conservative in managing its balance sheet. But as the -- so it's been holding more cash on the balance sheet. As the project gets closer to the end, as we've demonstrated that TPC is running very reliably now for almost 1.5 years, we expect some of that cash to come on.

So I can't get in front of the board of directors of TCO. It's a separate company that we are a shareholder in, but we expect, as we said, a much bigger dividend in the fourth quarter than we saw in 2Q, and we expect to see a release of some of that surplus cash that's been held on the balance sheet, and that will continue over the next couple of years as we head into that $5 billion of free cash flow in '25.

And maybe the last thing, Neil, I know you know this, TCO has really good price sensitivity. So I've seen yours and other estimates, at $70 million or $80 million, the cash flow is even stronger."
"20","Neil Mehta","Analyst at The Goldman Sachs Group","Thanks. Thanks, Pierre. That was great. And the follow-up is just on the return of capital. I think you have a big buyback range, a lot of market participants have kind of viewed your $17.5 billion as the P50 outcome in any reasonable commodity price environment. And so, thinking less of it like a flywheel and more as sort of a relatively fixed number unless commodity prices go wacky. Just any thoughts on that statement and whether you -- you're trying to give us a little bit more a surety around that number as opposed to a more volatile number."
"21","Pierre R. Breber","Vice President and Chief Financial Officer at Chevron","Yeah. The range, Neil, is tied to the upside, downside cases that we showed at our Investor Day roughly, right? So this $10 billion to $20 billion. So you're right, it's a wide range because it reflects a wide range of prices between that upside case and the downside case. And of course, in between, there's sort of a mid-cycle case. As a reminder, that downside case gets to $50 in a couple of years and stays there for three years.

So that is the real downside case. And that's what the low end of the buyback range is notionally tied to. The upside case is a case that's not too different from what we're seeing now. It averages about $85 over the five-year period, it trends down to $70 towards the end of that period, and that's why you're seeing a buyback very close to the top end of the range at the $17.5 billion.

So it's certainly a signal that as we look out over this commodity cycle, and again, we think of the buybacks as being steady across a cycle that we feel good about it. So, we said we could do a much larger buyback, but that would be not steady, and we want to be -- we don't want to be procyclical. We're trying to be across the cycle. And so, yes, when we guide on buybacks, we're guiding with the intent of maintaining it for a number of years across the cycle."
"22","Michael K. Wirth","Chief Executive Officer & Chairman of the Board at Chevron","Yeah. And Neil, I would just add, you see in our second quarter results, our net debt remains very, very low, and we've indicated multiple times that we don't have a problem gearing back up and putting more debt on the balance sheet to get back towards the range that we've guided to through the cycle in order to sustain a very steady share repurchase program."
"23","Operator",NA,"Thank you. We'll go next to Stephen Richardson with Evercore ISI."
"24","Stephen Richardson","Analyst at Evercore ISI","Thanks. Good morning. Mike, I was wondering if you could talk little bit about new energies. I think you've been clear from the beginning that build versus buy was part of the consideration in a lot of these businesses. We saw a big CO2 pipeline and EOR company transact recently. So maybe you can talk a little bit about the CCUS business as you view it and why build versus buy is maybe the better choice for Chevron? And then, maybe I'd just get ahead of it with a follow-up is, maybe you could give us a little bit of an update on Bayou Bend, please."
"25","Michael K. Wirth","Chief Executive Officer & Chairman of the Board at Chevron","Sure. Why don't -- I'll put those two together, actually. Look, we'll do both build and buy, I think, in new energies. I would fully expect us to do that in renewable fuels. We have built a business, but then we also went out and acquired Renewable Energy Group. So I think you'll see both.

Certainly, the Denbury transaction is one that the market somewhat anticipated, and you can presume that multiple market players probably took a look at or had conversations with Denbury. For us, in CCUS, we look for areas that have good geology or pore space, their near concentrated emissions and have the right policy support to enable a business. The Gulf Coast has all of these things.

And Bayou Bend, we've got about 140,000 acres of permanent CO2 pore space, both onshore and offshore. We've got storage potential there of greater than a 1 billion metric tons. In the second half of this year, we're going to drill a strat well in the offshore acreage to further delineate and characterize the subsurface. In the first part of next year, we expect to drill a strat well in the onshore acreage and do the same.

And of course, we're in conversations with a number of customers in that region in the Golden Triangle, up at Mont Belvieu, all the way across the Houston Ship Channel. And we've got term sheets going back and forth. We're in negotiations with a number of different potential customers. The commercial framework for this is still evolving. And we're working on the other pieces you need.

So classics, well-injection permits, and midstream assets, we've got an RFP out right now, with a number of midstream providers, consistent with the way we have generally approached the midstream. We own assets if they're strategic. If there's a way for us to go to somebody who is in the business of operating -- building and operating midstream infrastructure, we certainly look at that as well.

So we're putting all the pieces together there for a phased development. We like the Bayou Bend project, and we'll report more. But to your kind of underlying question, we'll build organically and we'll do inorganic where it makes sense. Thank you."
"26","Stephen Richardson","Analyst at Evercore ISI","Great. Thanks very much."
"27","Operator",NA,"Thank you. We'll take our next question from Biraj Borkhataria with RBC."
"28","Biraj Borkhataria","Analyst at RBC Capital Markets","Hi, thanks for taking my questions, and Pierre, best of luck with retirement. My first one is on portfolio concentration. So at your Analyst Day, you talked about just over $20 billion of free cash flow at $60 a barrel. And looking through today's slides, roughly half of that in the medium term will come from the Permian plus TCO. So I understand that you want every dollar to go to the highest level of return, which is completely sensible.

But I was wondering if you can talk about portfolio concentration because it is quite unusual for a super major to have that level of concentration in terms of free cash flow. So how do you think about portfolio diversity? And is this something you're actively trying to address going forward? And I've got a follow-up on a different topic."
"29","Michael K. Wirth","Chief Executive Officer & Chairman of the Board at Chevron","Yeah, Biraj, if you look back over the last decade, we've cleaned up our portfolio. We had a lot of assets that were kind of at the smaller end of the tail that pulled capital and management time and resources. And we want to be diversified. We've got a diverse portfolio. But we don't need to be diversified just for the sake of it. We want to have assets that have scale, that are material and long lived.

You can start in the Far East and look at our LNG positions in Australia, which aren't drawing a lot of capital right now, but are throwing off a lot of cash. We've got a strong position in West Africa that we strengthened with the Noble acquisition and the EG assets that can feed LNG into Europe.

Obviously, you mentioned TCO. The Eastern Med is a very strong position. We've recently taken FID and are working on expansion projects for Tamar, Leviathan, and have submitted a concept on Aphrodite. So there's a lot of opportunity in that asset. When we close PDC, we're going to be producing 400,000 barrels a day in the DJ Basin.

We've talked about some of our other shale and tight assets in Argentina. In Canada, we've got two crackers underway in CPChem that will come online middle of this decade; one in the U.S., one in the Middle East. We've acquired REG and are growing our renewable fuels business. So, we have exposure across a large portfolio.

And then of course, we also have projects coming online in the Gulf of Mexico. I mentioned Anchor earlier, Whale, Ballymore, and we recently acquired more leases in this recent lease sale than the -- twice as many leases as in the biggest lease sale over the last eight years. So, we're adding to our position in the Gulf of Mexico.

So this idea that we're a two asset company with Permian and TCO, I don't think really stands up to careful inspection. They're two great assets, and so they get a lot of attention, but we've got a lot of other strong assets in our portfolio."
