"","speaker","title","msg"
"30","Pierre R. Breber","Vice President and Chief Financial Officer at Chevron","Hey, if I can just build off that and go to the return of capital question that Neil asked and that's what gives us confidence not only on the buyback, but on the track record of dividend growth. So, we guided to 10% annual free cash flow coming from all of those businesses. Some are holding cash constant, some are growing cash flow that Mike covered, and that goes to leading dividend growth, where we've grown the dividend over the last five years at rates double our closest peer and much higher than others, and where we have a buyback that is nearly 6% of our shares outstanding annually.

Our business is built for $50. So part of the confidence in our ability currently, if you look at our breakeven and adjust for working capital this quarter, if you look at the last four quarters, it's actually probably a little bit lower than that with the strong refining margins that we've been seeing. So we're built for lower prices. Free cash flow is going to grow from this base. That should give investors' confidence in our ability to continue to grow the dividend at leading rates and to maintain buybacks at also very high rates."
"31","Biraj Borkhataria","Analyst at RBC Capital Markets","I've got -- just a follow-up on a different question. Through the Permian, you'll be producing a lot more gas over time and you have expressed the desire to grow in LNG. So, you've signed a couple of deals as an offtaker to synthetically integrate your U.S. gas position to global markets. I wanted to ask about the sort of -- whether you'd be interested in owning liquefaction or whether you feel being an offtaker is enough because some of your peers have argued the benefits of integration and owning through the value chain.

But I think in the past, you've noticed the returns are typically lower. And I'm particularly interested in asking that question now because a number of players have signed offtake agreements with companies such as Venture Global, and then actually they're not receiving the gas as agreed. So just interesting how you're thinking about that sort of value chain in LNG? Thanks."
"32","Michael K. Wirth","Chief Executive Officer & Chairman of the Board at Chevron","Yeah. I mean, it's consistent with what we've described earlier, and I think you've captured it. It depends on the circumstance. In places where we've got remote gas where you need to be in the entire value chain and you can create an economic model that supports the investments, we've done that.

In other locations where you've got other people that will put capital into the midstream assets, and we can sell gas into that, we can offtake gas off of it, but not participate in some of the very capital intensive and lower return portions of the value chain. That's certainly a model that helps us support our aspiration to drive higher returns.

Now you have to have good partners, you have to have reliable operations, and we'll work closely with the companies that we have offtake with. We vet them carefully and we have confidence in the people that we are working with to provide those reliable operations, but we're really looking to drive high returns, not necessarily to own assets for the sake of control unless it creates a differentiated value proposition."
"33","Operator",NA,"Thank you. We'll take our next question from Sam Margolin with Wolfe Research."
"34","Michael K. Wirth","Chief Executive Officer & Chairman of the Board at Chevron","Good morning Sam."
"35","Sam Margolin","Analyst at Wolfe Research","Hello. [Technical Issues]"
"36","Michael K. Wirth","Chief Executive Officer & Chairman of the Board at Chevron","Hey, Sam, you're breaking up."
"37","Sam Margolin","Analyst at Wolfe Research","The question is on the cash balance. It looks like, nominally, it's drawn down, but it feels -- there's some inputs that would theoretically help it rebuild in the second half. You've got working capital and I think TCO is going to pay a dividend in third quarter, and PDC had a very front-loaded capital program too. So, that's coming on with free cash. So just wondering about the cash balance and how you think about the level or if we're going to be in a rebuild phase for 2H?"
"38","Pierre R. Breber","Vice President and Chief Financial Officer at Chevron","Well, the direction that it goes depends, of course, on commodity prices and margins and a number of other factors. You're right, our cash levels have come down, in part due to working capital outflows, timing of affiliate dividends, and we've also paid down some debt.

We've been, I think, very clear that we don't want to hold surplus cash, certainly not permanently, that it's where the cash goes in the short term. But over time, that cash is going to be returned to our shareholders in the form of this growing dividend and ratable buyback program. So, we need only about $5 billion to support our operations. We're nearly $10 billion at the end of the second quarter. So that's more than sufficient.

We have access to lots of liquidity. We don't have any commercial paper now. Again, we've been paying down debt. So, that's the more economically efficient way to manage the balance sheet if we get there, and whether the cash balance goes up or down, again depends on all the inputs and outputs that we've been showing.

We're guiding towards a net debt, as Mike said, the net debt is well below the low end of our guidance range. So, we look at all those factors. And again, if cash balances head down to $5 billion, that will adequate to cover the operations.

On working capital, our pattern in the second half of the year is that we tend to see some draws on it. But we're certainly not going to recover from what we see in this first half of the year. A big portion of what we saw in the first half of this year on working capital are really tax payments tied to earnings last year. So you can kind of think of those as being offset from last year where we had -- where we had that favorable working capital environment.

So, there'll be ups and downs along the way. Over time, working capital tends to average out over zero. But these are just timing effects. We look through them. We knew we were -- had taxes due. And so, that's all part of the planning as we look at the balance sheet."
"39","Michael K. Wirth","Chief Executive Officer & Chairman of the Board at Chevron","And Sam, I guess that we've guided to a TCO dividend in the fourth quarter. We do not expect a dividend in the third quarter."
"40","Sam Margolin","Analyst at Wolfe Research","Got it. Okay. Sorry, I must have misread that remark. The follow- up is actually sort of on the organization. It's a follow-up to Steve's question earlier. But Pierre had spent some time in an ESG role and in a low carbon role. And the incoming CFO is coming from a role where there was a lot of work on the ground on the low carbon front, on the technology side. And so, Chevron has this really interesting sort of marriage between finance and low carbon that I think is differentiated when you look at some of the peers.

And so the question is, as we make progress through the low carbon development, do you feel like you're embedded in the highest return areas or are there other ones where capital is going to maybe pivot, and I think that ties into carbon capture too because that seems like a place where the incentives are pretty transparent?"
"41","Michael K. Wirth","Chief Executive Officer & Chairman of the Board at Chevron","Yes, Sam. So I think your question started with people and ended up kind of at our kind of investment priorities in new energies. Look, across the entire leadership team, we've got a commitment to driving higher returns and lower carbon, and people move through different kinds of roles. But this is part of every role in the company today. So, it's a part of the business. It's something we're committed to.

Our focus is, as we've said before, it's on things where we can leverage our unique capabilities, assets, value chains, customers, to create sustainable, competitive advantage in these new energy businesses. It's why we've not gone into wind and solar on a merchant basis because there's others that can do that and we don't really bring anything unique there.

Our renewable fuels business today is profitable and generating cash. We expect to start up the Geismar expansion and be producing more renewable diesel next year. So, that's a business today that is economic and attractive, and we continue to grow, particularly back into the feedstock side. We announced an acquisition this last quarter of a small company that's got some interesting feedstock technology.

Carbon capture and storage, obviously, is being built. We do it today in some assets. But as a business, we're building out Bayou Bend, I talked about. We're working on projects in other parts of the world as well. And we do believe that with the right technology, the right business model and policy environment that there is an opportunity there.

Other things that we're working on, hydrogen is one that's both electrolytic hydrogen and then traditional hydrogen paired with carbon capture and storage. In the U.S., the IRA incentives can certainly support the development of business models there. So I think we'll stay consistent with this. We're looking at -- always looking at new technologies, but the area we're focused on is the primary area you should expect to see us investing."
"42","Operator",NA,"Thank you. We'll go next to Jason Gabelman with TD Cowen."
"43","Jason Gabelman","Analyst at TD Cowen","Hey, good morning. And, Pierre, congrats on your retirement. I'd like to go back to the Permian detail for a minute, if I could, and kind of two questions on this. First, has capex in the Permian deviated at all from that $4 billion budget that you highlighted at the Analyst Day?

And then the second part, on the Permian inventory over the five year plan and long term, how much -- what percentage of those locations would you categorize as Tier 1? Thanks."
"44","Michael K. Wirth","Chief Executive Officer & Chairman of the Board at Chevron","Yeah, Jason, Permian capex is up a little bit this year. Primarily three things. Number one, we've actually seen drilling performance continue to improve and completions performance continue to improve. So, out of the same fleet of rigs and completion spreads, we're getting more work done, which means you consume more tubulars, more sands, more water, etc. So, that's kind of a good thing.

We're seeing some longer lead times on some of the critical elements in facilities. And so, we've actually had to make some long lead purchases for next year's program that we didn't anticipate as we were lining up this year's program. And then, we've increased facility scope for water handling in some areas of the Permian, particularly as we're trying to manage some of these induced seismicity issues.

We're being more and more careful removing more water, and so that has all led to some increase in capex. Not a lot of inflation there. The inflation has been largely in line with what we had expected and the rig fleet is being activated in line with what we expected.

Your second question on inventory, we don't really -- we haven't broken our portfolio into tiers. There's not a very clear definition of that and a way to kind of do that on a standard basis. So, when we've outlined the drilling locations and the long-term guidance there, it's really based on economics. And we've got locations that are economic at our price view for the future, which has historically not been a super aggressive price view. It's based on today's technology.

And as indicated, we've got more than 6,000 locations in that outer time window that are economic, based on those assumptions. By the time we get to that window, we may or may not see a different price environment. I fully expect we'll see a different technology environment, which can allow that number to grow even further. So, we look at it more in terms of the economics of the development than tiers."
"45","Jason Gabelman","Analyst at TD Cowen","Great, thanks. And my follow-up, just going back to TCO. You made some comments on kind of maintenance effects over the next four quarters. And I know you showed it graphically. But are you able to quantify the actual impact to our production over the next four quarters from all these turnarounds and start-up activities?"
"46","Pierre R. Breber","Vice President and Chief Financial Officer at Chevron","Well, Jason, we do it quarterly, like it's included in the third quarter guidance that we provided, and we'll continue to do that quarterly and you're seeing it sort of annually, we're giving annual guidance on TCO. So it's all embedded in there. I think we showed it relative to '22, but there's just a lot of moving parts. But we'll continue to give that guidance each quarter and you have annual guidance that incorporates all of that."
"47","Operator",NA,"Thank you. We'll take our next question from Irene Himona with Societe Generale."
"48","Irene Himona","Analyst at Societe Generale","Thank you very much. My first question is on the Downstream, please, if you can talk around the performance of your chemicals affiliates, in particular in Q2, and then what you're seeing so far in the third quarter? And then, also what you would expect in terms of refining margin evolution in the second half of the year, given the weakness in Q2? Thank you."
"49","Michael K. Wirth","Chief Executive Officer & Chairman of the Board at Chevron","Yeah. So, the chemicals business is cyclical, as everybody knows. We're certainly in a period now where we're seeing some length in supply due to newbuild facilities. Some, you know some -- there is some length there that's weighed on margins in the olefins chain. And in the short-term, we think we're going to continue to see that'd be a pretty tough sector.

Longer term, as you get out to mid-decade and beyond, demand will continue to grow and we expect demand and supply will come into better balance, and we'll see those margins recover out towards the middle and second part of this this decade.

Your second question, I'm sorry, I was thinking about chemicals there and..."
"50","Irene Himona","Analyst at Societe Generale","On refining, the refining outlook."
"51","Michael K. Wirth","Chief Executive Officer & Chairman of the Board at Chevron","Oh margin, refining margins. Yeah, certainly, we've seen refining margins come off the very strong levels that they were at last year. There's been some new capacity come into the system around the world, some big new refineries that have begun to start up or major projects that have come online.

And so, margins have softened year-on-year. Certainly, the West Coast in our portfolio is important. West Coast margins, both in the refining and the marketing part of the value chain have held up a little bit better because it's a market that is a little bit more cut off from the rest of the world than the Gulf Coast or Asia. And so, demand continues to be pretty strong out there.

Gasoline demand is strong. Jet demand continues to come back. Diesel demand has maybe flattened out a little bit, but certainly holding. And so, we're in an environment where I would expect inventories are towards the lower end of the products in a number of parts of the world. I think refining margins for the second half of this year will be -- are likely to be as good as they were in the first half of the year at least."
"52","Irene Himona","Analyst at Societe Generale","Thank you. My follow-up is -- am I allowed a follow-up? Sorry."
"53","Michael K. Wirth","Chief Executive Officer & Chairman of the Board at Chevron","Yes, please go ahead."
"54","Irene Himona","Analyst at Societe Generale","Thank you. Just on the Eastern Med [Phonetic] -- thank you, on the Eastern Med, following your FID for the pipeline in Israel, I was wondering, is that it for the time being for Leviathan or do the partners continue to examine other options like FLNG, for example? Thank you."
"55","Michael K. Wirth","Chief Executive Officer & Chairman of the Board at Chevron","Yes. No, we continue to evaluate other options. In fact, we're working towards a concept select for the next expansion of Leviathan, ideally, at the end of this year, and floating LNG is one of the concepts that we continue to look at."
"56","Operator",NA,"Thank you. We'll go next to Ryan Todd with Piper Sandler."
"57","Ryan Todd","Analyst at Piper Sandler","Great. Thank you. Maybe if I could follow-up on some earlier Permian conversations. You talked a little bit about some of the New Mexico well performance. But on well performance overall that you disclosed, it appears that first half results are showing improved performance across much of the basin, as you expected. What have you seen to date in terms of addressing some -- I know you don't have a lot of data, but in terms of addressing some of the concerns from last year, particularly, what have you learned regarding spacing, single versus multi-bench approach, etc., on the wells that you've done so far this year?"
"58","Michael K. Wirth","Chief Executive Officer & Chairman of the Board at Chevron","Yeah. I mean, the performance is really consistent with our expectations and what we outlined at our Investor Day earlier this year, Ryan. There are a couple of things just to remember. I mentioned earlier that, in New Mexico, we saw some infrastructure and third-party constraints, and you can have that -- we've got that in some other parts of our portfolio as well.

So there are things that will show up on these curves that are not necessarily just a reflection of the geology and the well performance. And as we continue to change our development strategy on well spacing, proppant loading, well length, etc., those will continue to be reflected in these curves.

The thing that is really important is production -- we put production out there because everybody likes to see it. We're not optimizing the production. We're optimizing the returns. And so, fluid mix, EUR, capital investments are all important parts of what we're optimizing to. It's harder for you to see all the things that we're looking to optimize to drive returns when you're just looking at production. So -- but the high-level answer is performance in line with the expectations as we've continued to evolve our program."
"59","Ryan Todd","Analyst at Piper Sandler","Okay, thanks. And maybe if we turn to the Gulf of Mexico, as we think about your Gulf of Mexico deepwater portfolio, you've got an impressive string of project start-ups coming over the next few years. How exposed are you to escalating trends in deepwater drilling and development costs? As you look across those projects, do you have costs locked in across some of those projects, rigs under multi-year contracts, etc. or is this -- I guess, how much are you able to mitigate cost escalation as we think over kind of capex requirements over the next few years?"
"60","Pierre R. Breber","Vice President and Chief Financial Officer at Chevron","Yeah. Those projects were contracted at a different times. So, they reflect mostly locked in rates, as you'd expect. Procurements well behind us as we're getting -- as those projects are pretty far along. So new exploration activities, we'll get exposed to some of the higher rig rates on that, but for the existing major capital projects, that's largely locked in."
"61","Michael K. Wirth","Chief Executive Officer & Chairman of the Board at Chevron","We came into the year with three rigs under contracts that were contracted back in a different environment."
"62","Pierre R. Breber","Vice President and Chief Financial Officer at Chevron","Thank Ryan."
"63","Michael K. Wirth","Chief Executive Officer & Chairman of the Board at Chevron","Okay. We've got a handful of people still in the queue. Yeah."
"64","Operator",NA,"We'll go next to Paul Cheng with Scotiabank."
"65","Paul Cheng","Analyst at Scotiabank","Hey guys. Good morning. First want to wish Pierre to have an exciting and very happy post-retirement. Thank you for the help over the past 20-plus years. Maybe two questions, if I could, Mike. One, you're talking about you submit a development plan in Cyprus discovery, can you give us a little bit in terms of the timeline, what should we expect? And also that, what is the preliminary design of the development that's going to look like and the scale, and what kind of time that it's going to see the first oil?

The second question that you haven't talked much about, Argentina. And over there, the government seems to be pretty excited with the shale oil development, and you have a position there. Can you give us an update, what is your thinking over there? Thank you."
"66","Michael K. Wirth","Chief Executive Officer & Chairman of the Board at Chevron","Yeah, Paul, in Cyprus, we've -- we're pleased with the outcome of the recent appraisal well. We've submitted our development plan to the government for their approval and it involves a capital efficient way to take the gas to market via subsea tiebacks to existing infrastructure. But this is all pending government approval.

If we get that, we could be into FEED later this year. But it's a little early for us to really lay anything out on first gas. So as we get through the government approval process, we'll be back to talk to you about the timeline on that one.

On Argentina, we remain very positive on the resource there. There's an election coming up. The country has got its -- some kind of macroeconomic challenges that it's facing right now. But we like the block [Phonetic] particularly our El Trapial area where we're doing some more development work now with some increased capital that flows with that. And we'll talk to you about that at Investor Day and beyond. But no real changes there. It's going to be part of the growth story."
"67","Pierre R. Breber","Vice President and Chief Financial Officer at Chevron","Thanks Paul."
"68","Paul Cheng","Analyst at Scotiabank","Thank you."
"69","Operator",NA,"We'll go next to Doug Leggate with Bank of America."
"70","Doug Leggate","Analyst at Bank of America Securities","Thanks for getting me on, guys. Pierre, it's been a pleasure. Congratulations and good luck to everybody. And Mike to you as well on your extended tenure. Guys, my first question is on the Permian ratability. It looks like you've got about a couple of hundred POPs this year, wells to sales; 2,000 over the next five years. Is that ratable? How should we think about the step up in activity?"
"71","Pierre R. Breber","Vice President and Chief Financial Officer at Chevron","Just one thing, it's -- the co-op POPs is 200. But if you were to include net POPs, again, half of our portfolio is non-op and royalty, it'd be more like 300. So it looks more consistent, right. The long-term plateau in the well inventory, the 2,200 over the next five years, incorporates all of the activity and the POP data was just on company operate. So there is some increase, but not as large as it looks. You just got to get it apples-to-apples."
"72","Doug Leggate","Analyst at Bank of America Securities","But they're fairly ratable, Pierre, I mean, like 500 a year type of deal or 400 a year type of deal."
"73","Pierre R. Breber","Vice President and Chief Financial Officer at Chevron","Yeah. As we get up to activity, and as Mike said, we're becoming more efficient, as our other operators that we work with. Yeah, it's going to be pretty ratable once we get full -- up to our full rate activity."
"74","Michael K. Wirth","Chief Executive Officer & Chairman of the Board at Chevron","Yeah. And of course, Doug, quarter-to-quarter there is some variability as we saw first quarter to second quarter of this year. Third quarter is going to be a little -- so there can be some surges and plateaus quarter-to-quarter, but on an annual basis, yeah, it's going to be pretty ratable."
"75","Doug Leggate","Analyst at Bank of America Securities","That's helpful. Thank you. My follow-up, guys, is on Tengiz, but it's a slightly different question. I guess Pierre and I are similar vintage. You signed Tengiz in 1993. It expires six years after the end of your Analyst Day trajectory through 2027 and it's a quarter of your free cash flow.

So, my question is, what are your options there, whether it'd extended or replaced? And perhaps maybe some color on what the production profile looks like post 2027. [Indecipherable] has it going into fairly severe decline after 2030. So, just want to know what you're thinking about the long-term sustainability of those free cash flows?"
"76","Michael K. Wirth","Chief Executive Officer & Chairman of the Board at Chevron","Yeah. So the concession is a decade away. We're focused on delivering the project right now. This is a big, complex asset; a big, complex project. We'll certainly be in discussions with the government over time about potential extension of this. It'll reflect what we see in terms of reservoir performance and in production opportunities out into the future.

These concession discussions have to create value for the country and for Chevron. So we've got to find something that works for both parties. We've walked away from concessions, as you've covered extensively, Doug, where it didn't work for us, in places like Indonesia and Thailand. We've extended in places like Angola, where it did. So we'll be talking more about that over time. But, right now, we're really focused on project execution and delivering FGP."
"77","Doug Leggate","Analyst at Bank of America Securities","Thanks for that."
"78","Operator",NA,"Thank you. Our last question comes from Roger Read with Wells Fargo."
"79","Roger Read","Analyst at Wells Fargo & Company","Yeah, thanks. Good morning, everybody."
