"","speaker","title","msg"
"80","Michael K. Wirth","Chief Executive Officer & Chairman of the Board at Chevron","Good morning, Roger."
"81","Roger Read","Analyst at Wells Fargo & Company","I guess Mike, first question for you. With the extension of your tenure, are you willing to share with us what some of the things you're hoping to get done in the extra time will be or maybe what some of the real opportunities are here that you'd like to shepherd through?"
"82","Michael K. Wirth","Chief Executive Officer & Chairman of the Board at Chevron","Well, Roger, it's been a pretty turbulent first part of my tenure with a major restructuring, a pandemic and oil prices that collapsed, a war and oil prices that spiked, the political and geopolitical noise that comes with those things, the ongoing climate and ESG issues, three acquisitions, one of which we still haven't closed.

And so, I'm actually looking forward to a little smoother water, I hope, one day. And, look, we still got work to do to continue to drive higher returns and lower carbon. And so, it's to continue that work. We've got good momentum in our business. We've delivered strong results through all of that turbulence and have maintained strong shareholder distributions throughout and strategic consistency throughout where we've seen others in the industry buffeted around a little bit by these forces. And so, I'd like to continue that and to drive more value to our shareholders and higher returns and lower carbon."
"83","Roger Read","Analyst at Wells Fargo & Company","Alright. I commend you for not trying to duck out when things finally look good for at least a short time. My follow-up question is really much more on the modeling front. If we look at your realizations on oil, they were much stronger here in the second quarter. I think that contributed to some of the outperformance.

But what we really saw was a dip Q1 and an improvement in Q2, kind of back in line with traditional. So, I was just wondering, as we think about, you know was that a timing issue, a regional issue, first quarter, and anything you should -- we should be thinking about as we look at your realization or capture on oil prices going forward?"
"84","Pierre R. Breber","Vice President and Chief Financial Officer at Chevron","Hey Roger, our view that -- we've not quite picked that up. So why don't you follow up with Jake after the call and make sure we understand your question, and we'll do our best take on it. But our oil realizations have looked good and our natural gas realizations have looked strong. We had a little more -- we had better timing in the first quarter. So if you look quarter-on-quarter in some of our international gas, it might seem a little weaker. But not sure on liquids. So, please follow up with Jake."
"85","Jake Spiering","General Manager, Investor Relations at Chevron","Thanks Roger. I would like to thank everyone for your time today. We appreciate your interest in Chevron and your participation in today's call. Please stay safe and healthy. Katie, back to you."
"86","Operator",NA,"[Operator Closing Remarks]"
