"","speaker","title","msg"
"5","Jeffery Owen","Chief Executive Officer at Dollar General","Thank you, Kelly. We have a clear vision for the future of this company, which is to be a force for opportunity for our customers, employees, communities and shareholders. To bring this vision to life in the years ahead, we have developed a strategic framework to serve as our road map into the future. I want to briefly introduce this framework today and we'll provide further detail and updates in the quarters ahead.

We call this road map DG Forward, and it is focused on the powerful combination of execution and innovation. For us, our execution is driven by our operating priorities. While these priorities are not changing, we are going to sharpen our strategic focus in four key-ways.

First, we are going to focus even more on rural by doubling down on serving and providing our rural customers with what they need when they need it. This company was founded to serve the underserved, and today, approximately 80% of our stores, many of which are in rural America, serve communities with fewer than 20,000 residents.

Second, we are going to extend our reach. We will focus on expanding the DG universe by serving new customers through new formats or existing customers in new and differentiated ways.

Third, we are going to fuel our growth by strengthening and modernizing three critical components to improve execution; our operating model, our supply chain and our IT foundation. We will fuel our best-in-class growth by investing in resources to enable our team to execute at the highest levels to serve our customers.

The fourth and most important area of focus with DG Forward is that it's all powered by our people. We believe Dollar General is truly powered by the best team in retail, and we are leaning into three specific areas to double down on this strategic advantage; investing in our people and creating opportunities for growth and development, amplifying our culture and reinforcing Dollar General as a destination for starting, growing and enjoying a meaningful career where the work we do every day makes a difference.

This DG Forward framework is the lens through which we see the future of this company, and we are excited about what lies ahead. You will hear more from us in the quarters ahead about some of the innovation that is well underway, but I want to spend our last few minutes providing a quick update on how we are executing through our operating priorities.

Our first operating priority is driving profitable sales growth. We continue to focus on providing value to customers in non-consumable categories through our NCI offering in Dollar General stores as well as through the treasure hunt experience in our stand-alone pOpshelf format. During the quarter, we opened 24 new pOpshelf locations, bringing the total number of stores to 164 at the end of Q1, located in 16 states. While sales in this economic environment are softer than our earlier results, we continue to be pleased with the customer response.

Looking ahead, we are taking a balanced approach to opening the right number of new pOpshelf stores in the right locations in this environment and now expect to operate a total of approximately 230 stores by the end of 2023. As a result of our slower pace of openings, we are reevaluating our plans with regards to our timing of reaching 1,000 stores by the end of 2025 and plan to provide an updated expectation at a later date. Importantly, we still believe pOpshelf adds approximately 3,000 opportunities to our total addressable market over the long term, and we remain as excited as ever about the growth opportunity.

Turning now to DG Fresh, which has delivered significant cost savings while enhancing the profitability of our perishables offering. Our current area of focus for DG Fresh is increasing sales in frozen and refrigerated categories through enhanced product offerings and building on our multiyear track record of growth in cooler doors and associated sales. During Q1, we added more than 18,000 cooler doors across our store base, and we plan to install a total of more than 65,000 incremental cooler doors in 2023. And while produce is not currently serviced by our internal supply chain, we continue to believe that DG Fresh provides a potential path forward to expanding our produce offering to more than 10,000 stores over time.

To that end, at the end of Q1, we offered fresh produce in nearly 3,900 stores, with plans to expand this offering to a total of more than 5,000 stores by the end of 2023. Importantly, despite the meaningful improvements we have made and savings that we have realized to date as a result of DG Fresh, we believe we still have an opportunity to drive significant additional returns with this initiative in the years ahead.

Turning now to an update on our health initiative, branded as DG Well Being. Our expanded health assortment offering was available in nearly 5,000 stores at the end of Q1, and we now plan to expand to a total of more than 7,000 stores by the end of 2023. Looking ahead, our plans include further expansion of our health offering and also of our partnership with a third-party payment platform to allow customers to use health plan supplemental benefits to purchase various health and wellness-related items in their local Dollar General stores. This health benefit option is now available in approximately 7,500 stores, with the goal of being available chain-wide by the end of the year as we continue to focus on increasing access to basic health care products and ultimately services over time, particularly in rural America.

In addition to these initiatives, we continue to pursue other opportunities to enhance gross margin, including supply chain efficiencies, private brand enhancements and improvements in global sourcing. Our second priority is capturing growth opportunities. As I mentioned earlier, our high-return, low-risk real estate model continues to serve us well as a core strength of the business. In the first quarter, we completed more than 800 real estate projects, including 212 new stores, 582 remodels and 22 relocations.

For 2023, we are revising our real estate plans to reflect the reduced pace of pOpshelf opening. We now plan to execute 3,110 real estate projects in total in the U.S., including 990 new stores, 2,000 remodels and 120 relocations. We continue to expect approximately 80% of our new stores and nearly all of our relocations will be in one of our larger store formats, which continue to drive increased sales productivity per square foot as compared to our traditional store.

With regard to remodels, approximately 80% will be in our DGTP format, which provides the opportunity for a significant increase in cooler count as well as the ability to add fresh produce in many stores. In addition to our planned Dollar General and pOpshelf growth, we opened our first Mi Super Dollar General store in Monterrey, Mexico in Q1. We have been very encouraged by the customer response and the early results, which include sales results that are exceeding our pro forma expectations. Looking ahead, our goal is to have up to 20 stores serving the underserved communities in northern Mexico by the end of 2023 as we look to leverage our brand awareness while extending our value and convenience proposition to a customer base that is similar to our core customer in the United States.

Next, our digital initiative, which is an important complement to our physical footprint as we continue to deploy and leverage technology to further enhance convenience and access for customers. We are extending our reach in a variety of important ways, including driving customer engagement through our app and extending our partnership with DoorDash, which is now available in more than 14,800 stores.

Our DG Media Network provides another important avenue of growth as we seek to connect our unique rural-based customer network with CPG companies and brands to deliver a more personalized experience for our customers, a higher return on ad spend for our partners and profitable growth for our business. Overall, our strategy consists of building a digital ecosystem specifically tailored to provide our customers with an even more convenient, frictionless and personalized shopping experience. And we are pleased with the growing engagement we are seeing across our digital properties.

Our third operating priority is to leverage and reinforce our position as a low-cost operator. Kelly and her team are rigorously applying our Save to Serve lens to the business to guide our approach to keeping costs low for our customer. As she discussed, we will be particularly focused on managing expenses this year without compromising long-term growth. We continue to focus on driving efficiencies in the organization, including through our Fast Track initiative.

The current phase of this initiative is focused on self-checkout, which provides customers with even greater convenience in our stores. This offering was available in approximately 12,600 stores at the end of Q1, and we are on track to be in more than 14,000 stores by the end of 2023 as we look to further extend our position as an innovative leader in small box discount retail.

We also continue to reduce costs through the expansion of our private tractor fleet, which consisted of more than 1,700 tractors at the end of Q1 and accounted for approximately 45% of our outbound transportation needs. Looking ahead, we plan to have more than 2,000 tractors in our private fleet by the end of 2023, which would account for more than 50% of our outbound transportation fleet.

Overall, we are taking action to drive efficiencies and drive cost savings as our underlying principles are to keep the business simple but move quickly to capture growth opportunities while controlling expenses and always seeking to be a low-cost operator.

Our fourth operating priority is investing in our diverse teams through development, empowerment and inclusion. As I mentioned within our DG Forward framework, everything we do at this company is powered by our people, and we continue to focus on creating opportunities for personal and professional development and ultimately, career advancement. Our internal promotion pipeline remains robust as evidenced by internal placement rates of more than 70% at or above the lead sales associate position. Additionally, more than 10% of our growing private fleet team began their careers with us in either a store or distribution center.

We continue to have great success hiring the talent we need, and we are pleased with our staffing levels and average [Technical Issues]. Ultimately, we believe the opportunity to start and develop a career with a growing and purpose-driven company is what sets Dollar General apart from our competition and remains our greatest currency in attracting and retaining talent.

Just recently, we added to the strength of our executive team with the promotion of Steve Deckard to Executive Vice President of Growth and Emerging Markets, where he will oversee our real estate, data science, pOpshelf, Mexico and DG Well Being teams. His position will facilitate an even sharper organizational focus on driving execution in our core business while also innovating for the future. And there is no one better suited for this role than Steve, who has been a key strategic leader with Dollar General for 17 years, most recently leading our international expansion in Mexico. I look forward to his continued leadership and ongoing contributions to our success.

In closing, we are focused on delivering our DG Forward strategy to be a force for opportunity for our customers, employees, communities and shareholders. We believe our short-term adjustments position us well to serve our customers in this environment, and our execution on our initiatives and operating priorities positions us well to drive long-term growth.

I want to thank our more than 175,000 employees for their diligence and dedication to fulfilling our mission of Serving Others every day. Our customers and communities need Dollar General right now, and we are poised and ready to serve when and where they need us most.

With that, operator, we would now like to open the lines for questions."
"6","Operator",NA,"Thank you. [Operator Instructions] Our first question comes from Simeon Gutman with Morgan Stanley. Please go ahead."
"7","Michael Kessler","Analyst at Morgan Stanley","Hey guys, this is Michael Kessler on for Simeon. First question, so Dollar General has encountered some supply chain, labor, macro challenges in the midst of changes in management as well. And it does seem like issues are continuing to kind of creep in a bit. As you -- Jeff, as you look backwards over the last six to nine months, can you diagnose maybe what the root -- if there is a root of these issues, if any, of what I just mentioned is intertwined at all? And how do we and investors get comfortable that, I guess, the full extent of the challenges, I guess, are known today?"
"8","Jeffery Owen","Chief Executive Officer at Dollar General","Yeah, Mike, thank you for the call -- the question. I'd say when I think back on the supply chain, we mentioned in Q3 and Q4, we had challenges. We said we would get better in Q4 and we did exactly that. And we also said we'd improve in Q1. And quite frankly, our supply chain improved at a faster rate than even we expected. And you heard me in my prepared comments talk about we ended that quarter in the best position service level-wise in two years.

On the store side, certainly, we tested and learned increasing our labor hour investment in the store. We liked what we saw last year. We said we would continue that in 2023, primarily through labor hours. And we liked what we saw in Q1 as well. Our customer is telling us they're seeing the improvement. And as a result of that, we're going to do more.

And when you think about how we came into 2023 and started the year, we started strong. In February, our comp was actually 4.8%, as we mentioned, and was ahead of our expectations. And in mid-March, as we mentioned on our call, we're watching two significant events that disproportionately, we believe, impact our customer, tax refunds and SNAP. And unfortunately, that impacted her even more than we expected and, quite frankly, more than she expected. And so in March, she simply pulled back. And back half of March, we saw her pull back and really pull out of spending. The good news is in April, she started to return and she continues to return in May as well.

Now as you know, at Dollar General, we know our customer, we believe, better than anybody. And she certainly is telling us she's under pressure. And we have always said this and we will continue to do this that we will be there for her when she needs us most. And so the team is taking action, and I'm pleased to see the actions our team has taken in the short term and really from a position of strength, we're going to be there for affordability, primarily through the items that matter most to her. And so we're going to get even sharper. Even though we're pleased with our pricing position overall and have been for quite some time, we think there's an opportunity to be there for her even more. And so the team has already taken action on pricing on the items that matter most. We're doing it surgically like we always do and very pleased with where we're seeing the customer resonate. But certainly, that will take time to drive traffic as it typically will do.

The other action we're taking is we liked what we saw with the labor, and we're going to do more of it. So, we're pulling forward our labor investment into the second quarter. And quite honestly, we're pulling it forward because we liked what we saw, and our supply chain is improving at a faster rate. So, it allows us to do that and get the returns we're looking for, and quite frankly, make improvements in the store that we need to do, and we'll continue to do. So, these actions, certainly on the short term, will help. But also, they're going to help us emerge stronger as we look to the balance of this year and into 2024.

And also, I continue to be pleased on the progress we're making on our strategic initiatives. We continue to make strong progress in the first quarter. And as I mentioned, we've made further investments in the structure of this to allow us to make even more progress on our innovation front. But also, with the addition of our new executive in Steve Deckard, it will also provide us the ability to enhance our focus on the execution of the core DG business, which I'm seeing already, and I'm pleased to see as we move forward.

So bottom line, we're making improvements. The macroeconomic environment certainly shifted on us in the back half of March. We're seeing her return to us. We're liking what we see and we're positioned well for the long term."
"9","Michael Kessler","Analyst at Morgan Stanley","Thank you, Jeff."
"10","Operator",NA,"Our next question is from Matthew Boss with JPMorgan. Please proceed with your questions."
"11","Matthew Boss","Analyst at J.P. Morgan","Great, thanks. So, Jeff, on the rapidly changing backdrop that you cited, could you maybe speak to the changes in customer behavior that you're seeing today relative more so to three months ago, if we broke it down with traffic versus ticket? And then can you elaborate on some of the drivers of the May comp improvement? And just where exactly do you stand today relative to that 1% to 2% updated full year comp guide?"
"12","Jeffery Owen","Chief Executive Officer at Dollar General","Thanks, Matt. If you recall back to the Q4 call, we talked about our customer, and we talked about the fact that her financial situation was getting worse. And quite honestly, what we do in our survey work and talking to our customers as we do and our first-party data that we have really tells us that our customer's even under more pressure as we have progressed into 2023. And quite honestly, it's some of the most pressure we've seen in quite some time.

The good news is she's still employed. That's always an important factor in her health, so that's a good thing to see. But quite honestly, our customers, some of the details, food inflation continues to persist. And even though it's moderated somewhat, if you think about the two-year stack, it's almost 20%. And our customer certainly is seeing that pressure. And then quite honestly, when you think about the child tax credit and the removal of that and how that impacted her tax refunds, that's an incredible buffer for her, that quite frankly surprised her on the level of refund she did not receive.

And in some cases, some of our customers are saying that they're even having to pay taxes this year, which is something that they typically don't have to do. So, when you think about that, they're saying to us, you look at those two shocks to her also with the SNAP benefit and the $95 reduction on a per household basis, last year and last time this happened, we saw through our first-party data, they were able to shift to other types of tender. But quite frankly, in this environment, and we have the luxury of having first-party data, we're seeing they're not able to do that.

And not only are the states where the SNAP benefits were reduced having an impact but also the states that happened last year, they're also seeing pullback as well. And unfortunately, our customers are saying they're having to rely more on food banks, savings, credit cards. As we all know, credit card rates are at an all-time high. So, saying all that, what we're seeing her do is really rely more in the shopping behavior. We're seeing her buy fewer items per basket. We're seeing her really utilize that $1 price point, and we're very pleased that we still offer that.

And then we're also seeing her buy closer to payday in the first of the month. And -- but what we are seeing through the actions we've taken; we're seeing that our customer's continuing to return to shopping. We're pleased to see our share gains in the month of April and May returning, so we're excited about that. And quite frankly, when you step back and think about share, we grew share in February. Our customer pulled back in March and really pulled out of the spending. She returned in April. And even though we had a negative comp, we still gained share and then we gained share in May as well.

So, we're pleased to see that not only are customers leaning more on Dollar General as we expected she would, but the actions that we're taking are beginning to take hold. So, we feel good. We're positioned to serve our customer in times like this. And with primarily 80% of our stores in communities that's 20,000 or less, we're uniquely positioned to be there for her."
"13","Matthew Boss","Analyst at J.P. Morgan","Great. And then maybe, Kelly, as a follow-up, so just in light of this backdrop, how do you feel about your pricing position today? What actions might you take? And then could you just overall walk through the puts and takes that you've embedded in your gross margin forecast for the second quarter or the back half of the year relative to the expansion that we saw in the first quarter?"
"14","Kelly Dilts","Chief Financial Officer at Dollar General","Yeah, I'll start with the pricing. We feel great about our pricing position. And just like Jeff said, we're investing in a targeted everyday low-price investment. And in this environment, we feel like it's really important to do so on those key items that are important to our customer. And what I would say is that is embedded in our gross margin guidance.

I'm just stepping back on guidance, just taking a look at it from a high level for the full year. Our revised guidance is really a function of the macroeconomic environment, and it's putting pressure on two things, and that's sales and shrink. And as Jeff alluded to, we're taking actions to address both as well as actively managing the rest of the P&L, our working capital and our capital investments. We're not going to sacrifice long-term growth as we do that either.

So, we do expect this customer to remain under pressure for the foreseeable future. The depth and the duration of that is really difficult to predict. But as history always tells us, they'll ultimately recover and get their budgets back in line. So, when we think about that and think about then the cadence of the year, really, I want to focus on Q2. And that's where we're going to see the most pronounced headwinds and probably the highest decrease in EPS.

And to your point on gross margin, Q2 is going to be the toughest year-over-year lap on the gross margin rate. And then we've got some other pressures this year to consider. So, one is shrink, and it's going to be the most difficult comparison on a year-over-year basis. And then the other one is that targeted pricing investment will put some pressure on gross margin. So, with that, we're expecting the gross margin rate for the second quarter to be around or somewhat lower than the gross margin rate for the first quarter.

Adding to a little bit more pressure in Q2 is also just interest expense. We're going to add the most pressure to Q2 versus the remaining quarter just as the cadence of the interest works through. And then finally, the pull forward of the labor investment with over $40 million being spent in Q2 will also pressure Q2. That said, like we talked about, we really like the trends that we're seeing around that investment. It gives us a lot of confidence that it's the right thing to do for our customers and for our business, and we're expecting sustained benefits from that investment.

And you know it well. So, everything we do is centered around the customer, and we're going to continue to execute on that. And while we do like the momentum that we're building with these actions on price and labor investment, we think that sets us up for the back half of the year because there could just be a little bit of a lag to the full benefit of those investments.

And then finally, just importantly, I think it's always good to ground ourselves in history. And history also suggests that we tend to come out of these types of environments even better positioned. And that's as a result of a more productive core customer as well as a trading customer. And that's why we really believe that Q4 will have the best comp of the year. And then as we move into 2024, we'll do so in an even stronger position."
"15","Matthew Boss","Analyst at J.P. Morgan","Great, thanks for the color. Best of luck."
"16","Kelly Dilts","Chief Financial Officer at Dollar General","Thanks."
"17","Operator",NA,"Our next question is from Michael Lasser with UBS. Please proceed with your question."
"18","Michael Lasser","Analyst at UBS Group","Good morning. Thanks a lot for taking my questions. Jeff, the market had long measured Dollar General's market share against some of its large publicly traded competitors like Walmart, Family Dollar and others. And on that metric, Dollar General has been a share gainer for a long time. Now it's arguably having to work its P&L harder to generate sales growth or not experience share gains. Why is that the case? Is it that Dollar General now has 19,000 stores, invigorated competitors and it's just much more difficult to gain share or more expensive? And as a result, Dollar General is going to have structurally lower margins moving forward?"
