"","speaker","title","msg"
"19","Jeffery Owen","Chief Executive Officer at Dollar General","Well, thank you, Michael. When you think about the quarter, and certainly, you're right, Dollar General has historically been a share gainer and we will continue to be a share gainer. When you think about this quarter, in the highly consumables area being flat overall, it really was, again, I go back to the comp cadence in a second, but we were flat overall in the highly consumables, but we did grow share on the non-consumable business. So, I want to be clear that I share that with you.

But as you walk through the comp cadence of the quarter, it really is the story. And when you think about that macro pressure and the fact that we believe our core customer was disproportionately impacted by that, we started to see our share -- actually, when you start the year in February, we actually had a very healthy comp and healthy share gains. And as we went into March, March is when she simply pulled out of the market and had to adjust. And she came back in April, as I mentioned earlier, where we saw share gains resume, and we continue to see share gains resume in May.

And quite honestly, as we think about being there for the customer, the majority of the actions we've taken as it relates to our ability to pull forward the labor investment, the supply chain improvements we've made and getting even sharper on the price, that really didn't happen until late in the quarter. So, when you think about the share gains and the returns, what we're seeing is our customers coming back to Dollar General as we expect they would. And we believe that the actions we're taking will only make it a more compelling offering for our customer. We're there for her in affordability and value, and we'll provide her with the consistency in the shopping experience that she's grown to be accustomed to at Dollar General. We'll make that even better as we move forward.

And so, as we think about that, we feel real good about our ability to continue to grow share and also provide healthy operating margins. And as you know, we've made tremendous investments over the years to enable us to structurally be able to do that. When you think about the comp and the composition of our sales mix and the highly consumable sales mix that we're seeing, it's pretty impressive that Dollar General's structural profitability has allowed us to continue to be much more profitable even in an environment like that.

And we continue to see where areas that we can grow margin and provide us with the ability to not only serve this customer sustainably grow share but also provide healthy returns, and that's something that we are very excited about the ability to do that as we move through this year and then also as we move even stronger into '24 and beyond."
"20","Michael Lasser","Analyst at UBS Group","And my follow-up question is, Jeff, your discussion around price investments come on the heels of one of your large competitors making price investments last year. And so, this has sparked the narrative within the investment community that there's just going to be a race to the bottom and a never-ending price war within the small value retail sector. How do you prevent that?

And recognizing you're not going to provide guidance for 2024 as of yet, can you still make these types of investments and get back to your double-digit EPS growth algorithm within a reasonable time frame?"
"21","Jeffery Owen","Chief Executive Officer at Dollar General","Yeah, Michael, first of all, as we've said historically and continue to say, our price position relative to competition continues to be strong. And quite honestly, our philosophy on price has not changed. Our pricing goal continues to be at parity with mass, plus or minus, call it 2%, 3%, and we're well within that targeted range, and we feel good about that position.

But we believe our customer, and we've said this for many years, that we reserve the right to be there for the customer when she needs us most, and we believe this is a time for that. And we think there's an opportunity to get even sharper on certain items that matter most. And so, we believe, again, this is a very targeted structural approach -- excuse me, targeted and surgical approach to being able to be there for this customer.

And we've done this over the last few weeks. We're pleased with the response we're seeing. But again, our philosophy and our goal has not changed. We still have the same pricing gap targets that we've had for quite some time, and the actions we've taken are in the guidance that we contemplated. And I'll turn the back half of the question over to Kelly."
"22","Kelly Dilts","Chief Financial Officer at Dollar General","Yeah, you're absolutely right, Jeff. The guidance does contemplate that. And really, the guidance range is a function of the flow-through of the sales scenarios and with that additional shrink risk largely being offset by the costing actions that we're taking in SG&A. And so, we're getting a benefit from that as well. I think as we move into the year with all the actions that we're taking, I'm confident in delivering this EPS guidance. And I think with the impact of those actions that Jeff talked about, that we continue to see Dollar General as a 10% EPS grower over the long term."
"23","Michael Lasser","Analyst at UBS Group","Thank you."
"24","Operator",NA,"Our next question is from Karen Short with Credit Suisse. Please proceed with your question."
"25","Karen Short","Analyst at Credit Suisse Group","Hi, thanks very much. Appreciate it. So actually, just following on that line of thinking, you've basically grown sales per square foot by 15% since 2019, and you're looking at EBIT margins that are below where they were in 2019. So, I guess the question is, what do you think a sustainable EBIT margin actually is?

And then I guess what I'm still confused by is you were pretty adamant in March that you weren't seeing impact from SNAP reductions. And I understand that other things kind of came into play. But that obviously changed during the first quarter. So, what -- like what visibility did you not have in March?

And then I guess, sorry, my third question would be, you've obviously always outperformed in a weaker macro with a trade down in your format. So, do you still feel confident that, that's doable?"
"26","Jeffery Owen","Chief Executive Officer at Dollar General","Okay, Karen. I'll try. There are several questions in there, so I'll start with the -- let me try to start with the SNAP question first. And then we'll talk about the macro and then I'll toss it over to Kelly to talk about the EBIT margin question.

So, when you think about the SNAP, when we sat here in Q4, what we talked about was there are two pending changes that we're watching. And at that point in time, you're right, we had not seen the impact of SNAP. What we did say was we've trended it off our first-party data and what states that had pulled back previously and how that customer responded. But we also mentioned, and we continue to feel it's in a much different spot for this customer when that actually took place. So, our customer today is certainly in a much worse off position than she was a year ago when those changes happened in those previous states.

And so, since then, what really happened was, certainly, we saw the customer pull back, really a combination of two things. I think the tax refund component is the other one we talked about that we had not seen, quite frankly, any impact from that. And as you look at our comp cadence, it pretty much matches the tax refund reduction and it's a very high correlation there. So those are the two things that, quite frankly, we saw that changed in the back half of March and persisted into April.

I think the good news is, and you're right, we believe this model is built for all seasons, and it's proven that it can deliver to our customer in any economic environment. We continue to believe that. But we also see opportunities, which we see right now for the ability to serve our customer even better than we've served her in the past.

And that's what we're doing and that's what we're squarely focused on is responding to the macro environment, taking care of our customer, but also positioning Dollar General long term to be able to continue to serve this customer. And when you think about it, 80% of our stores are serving communities at 20,000 or less. So, we're uniquely positioned to be able to do that, and we're squarely focused on delivering on that."
"27","Kelly Dilts","Chief Financial Officer at Dollar General","I'd say we're squarely focused on delivering operating margin expansion as well. And I think if you look back to '19, you'll see that we're expecting to continue that expansion as we move into 2024 and get through this macro environment. We have a lot of initiatives in place to drive that operating margin profit, and we are making sure that we invest in those even during these times. So, we feel good about that on a go-forward basis."
"28","Karen Short","Analyst at Credit Suisse Group","So just a follow-up on that then. What do you think your structural margins -- could EBIT margin could be? Like say not '23 obviously but '24, and '25?"
"29","Kelly Dilts","Chief Financial Officer at Dollar General","Yeah, I don't want to comment on that year right now, but I would just say that everything that we're doing right now sets us up for a successful '24."
"30","Karen Short","Analyst at Credit Suisse Group","Okay, thanks."
"31","Kelly Dilts","Chief Financial Officer at Dollar General","Thank you."
"32","Operator",NA,"Our final question is from Rupesh Parikh with Oppenheimer. Please proceed with your question."
"33","Rupesh Parikh","Analyst at Oppenheimer","Good morning and thanks for taking my question. So, I just want to go back to the comp shortfall that you saw in the quarter and your updated expectations for the full year. Just curious why you believe it's more -- the comp [Indecipherable] is more driven by macro weather versus changes in competitive dynamics."
"34","Jeffery Owen","Chief Executive Officer at Dollar General","Yeah, I'll start that, Rupesh, and I'll turn it over to Kelly to add any color. But again, I think it goes back to the comp cadence. I mean, a couple of things. First, as I said earlier, our February started out extremely strong. And as you look throughout the quarter, March and April, we saw the pullback in March. We saw April continue and then we've seen it respond nicely in May. So that's why we -- when you look at the macroeconomic shock to our customer primarily in the two areas I talked about, combined with a really cold and wet spring, we're seeing our customer continue to respond. And we're liking what we see as we enter into the second quarter as it relates to her ability to rebound and spend with us.

And also, again, I go back to the operational improvements. I mean, our supply chain hasn't been this good since two years ago. Our store conditions continue to improve. Our customers are seeing it. They're telling us that. And we haven't seen that movement, quite frankly, in quite some time. Our movement from Q4 to Q1 was significant and we're excited about that. We're also excited about how we're seeing the ability to accelerate that in the second quarter because of our supply chain improvements. And then also, we believe that value is always incredibly important to our customer, and we've been able to show value for many, many years. But we believe now, with the ability for us to be there for her and be even sharper on the things that matter most to her, will drive traffic into the store, will allow us to serve her better and gain share as we've talked about historically doing and we will continue to do here at Dollar General."
"35","Rupesh Parikh","Analyst at Oppenheimer","Great. And then one follow-up question. Your inventory balance was up, I think, 20% year-over-year. Just curious how you feel about the health of the inventory position and opportunities you see to improve from here?"
"36","Kelly Dilts","Chief Financial Officer at Dollar General","Yeah, we continue to feel good about the quality of the inventory. But I will say inventory management remains a focus for us. So, inventory growth was relatively consistent with Q4, although we had hoped that it would come in somewhat lower this quarter. The good news here is what I would say is we made some progress on working down the non-consumable inventory. It was offset, though, by improved consumable in-stock levels. And as Jeff noted, with the supply chain health, that's where we got those in-stock levels from.

So just a couple of facts for you. We reacted pretty quickly to the current environment by reducing non-consumable receipts. And frankly, I'd say we acted historically as well because some of those receipts were pulled back almost a year ago and in reaction to the discretionary spend trends that we were seeing. So, in Q1, our non-consumable receipts were actually down over 30%, and we expect that trend to continue into Q2. And with that, what we saw was a 3% reduction in non-consumable inventory per store from Q4.

So nice movement there. And we do expect it to get more normalized levels in the back half of the year. Again, at the same time, our supply chain service levels improved faster than we expected, and that drove some consumable products to the store, which was one of the main contributors, as you look, on either a year-over-year basis or a quarter-over-quarter basis.

So, I'd just end with, we know that inventory remains an opportunity for us, and we're going to continue working on reducing those levels with the goal to remain in line with sales, and we believe that the new structure we put in place will make sure that we get that done."
"37","Rupesh Parikh","Analyst at Oppenheimer","Thank you for all the color."
"38","Kelly Dilts","Chief Financial Officer at Dollar General","Thank you."
"39","Operator",NA,"We have reached the end of the question-and-answer session. I would now like to turn the call back over to Jeff Owen for closing comments."
"40","Jeffery Owen","Chief Executive Officer at Dollar General","Thank you for all the questions, and thanks for your interest in Dollar General.

If I can summarize our discussion today, let me leave you with these three things.

First, Dollar General is built for times like this, and we have a keen focus on enhancing our ability to serve our customer.

We are investing and adapting structurally, strategically and operationally to serve our customers even better in this environment, which we believe will drive momentum later in the year and into 2024.

And we have a clear vision and a powerful growth strategy for the future.

Thank you for listening and have a great day."
"41","Operator",NA,"[Operator Closing Remarks]"
