"","speaker","title","msg"
"1","Operator",NA,"Good morning, and welcome to the Third Quarter 2023 Earnings Conference Call for D.R. Horton, Americas Builder, the largest builder in the United States. [Operator Instructions]

I will now turn the call over to Jessica Hansen, Vice President of Investor Relations for D.R. Horton."
"2","Jessica Hansen","Vice President, Investor Relations and Communications at D.R. Horton","Thank you, Paul, and good morning. Welcome to our call to discuss our results for the third quarter of fiscal 2023.

Before we get started, todays call includes forward-looking statements as defined by the Private Securities Litigation Reform Act of 1995. Although D.R. Horton believes any such statements are based on reasonable assumptions, there is no assurance that actual outcomes will not be materially different. All forward-looking statements are based upon information available to D.R. Horton on the date of this conference call and D.R. Horton does not undertake any obligation to publicly update or revise any forward-looking statements. Additional information about factors that could lead to material changes in performance is contained in D.R. Horton's Annual Report on Form 10-K and its most recent quarterly report on Form 10-Q, both of which are filed with the Securities and Exchange Commission.

This mornings earnings release can be found on our website at investor drhorton.com, and we plan to file our 10-Q early next week. After this call, we will post updated investor and supplementary data presentations to our Investor Relations site on the Presentations section under News and Events for your reference.

Now, I will turn the call over to David Auld, our President and CEO."
"3","David V. Auld","President and Chief Executive Officer at D.R. Horton","Thank you, Jessica, and good morning. I am pleased to also be joined on this call by Mike Murray and Paul Romanowski, our Executive Vice Presidents and Co-Chief Operating Officers; and Bill Wheat, our Executive Vice President and Chief Financial Officer.

For the third quarter, the D.R. Horton team delivered solid results, highlighted by earnings of $3.90 per diluted share. Our consolidated pre-tax income was $1.8 billion, on an 11% increase in revenues to $9.7 billion, with a pre-tax profit margin of 18.3%. Our homebuilding return on inventory for the trailing 12 months ended June 30th was 31.8%, and our return on equity for the same period was 24.3%. Despite continued high mortgage rates and inflationary pressures, our net sales orders increased 37% from the prior year quarter, as the supply of both new homes and existing homes at affordable price points is limited and demographics supporting housing demand remained favorable.

We are focused on consolidating market share by supplying more homes to meet homebuyer demand, while maximizing the returns and capital efficiency of each of -- in each of our communities. With improvements in both labor capacity and availability of materials, our cycle times are decreasing, positioning us to release homes for sale earlier in the construction cycle. We are pleased that we were able to increase our homebuilding starts to 22,900 [Phonetic] homes this quarter, which was supported by a 6% sequential increase in our active selling communities.

Our homebuilding operating margins are lower than the record high margins we reported last year due to cost inflation and pricing adjustments and incentives we implemented to address homebuyer affordability challenges caused by higher mortgage rates. However, our margins improved sequentially from the March to June quarter as home prices and incentives have stabilized and some reductions in construction costs are now being realized in our homes closed.

We are well-positioned with our experienced operators, diverse product offerings, flexible lot supply and strong capital and liquidity position to produce and sustain consistent returns, growth and cash flow. We will maintain our disciplined approach to investing capital to enhance the long-term value of our company, including returning capital to our shareholders through both dividends and share repurchases on a consistent basis. Paul?"
"4","Paul J. Romanowski","Executive Vice President and Co-Chief Operating Officer at D.R. Horton","Earnings for the third quarter of fiscal 2023 decreased 16% to $3.90 per diluted share compared to $4.67 per share in the prior year quarter. Net income for the quarter decreased 19% to $1.3 billion on consolidated revenues of $9.7 billion. Our third quarter home sales revenues were $8.7 billion on 22,985 homes closed, compared to $8.3 billion on 21,308 homes closed in the prior year. Our average closing price for the quarter was $378,600, flat sequentially and down 3% from the prior year quarter. Mike?"
"5","Michael J. Murray","Executive Vice President and Co-Chief Operating Officer at D.R. Horton","Our net sales orders in the third quarter increased 37% to 22,879 homes, and order value increased 26% from the prior year to $8.7 billion. Our cancellation rate for the quarter was 18%, flat sequentially and down from 24% in the prior year quarter. Our average number of active selling communities was up 6% sequentially and up 8% year-over-year. The average price of net sales orders in the third quarter was $381,100, up 2% sequentially and down 8% from the prior year quarter.

To adjust to changing market conditions and higher mortgage rates over the past year, we increased our use of incentives and reduced the size of our homes to provide better affordability to homebuyers. Although home prices and incentives have begun to stabilize, we expect continued utilizing a higher-level of incentives as compared to last year. Our sales volumes can be significantly affected by changes in mortgage rates and other economic factors. However, we will continue to start homes and maintain sufficient inventory to meet sales demand and aggregate market share. Bill?"
"6","Bill W. Wheat","Executive Vice President and Chief Financial Officer at D.R. Horton","Our gross profit margin on home sales revenues in the third quarter was 23.3%, up 170 basis points sequentially from the March quarter. The decrease in our gross margin from March to June reflects a decrease in incentive costs and lower stick and brick costs on homes closed during the quarter. On a per square foot basis, home sales revenues and lot costs were both flat sequentially, while stick and brick cost per square foot decreased 4%.

As Mike mentioned, we continue to -- we expect to continue offering a higher-level of incentives as compared to 2022. But due to the recent stabilization in home prices and some reductions in both incentives and construction costs, we expect our homebuilding gross margins to be slightly higher in the fourth quarter compared to the third quarter. Jessica?"
"7","Jessica Hansen","Vice President, Investor Relations and Communications at D.R. Horton","In the third quarter, our homebuilding SG&A expenses increased by 6% from last year and homebuilding SG&A expense as a percentage of revenues was 6.7%, up 10 basis points from the same quarter in the prior year. Fiscal year-to-date, homebuilding SG&A was 7.2% of revenues, up 30 basis points from the same period last year as we've maintained the capacity of our platform to grow market share. Paul?"
"8","Paul J. Romanowski","Executive Vice President and Co-Chief Operating Officer at D.R. Horton","We started 22, 900 homes in the June quarter, up 15% from the March quarter. We ended the quarter with 43,800 homes in inventory, down 22% from a year-ago and flat sequentially. 25,000 of our homes at June 30th were unsold, of which 5,700 were completed. For homes we closed in the third quarter, our construction cycle time decreased by over a month from the second quarter, reflecting improvements in the supply chain. We expect to see a further decrease in our cycle time for homes closed in the fourth quarter. We will continue to adjust our homes and inventory and start pace based on market conditions. Mike?"
"9","Michael J. Murray","Executive Vice President and Co-Chief Operating Officer at D.R. Horton","Our homebuilding lot position at June 30th consisted of approximately 555,000 [Phonetic] lots, of which 25% were owned and 75% were controlled through purchase contracts, 34% of our total owned lots are finished and 53% of our controlled lots are or will be finished when we purchase them. Our capital-efficient and flexible lot portfolio is a key to our strong competitive position.

Our third quarter homebuilding investments in lots, land and development totaled $2.2 billion, up 25% from the prior year quarter and 27% sequentially. Our current quarter investments consisted of $1.2 billion for finished lots, $700 million for land development and $290 million for land acquisition. Paul?"
"10","Paul J. Romanowski","Executive Vice President and Co-Chief Operating Officer at D.R. Horton","During the quarter, our rental operations generated $162 million of pre-tax income on $667 million of revenues from the sale of 1,754 single-family rental homes and 30 multi-family rental units. Our rental property inventory at June 30th was $3.3 billion, which consisted of $1.9 billion of single-family rental properties and $1.4 billion of multi-family rental properties. Our rental operations are generating significant increases in both revenues and profits this year as our platform expands across more markets. For the fourth quarter, we expect our rental revenues to be greater than our third quarter and our rental profit margin to be lower than our third quarter. Bill?"
"11","Bill W. Wheat","Executive Vice President and Chief Financial Officer at D.R. Horton","Forestar, our majority-owned residential lot development company reported total revenues of $369 million for the third quarter, on 3,812 lots sold with pre-tax income of $62 million. Forestar's owned and controlled lot position at June 30th was 73,000 lots. 57% of Forestar's owned lots are under contract with or subject to a right of first offer to D.R. Horton. $270 million of our finished lots purchased in the third quarter were from Forestar. Forestar is separately capitalized from D.R. Horton and had more than $780 million of liquidity at quarter end, with a net-debt to capital ratio of 19.1%. Forestar is uniquely positioned to capitalize on the shortage of finished lots in the homebuilding industry and to aggregate significant market share over the next few years with a strong balance sheet lot supply and relationship with D.R. Horton. Mike?"
"12","Michael J. Murray","Executive Vice President and Co-Chief Operating Officer at D.R. Horton","Financial services earned $94 million of pre-tax income in the third quarter on $29 million of revenues, resulting in a pre-tax profit margin of 41.2%. During the quarter, 99% of our mortgage company's loan originations related to homes closed by our homebuilding operations and our mortgage company handled the financing for 74% of our buyers.

FHA and VA loans accounted for 51% of the mortgage company's volume. Borrowers originating loans with DHI mortgage this quarter had an average FICO score of 723 and an average loan-to-value ratio of 88%. First time homebuyers represented 56% of the closings handled by our mortgage company this quarter. Bill?"
"13","Bill W. Wheat","Executive Vice President and Chief Financial Officer at D.R. Horton","Our balanced capital approach focuses on being disciplined, flexible and opportunistic to support and to sustain an operating platform that produces consistent returns, growth and cash flow. We continue to maintain a strong balance sheet with low leverage and significant liquidity, which provides us with flexibility to adjust to changing market conditions.

During the first nine months of the year, our cash provided by homebuilding operations was $2.1 billion, and our consolidated cash provided by operations was $2.3 billion. At June 30th, we had $4.6 billion of homebuilding liquidity, consisting of $2.6 billion of unrestricted homebuilding cash and $2 billion of available capacity on our homebuilding revolving credit facility. Homebuilding debt at June 30th totaled $2.7 billion, which includes $400 million of senior notes that were redeemed early in July.

Our homebuilding leverage was 11.1% at the end of June and homebuilding leverage net of cash was 0.7%. Our consolidated leverage at June 30th was 22% and consolidated leverage net of cash was 11.3%. At June 30th, our stockholders' equity was $21.7 billion, and book-value per share was $64.3, up 23% from a year-ago. For the trailing 12 months ended June, our return-on-equity was 23%.

During the quarter, we paid cash dividends of $85 million, and our Board has declared a quarterly dividend at the same level as last quarter to be paid in August. We repurchased 3.1 million shares of common stock for $343 million during the quarter for a total of 7.7 million shares repurchased fiscal year-to-date for $764 million. Jessica?"
"14","Jessica Hansen","Vice President, Investor Relations and Communications at D.R. Horton","As we look forward, we expect current market conditions to continue with uncertainty regarding mortgage rate, the capital markets and general economic conditions that may significantly impact our business. For the full year, we currently expect to close between 82,800 and 83,300 homes in our homebuilding operations and between 6,500 and 7,000 homes and units in our rental operations.

We expect our consolidated revenues for fiscal 2023 to be in a range of 34. 7% to $35.1 billion. We expect to generate greater than $3 billion of cash flow from operations in fiscal 2023, primarily from our homebuilding operations. We also expect our fiscal 2023 share repurchases to be approximately $1.1 billion, similar to last year.

For the fourth quarter, we currently expect to generate consolidated revenues of $19.7 billion to $10.1 billion, and homes closed by our homebuilding operations to be in the range of 22,800 to 23,300 homes. We expect our home sales gross margin in the fourth quarter to be approximately 23.5% to 24%, and homebuilding SG&A as a percentage of revenues in the fourth quarter to be in the range of 6.7% to 6.8%.

We anticipate a financial services pre-tax profit margin of around 30% to 35%, and we expect our income tax rate to be approximately 24.5% in the fourth quarter. We will continue to balance our cash flow utilization priorities among our core homebuilding operations, our rental operations, maintaining conservative homebuilding leverage and strong liquidity, paying an increased dividend and consistently repurchasing shares. David?"
"15","David V. Auld","President and Chief Executive Officer at D.R. Horton","In closing, our results and position reflect our experienced teams, industry-leading market share, broad geographic footprint and diverse product offerings. All of these are key components of our operating platform that sustain our ability to produce consistent returns, growth and cash flow, while continuing to aggregate market share.

We will maintain our disciplined approach to investing capital to enhance the long-term value of the company, which includes returning capital to our shareholders through both dividends and share repurchases on a consistent basis. Thank you to the entire D.R. Horton team for your continued focus and hard work.

This concludes our prepared remarks. We will now host questions."
"16","Operator",NA,"Thank you. [Operator Instructions] The first question today is coming from Stephen Kim from Evercore ISI. Stephen, your line is live."
"17","Stephen Kim","Analyst at Evercore ISI","Thanks very much, guys. Impressive quarter once again. So congratulations on that. I wanted to talk about your construction, you pace of construction and your goals going forward. You talked about growing your starts this quarter versus last quarter. But let me just look back maybe a year, year and a half ago, there were a couple of quarters where you started even more. You started about 25,000 units a quarter. I wanted to get a sense from you as to whether or not you feel like that's a level that you could achieve in the near-term? And if not, why not?

And then also if you could talk about whether seasonality is going to be a factor we should be thinking about with respect to your starts cadence?"
"18","Michael J. Murray","Executive Vice President and Co-Chief Operating Officer at D.R. Horton","Yes, Stephen. We have seen as we talked about about a 30-day reduction in our cycle time and can see consistency and improvement as we travel throughout -- throughout our divisions and seen pretty -- pretty good balance with our trades and all the supplies that we need to continue with improvement in cycle time. If you look at our starts pace, it did tick up some and stayed pretty consistent with our closings, which is a cadence that we expect to see as we look towards the fourth quarter based on our sales pace and the strength of the market and where we have the lots and the ability to push that up a little bit, we will, but not looking to outpace the market and continue to keeping that cadence and position ourselves for continued growth."
"19","Stephen Kim","Analyst at Evercore ISI","Okay. So, it sounds like -- I didn't really get a sense for whether 25,000 is a significant figure in your mind. And why is that a level that we couldn't achieve or revisit simply because it wasn't that long ago where you actually did that for, like I said, two quarters in a row. And then also if I could tack on a second question about your rental platform, you did give some guidance regarding rents being higher, but margins being lower relative to -- in 4Q relative to 3Q. But could you talk about your plans for rental inventory in dollars carried on the balance sheet? Where should we be thinking your going to take that level of investment, which. I think is $3.3 billion, if I'm not mistaken right now. Is that going to grow meaningfully as we look into 2024 and beyond or is that a level that you feel comfortable with maybe even begin to harvest some of that? Thanks."
"20","David V. Auld","President and Chief Executive Officer at D.R. Horton","Hey, this is -- as to the 25,000 starts per quarter, we are very focused on increasing -- incrementally increasing starts quarter-to-quarter to quarter. And we believe that as we continue this process, we will consolidate the labor availability, capacity. And with labor and material consolidation, our ability to program out our starts and then continue to build the houses and gain efficiency in that process, it's just a -- it's an ongoing effort. So do we have a target out there of -- we got to get to this number. No, our target is market-by-market, flag-by-flag, how do we consolidate these markets and increase our market share. And just by the nature of doing that, we're going to get bigger and bigger and bigger. And I'll let Mike reply to the rental question."
"21","Michael J. Murray","Executive Vice President and Co-Chief Operating Officer at D.R. Horton","Hey, Stephen. So we expect that the margin on the fourth quarter closings in the rental segment will probably have a lower profit margin largely on the basis of mix of projects that are delivering between Q3 and into Q4. A lot of it's on a cost basis difference between those homes that were built at different times and when they're delivering."
"22","Paul J. Romanowski","Executive Vice President and Co-Chief Operating Officer at D.R. Horton","And then in terms of our forward investment level, we're at a total of about $3.3 billion of inventory today. We've seen a significant growth ramp in that over the last two years. We do expect to continue to grow that platform and we will see our inventory levels continue to grow over the next couple of years, but we do expect that growth pace to moderate from what it's been in the last two years."
"23","Stephen Kim","Analyst at Evercore ISI","Great. Thanks very much guys."
"24","Operator",NA,"Thank you. The next question is coming from Joe Ahlersmeyer from Deutsche Bank. Joe, your line is live."
"25","Joe Ahlersmeyer","Analyst at Deutsche Bank Aktiengesellschaft","Thanks, and good quarter, guys."
"26","David V. Auld","President and Chief Executive Officer at D.R. Horton","Thank you."
"27","Joe Ahlersmeyer","Analyst at Deutsche Bank Aktiengesellschaft","Wanted to follow-up on the community count, that's up about 9% year-to-date -- calendar year-to-date that is. And I'm just wondering is there anything in there that we should consider that's more temporary in nature? I'm not going to straight-line that release or anything or that sequential number, but should we expect that to go down into the back half, or are we going to sustain those levels? And then I have a follow-up."
"28","Jessica Hansen","Vice President, Investor Relations and Communications at D.R. Horton","Sure, Joe. We've been really focused on our flag count. I mean, we clearly have the lot position to open new communities and to grow our community count, whereas the last couple of years it's not moved more than a low-single digit percentage, and we feel like we're positioned to be closer to the mid-single-digit going forward. So not necessarily 9% going forward, but around the mid single digits quarter-to-quarter. There can be some choppiness, just determining when we close out the communities and ultimately bring them online. But our lot position is there and our operators are focused on growing their flag count."
"29","Joe Ahlersmeyer","Analyst at Deutsche Bank Aktiengesellschaft","Makes sense. And just thinking about the homes and inventory number, that was actually sequentially flattish the last couple of quarters even as you did grow those communities. So is it right to think that maybe this is part of returning to higher levels of inventory unit turnover or should we expect that the total homes and inventory will sort of catch up on a lag as you continue to grow starts?"
"30","Paul J. Romanowski","Executive Vice President and Co-Chief Operating Officer at D.R. Horton","Yeah. Very focused on improving our inventory churn as our construction cycle times have improved. That's facilitating, that you look historically, we've typically when we go into a year with our number of homes and inventory, we've been able to turn that two times in the following year. The last couple of years has been slower than that, and so we're looking to get back to that more historic inventory turn level as we looked at fiscal '24."
"31","David V. Auld","President and Chief Executive Officer at D.R. Horton","That is a -- actually I'll go back -- going back to the start question, that is a factor in our start pace, is making sure that we have the capacity to continue to deliver these houses in a more -- in a faster and more efficient way. So it's all flows together. So that we can actually deliver more houses with fewer homes and inventory quarter-to-quarter, quarter-to-quarter."
"32","Joe Ahlersmeyer","Analyst at Deutsche Bank Aktiengesellschaft","That's great to hear. Thanks very much and good luck."
"33","Operator",NA,"Thank you. The next question is coming from John Lovallo from UBS. John, your line is live."
"34","John Lovallo","Analyst at UBS Group","Good morning, guys. Thank you for taking my questions. The first one is, it looks like the sequential improvement or the sequential cadence of orders from the second quarter to third quarter was better than normal seasonality by a bit. I mean, I think normal seasonality would suggest down about 5%. It looks like they were down about 1%. As we move into the fourth quarter, how should we sort of think about seasonality, which looks like it's typically down, call it 15% to 20% on a quarter-over quarter basis. Is that a reasonable way to think about the fourth quarter? Or the dynamics getting a little bit better out there where you might be able to do a bit better than that?"
"35","Michael J. Murray","Executive Vice President and Co-Chief Operating Officer at D.R. Horton","Yeah. Thanks, John. I think we are seeing more normal seasonality this year in terms of just demand traffic patterns, and so I think our base expectations would be that -- that orders would show a bit and closer to normal seasonality going forward. But to our approach to trying to be as consistent as we can and providing starts pace and a consistent level of inventory with still a short supply of inventory out there in the existing home market and in the new-home market, we're going to make sure we've got enough homes out there to capture whatever demand there may be, and so our hope would be over the longer-term we could see a bit more consistency there. But there still is a natural seasonality and an ebb and flow to consumer demand that I think is getting back to a more normal level."
"36","David V. Auld","President and Chief Executive Officer at D.R. Horton","And I do -- I do believe that we're going to have a lot more houses to sell this year given the shortened cycle time and our ability to to give people a date-certain to close. So, that we were limited in the number homes last year. So the comparison this quarter to last quarter -- a year-ago quarter is probably going to -- it's going to look better than typical seasonality."
