"","speaker","title","msg"
"78","Brad M. Cerepak","Senior Vice President & Chief Financial Officer at Dover","Not explicitly, but I think the way we're working through it is, is that it's mainly driven by, I would say more towards -- tilted towards the safety stock levels, the buffer inventory, and raw materials, and the materials flow where -- what we have to see is less inflow versus production to draw down, and that's what's happening here in the second quarter. I mean, we did have slightly negative inventory through the first half of the year. But it's a heck of a lot better than it was a year ago, and we're continuing to make progress to make sure production is in excess of the inflows. That's the way we're working it."
"79","Deane Dray","Analyst at RBC Capital Markets","Thank you."
"80","Richard J. Tobin","President & Chief Executive Officer at Dover","Thanks. I think that's it, Jack."
"81","Operator",NA,"And we'll take our final question from Nigel Coe with Wolfe Research. Please go ahead."
"82","Nigel Coe","Analyst at Wolfe Research","Are you sure? Do you want to finish it off or should I ask the question?"
"83","Richard J. Tobin","President & Chief Executive Officer at Dover","No. Yeah, go ahead."
"84","Jack Dickens","Senior Director, Investor Relations at Dover","Nigel, we didn't want to cut you off."
"85","Nigel Coe","Analyst at Wolfe Research","Yeah, you saw my name and cut off, right? Okay, so. Yeah, don't worry, I'm kidding. Look -- so look, we love your macro perspectives. You were very early to be cautious and rightly so, but it seems like some of the capex businesses are maybe trending a bit weaker, Belvac, Hill Phoenix, maybe just put some perspective on what you're seeing in those capital businesses? And is it an adjustment to higher rates, macro uncertainty? What do you think -- how do you think this plays out?"
"86","Richard J. Tobin","President & Chief Executive Officer at Dover","Well, I mean, I think that Belvac is a cyclical business. There was just a lot of capital that was put in during the pandemic years into can making. We did fabulous in terms of market participation there versus our competitors, but we fully expect and have been preparing for over the last 18 months where there'll be some roll down because you just can't keep at that kind of pace. Now having said that, I don't think it's as negative of a story either just because of the fact that the revenue was influenced by some engineering work that we did at very low margins while we sold the equipment.

And we're actually working on some interesting IP-related projects that may help us out the right to capex. On the refrigeration side, we had that order cancellation that we talked about at the end of last quarter that was very customer-specific. The balance of the demand is decent. I think that there's a little bit of the same frictional costs in terms of labor availability and installation, that's not our problem, it's our customers' problem. So the pace of that capex tends to be a bit choppy.

But the conversations that we're having and I think it's in the transcript, the conversations we're having about 2024 in terms of demand in that particular space are good. And I'm just talking about kind of the old traditional case business without even getting into natural refrigerants where -- we're growing at a very heady pace in North America right now off a low base. But based on the conversations that we're having, we feel very excited about where this thing could go."
"87","Nigel Coe","Analyst at Wolfe Research","Okay, that's helpful. Quick follow on if I can. Retail fueling, you mentioned focusing on margin and cash flow, and obviously the suction actions that speak to that. You've talked about this before but is this like a doubling down of our strategies? Is this becoming even more of a focus on -- just cash flow as opposed to growth?"
"88","Richard J. Tobin","President & Chief Executive Officer at Dover","No, I mean, I think we have individual strategies for every business that we have in the portfolio. Obviously, if you go back a couple of years ago, this was EVs are taking over the world and the negative headwinds of EMV plus that -- the view of what these businesses were worth was I think completely overdone. We think that we've got 20 years of high margin opportunity into that space. But having said that, we're just repositioning that business where we think that we've upgraded the entire product line globally, by the way, not just in the United States, that we can run that --- we can run this business a lot more or lot lean -- more lean than we did in the past. And that's the actions you see us taking. We think we can get that segment to 25%, and you're seeing some of the building blocks working our way there."
"89","Nigel Coe","Analyst at Wolfe Research","Okay. Thanks for the question."
"90","Richard J. Tobin","President & Chief Executive Officer at Dover","Yep. Thanks."
"91","Operator",NA,"[Operator Closing Remarks]"
