"","speaker","title","msg"
"3","Rachel Glaser","Chief Financial Officer at Etsy","Thanks, Josh, and thank you everyone, for joining us. My commentary today will cover consolidated results for our House of Brands, key drivers of performance and Etsy Marketplace stand-alone results where appropriate. Fourth quarter consolidated GMS declined 4% year-over-year to $4 billion, nearly flat on a currency-neutral basis. Revenue increased 12.6% year-over-year to $807 million. And we delivered adjusted EBITDA of $227 million, representing a very healthy 28% margin. Foreign exchange headwinds moderated in the fourth quarter to 330 basis points, down from 400 basis points in the third quarter. We're pleased that the Etsy Marketplace successfully anniversaried the incredibly strong prior year period, which included pandemic lockdowns and supply chain issues. In addition, we saw some acceleration in Etsy marketplace GMS growth on a year-over three-year basis, which I'll discuss more in a few minutes. Our three subsidiary marketplaces had a tougher time than Etsy with some weakness in the quarter that weighed on consolidated results.

Drilling into fourth quarter revenue growth, marketplace revenue increased 11% year-over-year, primarily driven by the Etsy Marketplace transaction fee increase from 5% to 6.5%. Services revenue outpaced marketplace growth up 17.7% year-over-year, with consolidated ads revenue increasing 20% year-over-year. While we had expected to see normal seasonal headwinds for Etsy Ads on higher organic traffic during the fourth quarter, continued product enhancements drove better-than-anticipated performance. This included utilization of neural network embeddings, a type of machine learning advancement to increase ad relevance, which drove more clicks and purchases. We also launched a more visually engaging ad experience with videos on the homepage that increase conversion and return on ad spend for sellers.

We delivered another quarter of strong profitability in the fourth quarter, with adjusted EBITDA increasing year-over-year from $219 million to $227 million driven by the higher revenue. As you can see in the chart on the left, consolidated adjusted EBITDA margin declined on a year-over-year basis in the fourth quarter, primarily due to higher marketing spend and to a lesser extent, increased G&A expense and product development spend, which drove our margin down to 28.1% from 30.5%.

It's important to note that a significant portion of product and marketing investments generally do not see payback in period, which I will discuss in more detail. As you can see from the chart on the right, we have delivered very strong bottom line profitability over the last five years, both in margin percentage and even more importantly in adjusted EBITDA dollars. I'd also like to highlight that since 2017, our capital-light business model and disciplined expense management has allowed us to convert nearly 100% of our EBITDA to free cash flow. And we have used a portion of this cash to repurchase shares to offset dilution resulting from stock-based compensation. During this period, our free cash flow has grown meaningfully, and our share count has remained flat.

Our consolidated product development spend increased 36% year-over-year to $113 million in the fourth quarter, primarily driven by headcount additions for the Etsy marketplace. As a reminder, our product development expense line is where most of our engineers sit and represents the largest portion of our headcount growth since 2020. We ended 2022 with approximately 2,790 employees, an increase of 16% on a consolidated basis compared to 2021. As you know and can see on the chart on the left, we began to slow hiring as our growth rate slowed in the second quarter of 2022, and we also experienced very strong levels of employee retention. Fourth quarter consolidated headcount was essentially flat to third quarter. For 2022, our revenue per average full-time headcount for Etsy marketplace was $1.4 million, which is well above the approximately $800,000 for the Etsy marketplace in 2019 as we've hired at a pace significantly below our revenue growth rate.

Josh explained how we carefully measure payback from the product development expense line, which we generally see within about 18 months. In addition, returns per core product headcount also remain in line with the year ago levels, an indication that we remain efficient even with a significantly larger size of our team. Product development spend as a percentage of revenue was 16% for 2022, which as you can see on the right is now similar to our pre-pandemic range and that what we believe is in a healthy range for sustainable growth and profitability.

During the fourth quarter, we increased our consolidated marketing spend by 20% year-over-year to $245 million, primarily driven by a 29% increase in performance marketing, which represents the majority of our spend. Consolidated brand spend increased 12% year-over-year as we ran new Etsy TV and digital video campaigns in our top three core markets during the important holiday selling season. The vast majority of our spend across our marketing channels is for the Etsy marketplace but also includes spending for our subsidiary marketplaces. And for those of you who compute a customer acquisition cost from the marketing spend numbers we disclosed, please remember that our attribution models use the lifetime value of a buyer, not just a 30-day view. So some of the return occurs in a later period.

For the full year, consolidated marketing spend increased only modestly, including increases in both brand and performance spend. And we delivered 40 basis points of leverage in 2022, with our consolidated marketing spend as a percentage of revenue decreasing to 27.7%. We continue to gain efficiencies in marketing. And as you know, our offsite ads revenue offset approximately 35% of Etsy marketplace performance marketing spend, allowing us to put more dollars to work on behalf of our sellers. For the Etsy marketplace specifically, performance marketing spend drove approximately $2.5 billion in annualized GMS in 2022, up from $2.3 billion in 2021.

Moving to Etsy marketplace performance on a stand-alone basis. During the fourth quarter, Etsy marketplace GMS declined 3.5% year-over-year and was largely flat on a currency-neutral basis. We saw accelerating trends on a year-over three-year basis and growth on a currency-neutral basis during the all-important Cyber 5, with our December strength being a key factor in delivering GMS at the top end of our guidance. When looking at full year performance trends shown on this slide, it is gratifying that we have far surpassed the 16% to 20% compounded annual growth rate target we set for the Etsy marketplace back in 2019.

From a geographic perspective, 45% of fourth quarter Etsy marketplace GMS was from transactions, where either the buyer or the seller or both were outside of the U.S. This GMS was up 5% year-over-year on a currency-neutral basis, driven in part by the continued strength in Germany. Our non-U.S. active buyers reached an all-time high of 34 million in the fourth quarter, continuing to outpace U.S. active buyer growth trends. The strong U.S. dollar drove growth in the U.S. imports for the Etsy marketplace, providing additional support for our non-U.S. sellers.

Moving to category performance. During the fourth quarter, we saw strong trends in apparel and items such as bags, purses and other gifts as well as in paper and party, driven by more in-person holiday gatherings this year. Top-selling items during the holiday included personalized gifts such as custom-named necklaces and jewelry boxes. This slide shows full year 2022 Etsy marketplace GMS in our top six categories, representing 86% of total Etsy marketplace GMS in 2022. Toys and games overtook beauty and personal care by a bit to end the year as a top six category. We believe our breadth of listings remains an important competitive advantage, allowing the Etsy marketplace to seamlessly respond to shifting consumer demand. As you saw from our reporting throughout the year, weakness in home and living and craft supplies was generally offset by strength in apparel and paper and party supplies. We ended the year with 89.4 million active buyers, which was down slightly from the prior year but has held up very well through reopening and other headwinds. Our active buyers have slightly increased on a sequential basis in each of the last two quarters. We added 9.5 million new buyers in the fourth quarter. While this figure is down about 6% from the prior year, it grew 51% on a sequential basis from Q3 2022 to Q4 2022. This is a spectacular number, significantly higher than the 44% sequential growth in new buyers in the prior year. On a full year basis, we acquired 55% more new buyers in 2022 than in 2019.

Lapsed buyers are defined as existing Etsy buyers who have not made a purchase in at least a year. In the fourth quarter, we reactivated a record number of lapsed buyers, nearly 9 million. Adding that to our strong performance in the first three quarters of 2022, we reactivated a record 24 million buyers for the year, up 24% from 2021 and 87% from 2019. We'll continue to focus on this fertile growth opportunity in 2023. We ended the quarter with 7.4 million habitual buyers, a 194% increase from the fourth quarter of 2019, and they accounted for 40% of our Etsy marketplace GMS in the fourth quarter of 2022. The largest share of new habitual buyers came from Germany and Australia, a promising testament to our growing brand awareness in these markets. Our repeat buyer count remained largely unchanged from the prior year at approximately 36 million in 2022 despite the reopening headwinds, with fourth quarter repeat buyer strength coming from Germany and France.

As of December 31, we had $1.2 billion in cash, cash equivalents and short and long-term investments and a $200 million revolver that is currently undrawn. During the fourth quarter, we repurchased $150 million in stock under our $600 million May 2022 Board authorized repurchase program. Our free cash flow for the quarter was a healthy $286 million, converting 126% of EBITDA to free cash flow. I also want to point out that the capped call relating to our mostly retired 2018 convertible notes will be settled in shares on March 1. As a result, we expect to receive shares valued at approximately $157 million.

Now turning to outlook. So far this quarter, we have continued to see significant volatility in GMS on a week-to-week basis, which led us to bake a fairly broad range of outcomes into our Q1 guidance. In addition, credit card and other third-party data shows that there may be an overall shift in consumer demand to services and household supplies like groceries and away from discretionary categories. With that in mind, we currently estimate our first quarter 2023 consolidated GMS to be approximately $2.95 billion to $3.15 billion, revenue to be about $600 million to $640 million and with an adjusted EBITDA margin of 26% to 27%.

As we attempt to look past the first quarter, I'll remind you that last year we had a very strong January. We started to see rather steep GMS deceleration in the latter half of the first quarter with this deceleration continuing until about May. In a stable macro environment, the math would suggest a return to GMS growth rates in the teens in the second half of this year. However, the data and information we are seeing so far in 2023 related to consumer spending shifts and pressure from the macro environment makes us very cautious. It is possible that the benefit we would expect from moving beyond the prior year steep comps could be negated by increasing recessionary factors. It's just really tough for us to call right now.

So how do we plan in these uncertain times? We do a lot of scenario planning internally with a forecasting approach that starts with baseline trends from existing buyers and then layers on incremental growth from both new product initiatives and marketing. We also benefit from a marketplace model that operates with minimal capital requirements and relatively few fixed expenses. In fact, the majority of our consolidated expenses are either entirely variable or semi-variable with revenue trends. As I mentioned earlier, we started to meaningfully slow down our pace of hiring in the second quarter of last year, commensurate with the GMS run rate we were experiencing. Now with possible recession looming and the unpredictable way this could impact us, we are maintaining this prudent approach in 2023. We're still hiring but focused on the fewest, most critical roles and tightening our belt significantly in other discretionary areas. And as you have heard today, we have a lot in our pipeline that we are excited about. So while there is clearly an opportunity cost associated with this decision, we think it's the right thing to do given the very volatile macro conditions.

Etsy's strong acquisition of new buyers and reactivation of lapsed buyers last year are just two proof points of the strength of our brand, representative of a through line so to speak, that cuts across volatility that we have seen and may continue to see in 2023. We highly value the agility and resilience of our team in our marketplaces, which have served us so well, enabling us to lean into critical growth investments while also protecting our margins. We believe that that puts us in a position of relative strength, and it's our goal to do that again in 2023.

Being raised in California, I've always loved the saying that you can't stop the waves, but you can learn how to surf. We have proven we know how to surf even through choppy waters, and we hope that gives you as much comfort as it does to us. Thank you all for your time today, and now I'll turn the call back to Deb to take your questions."
"4","Deb Wasser","Vice President of Investor Relations & ESG Engagement at Etsy","Hi, everyone. Nice to see you all again. Thank you for joining us. I'm going to kick it off right away with some questions. We've got quite a few in the queue. Start with Maria Ripps from Canaccord. This one is going to be for Josh. Investing in search functionality has consistently been a pillar of the Etsy growth strategy. Looking out over the next two to three years, what are your top investment priorities as it relates to search? With all the recent momentum in AI and large language models, could we see some type of chat-based search functionality integrated into Etsy at some point? And then briefly, how has your image search feature been trending?"
"5","Josh Silverman","Chief Executive Officer at Etsy","Great questions. Thanks very much. So as you said, investing in search and discovery is a very, very core part of Etsy's present and our future with over 120 million or about 120 million live listings. Getting you to the good stuff is really important. Looking back at just 2022, the search team launched about 120 developments that were ramped up, meaning experiments that worked that we ramped up. And the -- some examples of those included Etsy Lens, as you referenced; better neural models; XWalk. And when we think about what those did, Etsy Lens is an example of something that allows you to talk with pictures instead of talking with words. So how do you tell the search engine what you want in really new and novel ways? XWalk helps you to process massive amounts of information, and neuro models help you to make sense of what people mean not what they say. And in fact, the neuro models we're using use the same kind of underlying algorithms that ChatGPT uses. So we're already using some of the underlying technologies that you're seeing from great innovators like Open AI, and it's having great impact.

By the way, the search team is also doing more prosaic things that are having a lot of impact. For example, search results are now getting good enough that we could put a Buy button right on search results and allow people to buy directly from search results without having to go all the way to the listing page, and that's been a great collaboration of our team to figure out exactly what information you need on the search results page in order to give someone the confidence to buy. So we made a ton of progress in 2022 in ways that improved the customer experience and drove the bottom line. We're really excited about our road map in 2023 and beyond. And I would say that similarly figuring out more novel ways to talk to our search engine, to tell it what you want, so multimodal search through maybe pictures and words, is going to be very important. Show me things of the following style that would match well with this couch. And so those kinds of things, I think, open up a huge opportunity for Etsy. Having multiple objective functions has been very helpful. How do I do something which drives conversion rate but also drives repeat visit rate? Those two actually might not be the same in terms of search results. So training our models to solve for more than one thing at one time.

Something I'm particularly interested in is how can we get better at quality. Everyone has their own view of what great looks like and what a really good item on Etsy looks like. So how can we start to better anticipate what's right for you? How can we get more personalized so that you see only the best of Etsy as according to you? We have a great road map, and I'm really excited about the work that the team is doing. To your specific question of could we see some kind of chat-like interface, very possibly, yes. I would say that we are constantly testing what's on the frontier. And if it makes our experience better and it does it in a way that's profitable, we're going to do it. One other thing I just want to say is every time that search team develops a new model, a new algorithm, we look at how much extra processing power has it used. And therefore, how much extra cost has it added? And how much does it improve conversion rate and the lifetime value of the buyers? And is that profitable to ramp up? And we only ramp up things where the benefit it adds is greater than the cost. Lastly, on your question about Etsy Lens, it's very early days. We're pretty subtle in terms of where we promote it in the search bar because we're just trying to learn how do people use it and make sure that the search result quality that we get is really good, but it's [Call Ends Abruptly]"
