"","speaker","title","msg"
"1","Operator",NA,"Good morning, and welcome to the General Motors Company Second Quarter 2023 Earnings Conference Call. [Operator Instructions] As a reminder, this conference call is being recorded Tuesday, July 25, 2023.

I would now like to turn the conference over to Ashish Kohli, GM's Vice President of Investor Relations."
"2","Ashish Kohli","Vice President of Investor Relations at General Motors","Thank you, Amanda, and good morning, everyone. We appreciate you joining us as we review GM's financial results for the second quarter of 2023. Our conference call materials were issued this morning and are available on GM's Investor Relations website. We are also broadcasting this call via webcast.

Joining us today are Mary Barra, GM's Chair and CEO; Paul Jacobson, GM's Executive Vice President and CFO; and Kyle Vogt, CEO of Cruise. Dan Berce, President and CEO of GM Financial, will also be joining us for the Q&A portion of the call.

On today's call, management will make forward-looking statements about our expectations. These statements are subject to risks and uncertainties that could cause our actual results to differ materially. These risks and uncertainties include the factors identified in our filings with the SEC. Please review the Safe Harbor statement on the first page of our presentation, as the content of our call will be governed by this language.

And with that, I'm delighted to turn the call over to Mary."
"3","Mary T. Barra","Chair and Chief Executive Officer at General Motors","Thanks, Ashish, and good morning, everyone. Our operating results continue to demonstrate strong growth, thanks to an incredible customer response to our new trucks and SUVs around the world and strong execution of our business plan by the GM team, our dealers and suppliers. Together, we delivered $3.2 billion in EBIT-adjusted in the second quarter, including an $800 million charge for new commercial agreements we have with LGE and LGES. The charge reflects the conscious decision we made during the Chevrolet Bolt EV recall to serve our customers in ways that go beyond traditional remedies and we're taking new steps that will reduce our costs and improve our margins overtime. We'll provide more details about EV margin improvement and IRA benefits at the Investor Day in November.

Our momentum is broad-based, Year-over-year, we have now delivered four consecutive quarters of higher retail market share in the U.S. and our total share was up almost one full point in the first-half, with strong pricing and incentive discipline. We lead the U.S. industry in both commercial and total fleet deliveries calendar year-to-date. We now have led the U.S. industry in Initial Quality for the second year in a row. We are focused on strong cost discipline and we are taking additional steps to lower our capital spending. All of this impacts the bottom-line. So, we are raising our full-year earnings, free cash flow and EPS guidance for the second time this year.

We now expect full-year EBIT-adjusted earnings to be in the range of $12 billion to $14 billion, up $1 billion from our guidance. Adjusted automotive free cash flow is now expected to be up $1.5 billion in a range of $7 billion to $9 billion and EPS is now expected to be in a range of $7.15 to $8.15 per share. The actions we are taking to be more efficient are also having an immediate effect on capital spending. We now expect capital spending in 2023 to be in the $11 billion to $12 billion range, which is about $1 billion less than the high-end of our prior guidance. And we're working on more reductions. This guidance assumes that we successfully negotiate new labor agreements without work stoppage. Our results in our new guidance underscore the strength of our products today.

Last quarter, we talked about new vehicles we're launching to support strong margins, all of them are connecting with customers. At the higher-end of the pickup market, the GMC Sierra AT4 and Denali models are now 70% of heavy-duty retail sales. Premium models also account for more than 70% of sales for the new GMC Canyon midsize pickup. For the Chevrolet Colorado, our high performance off-road model, the Z71 Trail Boss and ZR2 represent more than half of retail sales. The new Chevrolet Trax is also off to a very fast-start and it's driving solidly profitable growth.

In the U.S., we delivered more than 20,000 trucks in the second quarter and we expect that to keep growing. Half of these customers are new to General Motors. All of these new vehicles help us deliver more than a $1,600 per unit increase in ATPs in the U.S. compared to first quarter, with flat incentives and essentially flat inventory. We have the largest ATP increase in the industry by far. The other growth products I highlighted last quarter, the Chevrolet Montana in South America and the Trax in Korea also continue to build momentum. The Montana is our first compact pickup for the Brazil market. And in just four months, it has earned one-third of this segment. We're now expanding distribution to other markets in South America. In Korea, the Trax is an unqualified success, just like it is in the U.S., pricing is strong and has earned more than 50% market share in its segment and two-thirds of the customers are new to GM. These hits and the great work the team has done and caused have us on-track to deliver significantly higher EBIT-adjusted in GM International this year, excluding China equity income.

Looking ahead, we have several launches in growing segments around the world that will keep our momentum going. In North America, these include the 2024 Chevrolet Traverse, which we revealed earlier this month. It goes into production in Lansing, Michigan, late this year. In the EV market, we achieved our target of to produce 50,000 electric vehicles in North America in the first-half, about 80% were the Chevrolet Bolt EV and EUV. The Ultium platform production is increasing. We've had more than 2,000 customer reserve GMC HUMMER EVs and Cadillac LYRIQs in transit to dealers at the end of June. With both cell and vehicle production increasing, we continue to target production of roughly 100,000 EVs in the second-half of the year and we'll continue to grow from there. Demand for our EVs remains very strong, because the Ultium platform is purpose-built for electric vehicles. And it does not force customers to compromise on style, performance, utility, range or towing.

We have experienced unexpected delays in the ramp, because our automation equipment supplier has been struggling with delivery issues that are constraining module assembly capacity. We are working on multiple fronts to put this behind us as quickly as possible and things are already improving. For example, we have deployed teams from GM manufacturing engineering to work on-site with our automation supplier to improve delivery times. We've also added manual module assembly lines and we're installing more module capacity at our North American EV plants beginning with Factory Zero in Spring Hill this summer; Ramos Arizpe in the fall; and CAMI in the second quarter of next year.

And to address pent-up demand among our HUMMER EV customers, we are planning to increase second-half production by thousands of units. In the meantime, Ultium Cells LLC is delivering great quality and production, is ahead of schedule. Looking ahead, the next phase of our EV acceleration is coming into sharper focus. For example, we have now secured more than half of our 2030 direct sourcing target for many critical raw and process materials we need with significant onshoring. During the quarter, this included an expansion of our cathode active material joint venture in Canada and an investment to bring manganese sulfate processing to a new facility in Louisiana. As with other recent announcements, these agreements provide us with significant offtake and favorable commercial terms, which is a key component of the EV margin improvement strategy we outlined last quarter.

Now let's talk about fixed costs. Due to the success of the $2 billion fixed cost reduction plan we announced earlier this year, we have identified another $1 billion in fixed costs that we will deliver over the same 2023 to 2024 timeframe. This new action will offset about $1 billion in depreciation and amortization, which means that relative to 2022, our automotive fixed cost will be down $2 billion on a net basis as we exit '24. Key components include about $1 billion from the voluntary separation program, another $800 million in reduced sales and marketing expense and the remainder coming from significant reduction in all areas of the business, including engineering expense, travel and administrative costs. We're not done by any stretch. Mark and I have asked Norm de Greve, our new Chief Marketing Officer, to take a fresh review of our spending and put us on a course to deliver world-class levels of marketing efficiency.

Our product teams are also embracing a strategy, we call, winning with simplicity, that will reduce design and engineering expense, supplier costs, order complexity, buildable combinations and manufacturing complexity. For example, our teams are applying even greater discipline around our color and trim pallets, the way we package features and options and reuse. For our EV and ICE vehicles, we are targeting a 50% reduction in trim levels through a smart bundling of customer features and options. This results in fewer part numbers to simplify marketing, engineering, manufacturing, while maintaining the best features customers want. Yet, we are maintaining market coverage for all major segments and price points. In the U.S., we'll compete in ICE and EV segments that represent about 90% of the industry volume in 2030. Our next-generation full-size pickup and SUVs will show just how powerful winning with simplicity will be. We are investing significantly less capital and expect to deliver vehicles that will have much higher levels of customer-facing content and even better margins than today.

Another great example of a capital-efficient program is the next-generation Chevrolet Bolt that we plan to execute. Our customers love today's Bolt. It has been delivering record sales in some of the highest customer satisfaction and loyalty scores in the industry. It's also an important source of conquest sales for the Company and for Chevrolet. More than 70% of customers are new to GM. We will keep the momentum going by delivering a new Bolt that delivers what customers have come to expect, which is great affordability, range and technology. And we will execute it more quickly compared to an all new program and with significantly lower engineering expense and capital investment by updating the vehicle with Ultium and Ultifi technologies, and by applying our winning with simplicity discipline. We will have more details to share soon.

Now before we move to Paul's comments and Q&A, I'd like to invite Kyle to update you on important steps Cruise has taken to scale its business and make it profitable. So, Kyle, over to you."
"4","Kyle Vogt","Chief Executive Officer at General Motors","Thanks, Mary. We are halfway through our first year of rapid scaling and it's going extremely well. We're on a trajectory that most businesses dream of, which is exponential growth driven by continuous improvement, engineering innovation and solid product market fit. Our formula for driving this growth is quite simple: number one, we increase the supply of vehicles; number two, we increase the service availability, so more people can use it; and number three, we make the product awesome.

So, let's talk about how we're doing on all of those and then get into the numbers. On the supply side, we recently hit 390 concurrent driverless AVs. We believe this is the largest and fastest-growing AV fleet in the world. Yet, you will see several times this scale within the next six months. This is all on the Bolt platform, which we can scale to thousands of AVs. But we're also about to transition to Origins, which are a game changer for cost and are incredible the ride-in. And today, I'm pleased to share that our test vehicles are already running in-driverless mode on public roads in multiple cities. And we are confident in our regulatory and permitting path, despite this being the first time a major OEM has manufactured a vehicle without traditional controls. As a result, we believe we're the only AV company with a well-defined and significantly derisk path to reach billions in revenue.

On the second item, availability, we're rapidly expanding cities, hours and service area. As a -- very recently, we now operate a significant portion of our San Francisco fleet 24/7 across the entire city. We've expanded geofences and hours in Austin and Phoenix, and we plan to expand significantly in the next 30 days. Lastly, we've done the prep work and we'll launch commercial service in two or three more cities in the next 12 weeks alone, bringing us to as many as six commercial markets, with several more following shortly after. All the critical ingredients, things like mapping, ground infrastructure, validation, user acquisition, etc. have become several times more efficient as we move from city to city.

On the third, making the product awesome. We have over 85,000 five-star reviews in San Francisco alone. People love the product and it gets better every month with each new software update. And based on data from tens of thousands of users across multiple cities, it's clear to us now that demand will greatly exceed supply for several years. And this gives us margin opportunity and the potential to be ahead of plan on revenue growth. Now, that is rapid scaling.

I'll share a few additional data points before we move on. Cruise cracked 3 million miles just 49 days after hitting 2 million miles, and the next mile -- million is going to be even faster. We're now doing over 10,000 rides per week. But more importantly, we're growing rides at 49% per month on average over the last six months. 28-day user retention is nearly at the level of a fully matured human ride-hailing service and it continues to trend upwards. The product is extremely sticky despite the limitations in hours and service availability that exist today.

All of that scaling is occurring while also improving safety and driving down costs. So, let's take a look at those. Safety continues to improve despite increasing complexity. Our analysis of the first million miles shows AVs experienced 54% fewer collisions than human drivers in similar environments and 92% fewer where the AV was the primary contributor. In other words, the vast majority of collisions are caused by inattentive or impaired human drivers, not the AV. And we expect the gap between human and AV performance to get much wider over the next 12 months.

On the cost side, we're seeing ideal trends. Our operational cost per mile traveled has gone down by an average of 15% per month for the last six months, led by optimizations in infrastructure, process improvements and automation. Our fixed cost in the machine learning training and simulation are also decreasing overtime due to better simulation techniques and investments in efficiency. The most exciting is the step-function improvements in cost we will see as our newer vehicles and EV architectures launch. Due to having a much longer service life, the Origins significantly reduces our cost per mile. We also have an optimized sensing and compute architecture in late-stage development that cost about 75% less and will be on the very first Origins. It's the first time cruisers custom chips will hit the road, which we expect before the end of next year. As our fleet rolls over to this architecture, we'll start to see costs hit below $1 per mile, the magic threshold at which robotaxi has become cheaper for most people than owning a car. Lastly, we have something else that's been in the works for a few years, that is highly disruptive to the already highly disruptive AV industry. More on that later this year.

So, putting these things together, it's clear now that Cruise is no longer a science project. There was one significant risk and reasons to doubt, but it's now a rapidly-growing business with a transformational product in a multi-trillion dollar TAM. We've made incredible progress in Q2 over Q1. And I'm excited to continue that momentum in the months ahead. We're truly just getting started.

Back to you, Mary."
"5","Mary T. Barra","Chair and Chief Executive Officer at General Motors","Thanks, Kyle. And thanks for sharing the progress that the Cruise team is making is just incredible. So, before we move into Paul's remarks, I'd like to address our negotiations with the UAW, which just kicked-off, and with uniform. First and most importantly, I want to say how proud I am of our talented and experienced manufacturing workforce. There's a direct connection between their hard work and our success, and we have a great future ahead of us. As we've talked about today, the future includes continued investment in strategic ICE vehicles, like the full-size trucks, full-size SUVs and mid-size SUVs. Our future also includes retooling existing assembly plants and upskilling the team as we transform the Company to grow rapidly in EVs.

We have a long history of negotiating fair contracts with both unions that reward our employees and support our long-term success of the business. Our goal this time will be no different. That's the best possible outcome for all of our employees, plant communities dealers suppliers and investors and we look forward to constructive talks.

So, thank you, and now, let me turn the call over to Paul."
