"","speaker","title","msg"
"4","Ronald N. South","Senior Vice President, Chief Financial Officer at Henry Schein","Thank you, Stanley, and good morning, everyone. I'll be discussing our results as reported on a GAAP basis and also on a non-GAAP basis. Our second quarter non-GAAP financial results for 2023 and 2022 exclude integration and restructuring costs and amortization expense of acquired intangible assets. This is detailed in Exhibit B of today's press release.

With respect to sales growth, I will focus on LCI sales growth, which is internally generated sales in local currencies compared to the prior year and excludes acquisitions. Second quarter global sales were $3.1 billion or LCI sales decrease of 0.2%. However, when excluding sales of PPE products and COVID-19 test kits, our LCI sales grew 3.3%.

We sold $138 million in PPE products in the second quarter of this year, a decrease of approximately 28% year-over-year, and we sold $26 million and COVID-19 test kits, a decrease of approximately 62% year-over-year. Our GAAP operating margin for the second quarter of 2023 was 6.5%, an 81 basis point decline compared with the prior year GAAP operating margin. On a non-GAAP basis, operating margin for the second quarter was 8.2%, a 14 basis point decline compared with the prior year non-GAAP operating margin. Excluding the impact from lower PPE and COVID-19 test kit sales, we estimate that non-GAAP operating margin expanded 27 basis points.

Second quarter 2023 GAAP net income was $140 million or $1.26 per diluted share. This compares with prior year GAAP net income of $160 million or $1.16 per diluted share. Our second quarter 2023 non-GAAP net income was $173 million or $1.31 per diluted share. This compares with prior year non-GAAP net income of $179 million or $1.30 per diluted share. These results were impacted by a decreased contribution from lower PPE and COVID-19 test kit sales estimated to be $0.08 per diluted share relative to the prior year period. The foreign currency exchange impact on our second quarter EPS was immaterial.

As Stanley mentioned, we have committed over $1 billion in the acquisitions we've announced s -far this year, with $250 million invested in equity investments and business acquisitions in the second quarter of this year and we have subsequently signed agreements, committing another $800 million. The increased capital deployment for acquisitions has impacted quarterly financial results more than in previous years. The second quarter 2023 GAAP and non-GAAP financial results included high acquisition activity that resulted in acquisition expenses of $6 million or $0.04 per diluted share, which were offset by net acquisition-related fair-value adjustments of $16 million or $0.09 per diluted share, including a related remeasurement gain resulting from the purchase of a controlling interest of our previously held equity investment. This resulted in a net favorable impact of $10 million or $0.05 per diluted share for the quarter as illustrated in Exhibit C to our press release.

On a year-to-date basis, the favorable net impact of these acquisition expenses and acquisition-related fair-value adjustments, including the related remeasurement gain resulting from the purchase of a controlling interest of our previously held equity investment was only $0.01 per diluted share. We are confident that these strategic investments will drive enhanced growth and value-creation over the long-term as we accelerate the implementation of our 2022, 2024 BOLD+1 Strategic Plan.

Turning to our second quarter sales results. Global dental sales were $2.0 billion and LCI sales increased by 2.0%. Excluding sales of PPE products, LCI sales growth was 3.7%. Global dental merchandise LCI sales increased by 0.7%, but increased by 2.8% when excluding PPE products. North America dental merchandise sales were flat compared to the prior year and grew 2.6% when excluding sales of PPE products with good underlying growth, offset by lower-growth in our dental lab business as a result of digitalization and in our traditional orthodontics business.

International dental merchandise LCI sales increased by 1.9% and by 3.2% when excluding sales of PPE products. Global dental equipment LCI growth was 6.4%. Our North America dental equipment LCI sales increased 9.8% as we continue to see strong sales growth for traditional equipment and sales of digital equipment in North America return to growth. International equipment LCI sales increased by 1.6%.

Dental specialty products include implants, bone regeneration materials, orthodontic products and endodontic products. Sales of these products were approximately $270 million in the second quarter, with growth of 15.7%, driven by acquisitions and good implant sales in both North America and internationally, particularly in Austria, Switzerland and in Germany where we have a leading market position.

Global technology and value-added services sales during the second quarter were $193 million with LCI growth of 5.5%. Sales were again negatively impacted by government contract which expired early in the third quarter of 2022, LCI sales growth was 6.9% when adjusting for this contract. In North America, sales growth was driven primarily by our Dentrix Ascend, Practice Management and Revenue Cycle Management businesses. Growth internationally was driven by our Dentalee cloud-based solution.

Global Medical sales during the second quarter were $950 million and LCI sales decreased 5.3% due to lower sales of PPE products and COVID-19 test kits. In North America, excluding sales of PPE products and COVID-19 test kits, LCI sales grew 2.0% and were impacted by lower flu cases versus the prior year, which resulted in lower point-of-care diagnostic tests and related product sales. Keep in mind, this was against a very difficult comparison as LCI growth excluding PPE products and COVID-19 test kits grew 14.3% in the second quarter of 2022.

Regarding stock repurchases, we repurchased approximately 638,000 shares of common stock in the open market during the second quarter, buying at an average price of $78.36 per share for a total of $50 million. At quarter end, we had approximately $365 million authorized and available for future stock repurchases.

Turning to our balance sheet and cash flow, we continue to benefit from significant liquidity, providing our businesses with the financial flexibility and stability to execute on organic growth initiatives and strategic acquisitions, while continuing to return capital to our stockholders. We further strengthened our balance sheet by recently extending the maturity date of our $1 billion revolving credit facility to July of 2028, and also closed on our new $750 million credit facility.

Operating cash flow for the second-quarter was $274 million compared with $157 million last year, primarily as a result of lowering inventory levels. Restructuring expenses in the second quarter of $18 million or $0.10 per diluted share and were incurred as part of our previously disclosed restructuring initiative. These expenses mainly relate to severance benefits and costs related to exiting facilities. We now expect restructuring activities to extend through 2024.

Let me conclude my remarks with our 2023 financial guidance. At this time, we are still unable to provide estimates for costs associated with integration and restructuring for 2023, therefore we are not providing GAAP guidance. We are affirming our guidance for 2023 non-GAAP diluted EPS attributable to Henry Schein, Inc, a $5.18 per share to $5.35 per share, which is now 1% to 4% compared with our 2022 non-GAAP diluted EPS of $5.38, and includes the previously announced $0.05 to $0.10 dilution from 2023 acquisitions, which is consistent with our prior guidance, and has been updated to include second quarter results and the impact of all acquisitions that have been announced so far. The net impact of acquisition expenses and acquisition-related fair-value adjustments, including the related remeasurement gain resulting from the purchase of a controlling interest of a previously held equity investment is expected to be insignificant for 2023 and has been included in guidance. We expect these acquisitions to contribute to earnings growth beginning in 2024.

It is important to recognize that we expect year-over-year growth in diluted EPS to be higher in the fourth quarter than in the third quarter of this year. Our guidance for 2023 assumes total sales growth of approximately 1% to 3% over 2022. As a reminder, our guidance reflects one less selling week in 2023 than 2022. Our sales growth reflects a larger decline in sales of COVID-19 test kits, which we now expect to decrease by approximately 70% to 80% from 2022 versus our previous guidance of a 65% to 70% decrease. Additionally, PPE product sales are expected to decrease about 25% to 30% versus our previous guidance of a decrease of 20% to 25%. Despite the expected lower PPE and COVID-19 test kit sales, the impact on 2023 non-GAAP diluted EPS from PPE products and COVID-19 test kits is still estimated to be $0.35 to $0.40 per share due to higher-than-anticipated gross margins on PPE sales relative to our original guidance.

We are driving strong earnings momentum in our underlying core businesses and we still expect non-GAAP operating income will grow in the high-single-digit to low-double-digit range when excluding the contribution from PPE products and COVID-19 test kit sales. We continue to expect non-GAAP operating margin contraction of 10 basis points to 15 basis points from the 2022 non-GAAP operating margin of 8.2%. And this is largely a result of lower PPE products and COVID-19 test kit sales and profits. Our guidance reflects non-GAAP operating margin expansion when excluding income from PPE products and COVID-19 test kit sales.

Our 2023 guidance includes higher interest expense than in 2022 and as a result of higher interest rates and borrowing levels. We also expect an effective tax rate for the year at the 23% range, assuming no changes in tax legislation. Our guidance is for current continuing operations as well as acquisitions that have been announced and does not include the impact of future share repurchases and potential future acquisitions. Guidance also assumes that foreign currency exchange rates are generally consistent with current levels and the end-markets remain consistent with current market conditions.

With that, I'll now turn the call back to Stanley."
"5","Stanley M. Bergman","Chairman of the Board and Chief Executive Officer at Henry Schein","Thank you, Ron. We are here to answer any questions which investors may have. So, operator?"
"6","Operator",NA,"Thank you. [Operator Instructions] One moment please while we poll for questions. And the first question comes from the line of Elizabeth Anderson with Evercore ISI. Please proceed with your question."
"7","Elizabeth Anderson","Analyst at Evercore ISI","Hi guys. Thanks so much for the question. I have maybe one shorter-term question and one longer-term question, in terms of the shorter-term question, obviously the fair value adjustment was new this quarter and I just wanted to sort of make sure I understood, was this something that you knew sort of last quarter when you updated your guidance or because we're just trying to -- I'm just trying to understand whether the like core guidance moved down ex that?

And then my longer-term question. It's obviously very interesting with you adding all these new capabilities and geographies and how do we think about, like for example for, S.I.N. and like how long that, that might take or what your plans are in terms of bringing those implant into the United States? And then similarly in terms of the medical, the ability to sort of push those sort of more broadly across the new products across your portfolio. Thank you so much."
"8","Ronald N. South","Senior Vice President, Chief Financial Officer at Henry Schein","Certainly, Elizabeth. I'll take the first question and Stanley will respond to your second question. So the remeasurement gain was something we contemplated in our guidance. We didn't have a definite amount for it. Just like we weren't sure how much our acquisition costs were going to be either. So, ultimately those, as we've kind of demonstrated in that exhibit to the press release, those amounts once we realized is a higher expenses and we also realized the net remeasurement gain have largely offset on a year-to-date basis. So, yes, our guidance does contemplate the effect of those items. Sd I'll -- Stanley, if you want to take the second question."
"9","Stanley M. Bergman","Chairman of the Board and Chief Executive Officer at Henry Schein","Thank you. Elizabeth, the S.I.N. implants, not the whole line, but significantly important part of portfolio already approved in the US are selling to some extent and are being well-received by our particularly DSO customers where we in fact by coincidence last week were able to land a pretty decent DSO that is interested in the S.I.N. and implant, the system. It puts us and the whole S.I.N. transactions puts us in a very competitive position now because to some extent in the US and maybe some other markets, although BioHorizons Camlog is a premium product selling at a slightly lower-price than some of the major brands, if not all of them, we still are missing a piece in our portfolio on the more economic side of implants and now I believe we are well-positioned with S.I.N, and I believe in next year or so we will be able to also launch the Biotech line in the United States different market segments, but I think we're definitely in a very competitive position now and are actually starting to see some sales."
"10","Elizabeth Anderson","Analyst at Evercore ISI","And then for Shield as well, that sort of a similar timeline and you can sort of push that across your broader portfolio later this year or is that more, but we should think about that as more of a '24 type of occurrence?"
"11","Stanley M. Bergman","Chairman of the Board and Chief Executive Officer at Henry Schein","No, I think -- we acquired Prism about a year or so ago -- two years ago, which was mostly an East Coast business with a relatively limited portfolio. Shield puts us into the West Coast with a broader portfolio. And Shields was missing the wound care offering that Prism had. So we believe we will create synergies relatively quickly. There are costs, of course, in integration, which we've taken into account in our guidance, so mostly one-time costs.

But I think in '24, we should be able to start adding accretion in a nice way. This has really been an area that our customers -- big IDN customers that wanted us to perform. And we didn't undertake these kinds of services. We have one IDN in New York area that we service in the Homecare area, but we didn't really have the full capabilities between these two acquisitions and another small one which we hope to announce soon. We will have a pretty good offering in products for the home and will be a great extension to our physician urge care business."
"12","Operator",NA,"And the next question comes from the line of Brandon Vazquez with William Blair. Please proceed with your question."
"13","Brandon Vazquez","Analyst at William Blair","Hi everyone. Thanks for taking the question. Maybe first on one high-level question just on the macro backdrop. Can you guys talk about where you're seeing some strengths and weaknesses in the environment today? I think maybe equipment looked pretty strong in the US, but maybe a little weaker international and then consumables globally look kind of stable, low-single digits. So, curious how all these segments on the dental side are playing out from the macro side."
"14","Stanley M. Bergman","Chairman of the Board and Chief Executive Officer at Henry Schein","Yes. Thanks for that question. On the macro side in North America I believe there is stability on the dental side, that's what our team believes in general. Consumables, people are -- patients are returning to the dental office. If the data is not perfect, but if you look at the latest ADA survey and some recent analyst reports and studies suggest that patient traffic picked up throughout the second quarter after the steady volumes in the first quarter of '23. And so we. And so we, of course, we had some volatility in the first quarter of '22. And so it appears that patient flow is good. July, from that point of view was a good month. E-claims data also suggests that what I've just described, is backed-up again by e-claims data from Henry Schein One. If you peel the onion a little bit further, at least from our point of view, implant sales continue to grow well in North America. And the same for endodontics, our small aligner business is showing similar kinds of trend.

If you look at international, it's slightly more tepid in international. It's hard to tell because we're now in the summer months, that when the summer months when Europe is largely closed. Having said that, we did suffer in the second quarter because of the strikes in France. I would say Germany is okay. There we had pretty strong numbers in 2022 from a comp point of view because we had the Sera traded in the second quarter of 2022. Patient traffic in Germany which is our biggest market outside of the US. seems to be steady. There is somewhat of a staff shortage.

But again it's really hard to tell this is the vacation month now in July, August, and it's very hard to tell exactly what is happening in Europe, Germany. But from our checks, it's pretty steady. We don't see much of it to deterioration at all, in fact it could be on the positive side. So, generally dental and medical okay. On the medical side a little bit more. We did have high comps last year in 15% almost growth. So, the medical is not going to, as we did caution at the time present that kind of growth going forward. There is some trading to more generic products specifically on the pharmaceutical side doesn't impact the absolute dollar profits.

But I think medical is at least with the ASC business is back to where it was before COVID. And I think if you take out the unusual visits that we experienced in the first half of last year because of flu, I think medical is pretty stable as well. I think a on the other hand, I believed our market share is growing. On the specialty product side, again I think we've covered this in our call and introduced from our point of view, we don't see any major impact. From a units point of view, that is trading to lower-priced products specifically from our DSO customers. But in general, our markets are stable and I think we are quite comfortable at this moment. our backlog on equipment year-on year in North America is pretty similar to where it was at the end of last quarter. And on the international side is building up the game to pre-COVID levels. So, I would say stability or around, that would be our view at this moment. Thank you."
"15","Brandon Vazquez","Analyst at William Blair","Perfect. Thank you very much. And maybe one other quick one for Ron. We're trying to -- can you clarify and you may have given this already on the call, but just to be clear. Can you kind of talk about what EPS growth is in '23 and baked in the guidance, ex to PPE and COVID? And part of why I'm asking is just to make sure we understand what underlying dynamics are, we're kind of looking at our 2024 models where may be PPE and COVID sales can kind of stabilize and we can return to some more normalized growth rates. Thank you."
"16","Ronald N. South","Senior Vice President, Chief Financial Officer at Henry Schein","Yeah. Our full-year guidance is is still $5.18 to $5.35. And that includes an expected $0.35 to $0.40 headwind versus the prior year OF impact on EPS from contributions from PPE sales and COVID-19 test kit sales. So that remains unchanged From a guidance standpoint, while we've adjusted the -- some of our revenue assumptions on those products because of the better-than-expected margins on the PPE sales we haven't had to adjust the $0.35 to $0.40 expected headwind that was built into our original guidance."
"17","Operator",NA,"And the next question comes from the line of Jeff Johnson with Baird. Please proceed with your question."
"18","Jeffrey Johnson","Analyst at Robert W. Baird","Thank you. Good morning, guys. Stanley, maybe I would like to dig a little deeper on your North American comments. Consumables, you described that market is fairly stable. I think that fits with a lot of our survey data as well. The consumables number though did come down to 2.5% on an organic basis ex PPE this quarter, last quarter it was 6.5%. Do you think that's just the comps from the Omicron stuff in the first quarter last year that really helped inflate that first quarter number? Was there any change in pricing dynamics? Any other factors kind of bridging from the 6.5% first quarter to the 2.5% consumables growth in this quarter? Thanks."
"19","Stanley M. Bergman","Chairman of the Board and Chief Executive Officer at Henry Schein","A very Good question Jeff. Thanks for asking. I think you need to take the fourth quarter of 2022 and the first quarter of '23 and more or less average out because of the cut-offs and leads a little bit higher in the first quarter, but it certainly wasn't 6.5% growth apples-to-apples. I think we covered that in the past. I would also suggest that inflation in the consumable will in the Dental arena has muted. Maybe some products individually of certain brands have gone up, they're not necessarily fixed from the manufacturer pass through, but that the manufacturers are not necessarily able to hold all these consumable price increases.

At the same time, there is a movement towards corporate brand/generics. And some of the smaller brands are doing well, where some of those manufacturers are prepared to keep prices or even reduce prices. So it's very hard on a one-quarter basis to give you the perfect measurement of mix. But I would take into account the cut-offs for '22 for the fourth quarter and I would take into account the fact that generally there's been some deflation in merchandise prices. And I would say this is particularly coming from the larger DSOs and the mid-size DSOs who are today a lot more educated consumers than in the past. This is not really impacting our margin per se -- the general mix of our margin to DSOs. So there's a lot of nuance in what I just said. But let's see what happens in the third quarter and fourth-quarter, but my sense is the trend that I just described is not going to change much."
"20","Jeffrey Johnson","Analyst at Robert W. Baird","All right. Now my follow-up, Stanley. So is there more deflation to come or you are able to kind of take in that step-down and you think we can hold steady from there? And then, Ron, just a follow-up on your -- on the nonrecurring below-the-line -- well, I think it was above-the-line actually this quarter on the one-time gain. The $0.05 to $0.10 of dilution is unchanged. That is on a gross amount, you're talking about a net den impact from acquisition activity being close to flat this year. If you had provided that net guidance last quarter, would that have also been flat? So essentially you're not changing your gross or your net acquisition guidance for the year. Just wanted to understand that. Thank you."
"21","Ronald N. South","Senior Vice President, Chief Financial Officer at Henry Schein","Jeff, it's hard to tell as I -- maybe I wasn't clear exactly what the impact is going to be of deflation, whether it's price reduction on specific branded products or switch to generic or other manufacturers for specific kinds of products. Yeah, I doubt we're in more than 100 basis point to 150 basis point swing, maybe 200 basis point. But I'm not sure it's much different to that. So, I don't think inflation is going to be significant in the dental consumable business. I think it may go down slightly to deflation. But we're in that range. Units are holding more or less steady. Of course, from our point of view, we're growing our specialty business, although the business may be growing, it doesn't have an impact really in a material way on our total sales of dental consumables is because it's not material in the context of the whole consumable offering. Having said that, specialty products are impacting our margin in a positive way and are corporate brands and some of the smaller manufacturers. And, Jeff, to answer the second part of your question. The $0.05 to $0.10 that we referred to after the first quarter when we amended guidance was with specific reference to the expected dilutive effect during the year from the Biotech. We were holding that $0.05 to $0.10, but it now if for all the acquisitions that we have announced so far this year. Apart from that, we have higher-than-expected acquisition expenses, which are largely offset by the remeasurement gain that we recorded in the second quarter as well. So we've kind of have set those aside, and that was the purpose of Exhibit C to the press release so people could see the components of that, and we're holding to the $0.05 to $0.10 of dilution. But now it captures all of all of the acquisitions that we've announced to date."
"22","Operator",NA,"And the next question comes from the line of Jason Bednar with Piper Sandler. Please proceed with your question."
