"","speaker","title","msg"
"22","Lisa M. Barton","Chief Operating Officer at Alliant Energy","One thing I would add is -- the one thing I would add is, our renewables portfolio really protects our customers from fuel cost volatility. The fact that 40% of our retail customers were served by renewable resources is a big differentiator I think for us."
"23","Alex Mortimer","Analyst at Mizuho Securities","Understood. All right. Thanks so much and congrats on the quarter."
"24","Operator",NA,"[Operator Instructions] Your next question will come from James Kennedy at Guggenheim. Please go ahead."
"25","James Kennedy","Analyst at Guggenheim","Hey guys, good morning. Happy Friday."
"26","John Larsen","Chairman and CEO at Alliant Energy","Good morning, James."
"27","James Kennedy","Analyst at Guggenheim","Just a quick one. I'm sorry if I missed this, but what will you be in a position to provide in terms of guidance for the next update if the Wisconsin case is still outstanding."
"28","Robert Durian","Chief Financial Officer at Alliant Energy","Yeah, James, this is Robert. So if you think forward to the third-quarter conference call in early November and the EEI[phonetic] Finance Conference will be shortly after that. We will be providing updated capital expenditure and rate base projections for 2023 through 2027 and expect to have additional insights on expectations of our rate reviews in Iowa and Wisconsin to provide us more specifics on what we'll see for earnings guidance and financing plans in 2024."
"29","James Kennedy","Analyst at Guggenheim","Okay, what is the formal guidance on it?"
"30","Robert Durian","Chief Financial Officer at Alliant Energy","To be determined, like I said, we're expecting to make good progress with both of those proceedings in Wisconsin and Iowa and hopefully have more details or specifics regarding exactly what we'll show for earnings guidance of '24 and financing plans for '24, we're still very confident with the 5% to 7% long-term growth plan for EPS. So you shouldn't expect anything. But we'll just provide some more specifics. Hopefully, once we get further through these rate revisions."
"31","James Kennedy","Analyst at Guggenheim","Okay, cool. And then on the settlement, the battery wasn't included, so I guess just pathway forward there. Any color you can provide?"
"32","John Larsen","Chairman and CEO at Alliant Energy","Yeah, maybe James, I'll just note that battery storage is very cost-effective solution and quite frankly, important part of our resource plan for our customers. So we fully expect to advance energy storage. But there are some options on kind of the regulatory recovery and preceding going-forward. So a little more to be played out as the RPU preceding advances, so I think we'll have more updates as we get to the Q3 call or EEI on the energy storage."
"33","James Kennedy","Analyst at Guggenheim","Excellent. Thanks guys. Have a good weekend."
"34","John Larsen","Chairman and CEO at Alliant Energy","Yeah, thank you."
"35","Operator",NA,"As there are no other questions I will turn the conference back to Susan Gille, for any closing remarks."
"36","Susan Gille","Manager of IR at Alliant Energy","This concludes Alliant Energy's Second Quarter Earnings Call. Thank you for your continued support of Alliant Energy and feel free to contact me with any follow up questions."
"37","Operator",NA,"[Operator Closing Remarks]"
