"","speaker","title","msg"
"1","Operator",NA,"Good morning, and welcome to the Healthpeak Properties Incorporated Second Quarter Conference Call. [Operator Instructions] Please note this event is being recorded.

I would now like to turn the conference over to Andrew Johns, Senior Vice President of Investor Relations. Please go ahead."
"2","Andrew Johns","Senior Vice President of Investor Relations at Healthpeak Properties","Welcome to Healthpeak's second quarter 2023 financial results conference call. Today's conference call will contain certain forward-looking statements. Although, we believe the expectations reflected in any forward-looking statements are based on reasonable assumptions, our forward-looking statements are subject to risks and uncertainties that may cause actual results to differ materially from our expectations. A discussion of risks and risk factors is included in our press release and detailed in our filings with the SEC. We do not undertake a duty to update any forward-looking statements.

Certain non-GAAP financial measures will be discussed on the call. In an exhibit of the 8-K we furnished with the SEC yesterday, we have reconciled all non-GAAP financial measures to the most directly comparable GAAP measures in accordance with Reg G requirements. The exhibit is also available on our website at healthpeak.com.

I'll now turn the call over to our President and Chief Executive Officer, Scott Brinker."
"3","Scott Brinker","President and Chief Executive Officer at Healthpeak Properties","Thanks, Andrew. Good morning, and welcome to Healthpeak's second quarter earnings call. Joining me today for prepared remarks is Pete Scott, our CFO and our senior team is here for Q&A. Last evening, we increased earnings guidance and reported 4.8% blended same-store growth. The balance sheet remains in great shape. Through streamlining and automation, our G&A for 2023 is expected to be 6% below our original 2022 guidance. We're operating in a volatile macro environment. We have a strong handle on things we can control.

The fundamental driver of demand for our real estate is the desire for improved health, which is only growing. Equally important, we benefit from the impact of technology across our playing field of medical discovery and delivery. For example, progressive health systems now have 10 plus outpatient locations for every one hospital, with the strategic plan to grow that ratio to 20-plus. The hospital remains the epicenter, but much of the growth is outpatient, made possible by technology.

The shift in delivery aligns with our strategy to capture the outpatient real estate needs of leading health systems. And with tighter profit margins because of the cost of labor, health systems will increasingly seek knowledgeable third-party capital like Healthpeak to expand their footprint. Similarly, technology will reinforce and expand the need for lab space. AI and machine learning will increase the probability of success in drug research and reduce development timelines. This will drive more capital into the sector. The data needed for the algorithms and the validation comes from the laboratory, which are highly regulated in controlled environments.

A Nobel Laureate in chemistry recently said that she has run her lab for 30 years and never experienced the accelerating discoveries we've seen in just the last five years alone. The science is building on itself, including our understanding of genetics and improved testing, which will transform healthcare delivery. Today, it's reactive. We seek therapeutics after the problem arises. Technology will drive the addition to proactive care, we detect issues and seek care before a problem arises. This will shift the allocation of healthcare spending and expand the total pie. Our outpatient medical and lab buildings will be a critical part of this future.

A few comments on portfolio performance, starting with outpatient medical. We have an irreplaceable portfolio and deep relationships with leading health systems. More than half of our square footage is now leased directly to a health system, which is 2x the level from 20 years ago as business model has shifted toward outpatient care and we've become a partner of choice. I toured a number of our buildings in recent months and saw very active parking lots and lobbies, a great sign for current and future leasing. Our concentration in high growth markets like Dallas, Houston, Phoenix, Vegas, and Nashville, will benefit our portfolio for the next decade plus.

Moving to our lab business, where we have significant market share in key submarkets, a diversified tenant base and strong relationships. Biotech's have been doing what they should do in this environment, which is to conserve cash. So the default answer [Phonetic] has been to make due with the existing space. That mindset made perfect sense for the past few quarters, but will naturally run in cycles. Despite that backdrop, we had solid leasing activity, primarily with existing portfolio tenants, who accounted for 89% of year-to-date leasing. In each case, the broader market either isn't seeing the prospect or is it a big disadvantage because we can tear up an existing lease in exchange for a larger, longer-term commitment. More recently, we've seen an uptick in leasing discussions, which may reflect a more benign outlook for the Fed in interest rates.

I'll close with transactions, the market remains slow, given the financing markets and inactivity from core funds and non-traded REITs, many of which have reduction queues. Despite that backdrop, we sold $130 million of fully stabilized, but less core real estate year-to-date at an attractive 5.4% cap rate and used the proceeds to accretively delever. We're currently having good discussions on a couple of $100 million of additional less core asset sales, subject to closing, which isn't guaranteed in this environment, we'll have flexibility to either accretively pay down our line-of-credit or buyback stock.

I'll turn it to Pete, to cover financial results, balance sheet, and guidance."
"4","Peter Scott","Chief Financial Officer at Healthpeak Properties","Thanks, Scott. For the second quarter, we reported FFO as adjusted of $0.45 per share, AFFO of $0.40 per share, and total portfolio same-store growth of 4.8%. In addition, our Board declared a dividend of $0.30 per share, which equates to an AFFO payout ratio of approximately 75%.

Let me provide a little more color on segment performance. Starting with CCRCs. Same-store growth for the quarter was a very strong 19.3%. Occupancy has increased 230 basis points year-over-year, and we see additional upside was zero new supply in our markets. Total NREF cash receipts were $31 million in the quarter and for the full year, we expect our cash receipts to exceed and NREF amortization by $0.05 per share.

Turning to outpatient medical, we had another solid quarter with same-store growth of 2.5%. Demand for our space is high and leasing momentum remains strong. We have executed 83% of our full-year leasing budget and have an additional 15% in documentation. Re-leasing spreads were up 3.7% during the quarter, which again was at the high-end of our historical 2% to 4% range.

Trailing 12 month tenant retention was 81%, which is a reflection of the quality of our assets and our time-tested platform, which consistently produces sector-leading customer satisfaction scores. Finishing with lab, same-store growth for the quarter was 3.8%. Year-to-date, we have executed 461,000 square feet of leases, approximately 90% of that leasing activity has been with existing tenants and we achieved positive re-leasing spreads of 52% on renewals. In addition, we have another 196,000 square feet of executed LOIs with the majority of that activity occurring in July. All of our LOIs are with existing tenants, which further demonstrates the superior advantage that incumbent property owners like Healthpeak have in their respective markets.

With the biotech Index up 10% since the start of the second quarter, we are seeing an increase in tenant capital raising activity. Equity markets are open for companies with positive data readouts. Venture capital investment increased over $1 billion sequentially with Series A rounds growing more popular. M&A continues with $80 billion of deals announced year-to-date. The IPO market is showing signs of life and reverse mergers are becoming more popular, providing an alternative for companies to go public. An important part of our lab strategy is proactive asset management to improve our tenant credit profile.

As we have previously announced, we downsized Adverum in favor of Revolution Medicines, trading a small-cap credit for a $3 billion market cap company. During the second quarter, we backfilled the significant portion of the Kodiak space to Lonza Bioscience and Bicycle Therapeutics, in both cases a significant credit upgrade. And at the Cove, we proactively facilitated an assignment of Harpoon Therapeutics lease to a private biotech.

A quick note on Sorrento Therapeutics. We've been paid rent in full through July on the four operating leases, and we hold letters of credit or security deposits of $2.6 million. So no impact on 2023 earnings regardless of the outcome. As you've probably seen Sorrento is working on an exit financing package, but at this point there are no details I can provide or assurances, it will be completed. We hope to have clarity on a path forward in the near-term.

Turning now to our balance sheet. In May, we issued $350 million of 5.25% fixed-rate bonds, bringing year-to-date issuances to $750 million at a blended yield of approximately 5.35%. Our net floating rate debt balance was approximately $150 million at quarter end. Our balance sheet continues to be a competitive advantage in this environment. Our net-debt to EBITDA is 5.1 times. We have nearly $3 billion of liquidity. We have net floating rate debt exposure of approximately 2%. We have no bonds maturing until 2025. We have approximately $150 million of annual retained earnings and we have stable ratings from both S&P and Moody's. Our development spend is self-funded without the need for equity or asset sales from a combination of retained earnings and debt capacity from higher EBITDA. As Scott mentioned, any potential asset sales would be opportunistic and are not contemplated in guidance.

Turning now to our 2023 guidance. We are increasing our FFOs adjusted and AFFO guidance by $0.01 at the midpoints to $1.75 and $1.51 respectively. As you can see from our year-to-date results, performance across our portfolio remains strong and we are increasing our full year blended same-store guidance range by 25 basis points to 4% at the midpoint. Please refer to Page 38 of our supplemental, for additional detail on our guidance.

With that, operator, let's open the line for Q&A."
"5","Operator",NA,"Thank you. [Operator Instructions] And our first question comes from Juan Sanabria from BMO Capital Markets. Please go ahead."
"6","Juan Sanabria","Analyst at BMO Capital Markets","Good morning. Scott or Pete, I was just hoping you could talk a little bit more about the life science or lab market and the increase you've seen in demand in July. And how -- if you can maybe characterize or put a number around the increase in kind of opportunities or a number of companies looking for space for the amount of space being sought after by potential tenants and how and why that's changed?"
"7","Peter Scott","Chief Financial Officer at Healthpeak Properties","Yes. Hey Juan, it's Pete. Hope all is well. Maybe I would just start with that, and perhaps to Scott Bohn or Scott Brinker wants to add a little bit to it. But we talked about this earlier in the year that our tenant credit risk profile has been improving in the lab space. We also saw that sequentially this quarter as well. And I don't want to repeat a lot of what I said in my prepared remarks, but a lot of that improvement in the credit profile is because the capital markets are improving as well.

Just a couple of stats when you think about follow-on equity deals, you've had about $14 billion of deals get done year-to-date, tenants that have good data readouts or finding success raising capital. You look at the venture capital market, and that has improved, it's improved $1 billion sequentially. And in fact, we're seeing more Series A capital raises occur as well, which is important because that's really new company formation and that would be demand for new space for us.

M&A is strong. In fact, there was another M&A deal that got announced this morning. So that $80 billion is actually more like $87 billion at this point in time. And then reverse mergers are definitely popular right now. So it's a backward way of companies going public. We saw that in our portfolio with frequency merging with Corobio. So I'd say really that's what's driving the improved backdrop. Obviously, there's other things going on in each individual market. But we feel like things are trending in the right direction for us. And has certainly led to a little bit more leasing demand as you saw the LOIs that got signed in July, and we hope that, that's a harbinger for more to come in the next couple of quarters. But again, feeling a little bit better today than we did six months ago."
"8","Juan Sanabria","Analyst at BMO Capital Markets","And then just a follow-up question, just on the MOB guidance bump. What was the driver there? The second quarter seemed solid, but within, I guess, the typical range. So just curious on what drove the increased confidence there?"
"9","Thomas Klaritch","Chief Operating Officer at Healthpeak Properties","Juan, this is Tom. We continue to see positive operations at Medical City Dallas and that contributed about 90 basis points for the year and 50 basis points for the quarter. In addition, our escalators remain at that kind of 2.9%, 3% range. So that's driving results, and we continue to see rebounds in parking income where we're above our pandemic level reduction. So that continues to drive our results.

And as you said, the 2Q was really solid at 2.5%, and that was even with some headwinds against it. We had some -- a fairly high comp in 2Q of '22 at 4.5%, and that included some adjustments in rent abatements, and we had some positives to our expense reconciliation billings. So that had about a 70 basis point impact. We would have been at about 3.2% 2Q without those."
"10","Juan Sanabria","Analyst at BMO Capital Markets","Thank you, guys."
"11","Operator",NA,"The next question comes from Vikram Malhotra from Mizuho. Please go ahead."
"12","Vikram Malhotra","Analyst at Mizuho","Thanks for taking the questions. Just sort of building upon the Life Science comments you made. Can you just help us think about kind of the trajectory or the potential for Life Science -- your Life Science segment going into '24, not looking for a specific guide, but just looking for the sustainability given the bumps -- given that if leasing velocity remains as it is today. And you do have Amgen coming up, which I think is -- now is a known move-out. Let's assume you're not able to lease that up for the full year or it goes to redev. Can you just talk about sort of the potential of the segment, assuming trends remain as they are intact today?"
"13","Peter Scott","Chief Financial Officer at Healthpeak Properties","Yes. Hey, Vikram, it's Pete here. On the Amgen leases that you mentioned, the good news is we've actually backfilled a significant portion of those, and that's been a pretty known vacate for a while. I can't necessarily comment on the LOIs and specificity, but I think you guys see and understand where our leasing focus is right now. And obviously, re-leasing the Amgen space is an important focus of ours. But three of those buildings are currently leased today and don't have expirations until the end of this year or early next year. And we've always planned to redevelop those and really bring that campus up to a little bit of a better level, it's adjacent to the Cove there. So that's the Amgen portion of this.

I think just a couple of other things I wanted to point out, the mark-to-market we have talked about, we still feel good about the 20%-ish mark-to-market within our current portfolio. When you look at where market rents are versus in-place rents in the portfolio. That's obviously going to be a nice driver in the next couple of years, we believe, of some earnings growth. And the balance sheet is in great shape. Again, Sorrento, I can't really speak to that, but that could be a pretty big driver as we look at '23 relative to what '24 could look like. It's a pretty big number when you consider accepting the leases versus a liquidation there.

So I can't necessarily comment on 2024 much more than that at this point in time, but just to say that I think some of those big expirations, we've actually been working pretty hard on backfilling. And actually, and what we previously disclosed, we actually didn't have a lot of those Amgen leases getting leased up until 2025. Is there be some downtime and some capex associated with them."
"14","Scott Brinker","President and Chief Executive Officer at Healthpeak Properties","Hey, Vikram, and just, maybe a general comment on just the trajectory of lab leasing and rents. I mean, the last 18 months interest rates were up more than 500 basis points. Obviously, that has resulted in boards and management teams essentially saying not to expand real estate needs for the most part. The easy answer was just make do with existing space. But at the same time, you've got likely outlook where interest rates are probably going to come down over the next year or so and we are starting to see a little bit more interest in having those types of discussions.

And you think about the activity, we actually had over the last 18 months despite that change in interest rates, signed leases or LOI's on almost 2 million square feet of space, at strong rents, very modest TIs, 90% of that is with existing clients and pretty significant mark-to-markets. So really in the teeth of a pretty tough market over the last 18 months, I mean, we've had significant success, and we see the general macro environment, being more favorable over the next 12 to 18 months, not less favorable."
"15","Vikram Malhotra","Analyst at Mizuho","Yes. That makes sense. And just for my follow-up, Scott or maybe even Pete, just stepping back, this is a sort of a unique environment, where we don't know where rates are going. You've got, as you mentioned self-funded development, solid balance sheet. I'm just wondering are there bigger picture opportunities or changes to the portfolio you consider as we transition into whatever the next macro is? And just related to that, I guess, Pete, specifically, would you look at monetizing our assets, delevering even further to create that buffer, assuming there are opportunities down the road?"
"16","Scott Brinker","President and Chief Executive Officer at Healthpeak Properties","Yes. The answer is, yes. So we covered that in the prepared remarks. We are having those discussions. These are assets that others would find attractive, but aren't necessarily central to our longer-term strategy. But 100%, our expectation is that over the next 12, 18 months, I don't know if it's sooner, maybe later, our balance sheet, strong portfolio platform, efficient G&A. I mean, this will be a bigger company going forward, there will be opportunities coming out of this downturn in the lab segment, a lot of the development is underway is with owners that aren't as well connected to the tenant base, their balance sheets aren't nearly the same shape that ours is. So yes, there are going to be opportunities for us and our whole mindset right now is to weather through this downturn, which we have, I think, really well, controlling the things that we can continue to put up good earnings, balance sheet is in great shape. So yes, I think there's going to be a lot of opportunity on the other side of this."
"17","Vikram Malhotra","Analyst at Mizuho","Sorry, just to clarify, when you said you -- I might have missed it in the remarks. Did you mean potentially monetizing non-core and if you did, could you give us just a broad range, like how big is that opportunity for you?"
"18","Scott Brinker","President and Chief Executive Officer at Healthpeak Properties","Yes, it's a couple of $100 million that we're having discussions on. We haven't signed any contracts. So I don't want to talk about specific assets or pricing. But, obviously, we would only sell if we like the pricing, these are opportunistic. We don't need to sell any assets to fund our pipeline. So we'd only do this if we like the pricing. And our expectation is that the cap rates would allow us to repay our line of credit accretively, which gives us more flexibility down the road and we do see opportunities."
"19","Vikram Malhotra","Analyst at Mizuho","Great. Thank you."
"20","Scott Brinker","President and Chief Executive Officer at Healthpeak Properties","Yes."
"21","Operator",NA,"The next question comes from Austin Wurschmidt from KeyBanc. Please go ahead."
"22","Austin Wurschmidt","Analyst at KeyBanc Capital Markets","Yes, thanks, and good morning, everybody. With respect to the uptick in leasing discussions, is that just broadly across the portfolio or are you in active discussions as well for some of the vacant space in the -- across the development -- the active development projects?"
"23","Scott Bohn","Chief Development Officer and Co-Head of Lab at Healthpeak Properties","Yes, Austin, it's Scott Bohn. I would say it's across the entire portfolio, it's across all three core markets, and obviously, we have more space to lease in South San Francisco versus Boston, San Diego, just with where the occupancy of the portfolio stands. So, you'll see the bulk of it there. I mean, if you look at the LOIs, we've talked about today, two-thirds of those are for spaces in South San Francisco."
"24","Austin Wurschmidt","Analyst at KeyBanc Capital Markets","And then just a clarification on the leases, the 196,000 under LOI, I guess, how many leases are comprised in that? Is any of that for the active development? And when would you expect some of that to commence?"
"25","Scott Bohn","Chief Development Officer and Co-Head of Lab at Healthpeak Properties","Yes, Austin, we're not going to get into the individual LOIs today. It's just too early. I mean, these are obviously competitive deals, and we've got LOIs and signatures on those, but the -- we still need to get them across the finish lines to lease execution. So probably more to come on those next quarter."
"26","Austin Wurschmidt","Analyst at KeyBanc Capital Markets","Okay, fair. And then just last one from me, just going to MOBs a little bit, you touched on what drove the 2Q guidance bump. But last quarter, you referenced the company's track record, increasing MOB guidance through the year. Clearly, success doing that this quarter. But what levers are left to pull in the back half of the year that could get you or maybe said differently, could get you to the high-end of the range?"
"27","Thomas Klaritch","Chief Operating Officer at Healthpeak Properties","Well, we continue to see really good activity on leasing. We've got -- our lease commencements are a little bit above where we expected to be for the year, and we have quite a few executions -- executed leases as well as LOIs in place. So occupancy is going to be a piece of it. As I said earlier, the escalators and mark-to-market, we're at the upper end of our typical range on mark-to-market. So that's going to help some. And then Medical City continues to do well. And if they have another couple of strong quarters, that will definitely push us up to the higher end."
"28","Scott Brinker","President and Chief Executive Officer at Healthpeak Properties","Austin, we're also having what's interesting in both segments, lab and medical conversations with tenants or prospects about much bigger leases and spaces than we had over the last 18 months, it felt like a lot of the activity was smaller spaces. We'll see if anything, proceeds, but I think that's another sign that Boards and management teams are more willing to make big commitments today than they would have been over the past 18 months. Now I don't know any of that translates into 2023 earnings or same-store, but if you look forward into '24 and beyond, obviously, it's a great sign."
"29","Austin Wurschmidt","Analyst at KeyBanc Capital Markets","That's helpful. Thanks, Scott."
"30","Operator",NA,"The next question comes from Nick Yulico from Scotiabank. Please go ahead."
"31","Nicholas Yulico","Analyst at Scotiabank","Yes, thanks. Good morning. I guess first question is just in terms of -- as you think about the portfolio and some of the lease expirations and lab this year, next year. Is there any way to just quantify what piece of that you think are tenants that you expect to maybe not renew or those that you would proactively look to re-tenant, because of some potential credit issues or other factors kind of facing the tenant base? Just trying to understand like how we should think about some of the phasing of occupancy in the portfolio over the next year?"
"32","Thomas Klaritch","Chief Operating Officer at Healthpeak Properties","Roughly half of it is Oyster Point and Point Grand. So I assume that half of the remaining '23 and '24 lease maturities in lab are going into redevelopment, because of billings just need to be redeveloped to remain competitive. For the remaining 50%, maybe I'll ask Scott Bohn to comment?"
